978-4-003348-92-3,46216,2011/11/29,インカ皇統記　【二】,ｲﾝｶｺｳﾄｳｷ｢2｣,,,岩波文庫,,インカ・ガルシラーソ・デ・ラ・ベーガ．著／牛島　信明．訳,ｲﾝｶ･ｶﾞﾙｼﾗｰｿ･ﾃﾞ･ﾗ･ﾍﾞｰｶﾞ.ﾁｮ/ｳｼｼﾞﾏﾉﾌﾞｱｷ.ﾔｸ,,268.04,ﾍﾞ,2,岩波書店,2006,395,15,903,,インカの王女とスペイン人征服者との間に生まれたインカ・ガルシラーソ・デ・ラ・ベーガ（一五三九‐一六一六）によるインカ帝国の壮大な年代記。第二巻には、第四代から第八代までの王の事績と、太陽の神殿、婚姻、教育や土地の分配などの記述を収録。第四代インカ王のマイタ・カパックによるティアワナクの征服と、そこに見られた建物ハトゥンパカーサの服属とカック＝ヤウィーリの征服帰服したインディオたちが赦されたこと、ならびに伝説の解明三つの地方が服属し、他のいくつかの地方が征服されたこと、そして植民,件名（キーワード） インカ      [関連語] => アンデス文明,図書費,正文館書店,,文庫書架,,,２０１１．１１．１５,,False,,,,False,,,,False,True,False,,
978-4-003348-93-1,46217,2011/11/29,インカ皇統記　【三】,ｲﾝｶｺｳﾄｳｷ｢3｣,,,岩波文庫,,インカ・ガルシラーソ・デ・ラ・ベーガ．著／牛島　信明．訳,ｲﾝｶ･ｶﾞﾙｼﾗｰｿ･ﾃﾞ･ﾗ･ﾍﾞｰｶﾞ.ﾁｮ/ｳｼｼﾞﾏﾉﾌﾞｱｷ.ﾔｸ,,268.04,ﾍﾞ,3,岩波書店,2006,378,15,840,,インカの王女とスペイン人征服者との間に生まれたインカ・ガルシラーソ・デ・ラ・ベーガによるインカ帝国の壮大な年代記。第三巻では、第九代・第一〇代の王の支配と、金銀に飾られた王宮、太陽の大祭の様子等が描かれる。インカ皇統記の第六の書（王宮の建造とその装飾について；王宮を美しく飾るために、金と銀によって、ありとあるものが模造されていたこと；王宮で奉仕した召使いたちと、インカ王の輿を担いでいた者たちについて；集会所として用いられていた大広間、ならびに王宮のその他の様相について　ほか）インカ皇統,件名（キーワード） インカ      [関連語] => アンデス文明,図書費,正文館書店,,文庫書架,,,２０１１．１１．１５,,False,,,,False,,,,False,True,False,,
978-4-003348-94-9,46218,2011/11/29,インカ皇統記　【四】,ｲﾝｶｺｳﾄｳｷ｢4｣,,,岩波文庫,,インカ・ガルシラーソ・デ・ラ・ベーガ．著／牛島　信明．訳,ｲﾝｶ･ｶﾞﾙｼﾗｰｿ･ﾃﾞ･ﾗ･ﾍﾞｰｶﾞ.ﾁｮ/ｳｼｼﾞﾏﾉﾌﾞｱｷ.ﾔｸ,,268.04,ﾍﾞ,4,岩波書店,2006,418,15,903,,インカ帝国の全貌を記す壮大な年代記。最終巻には、インカの動植物の詳細な記録を収録。また、アタワルパとワスカルの二人の王子の抗争とスペイン人の来襲により、広大な版図を誇った帝国が滅亡に至るまでの混乱の日々が、帝国内部の目から静かに語られる。インカ皇統記の第八の書（ワクラチューク地方の征服と、その地方の名について；チャチャプーヤ地方の最初のいくつかの村の征服について；その他の町々や野蛮な部族の征服について；好戦的で、しかも頑固なインディオの住む三つの大きな地方の征服について　ほか）イン,件名（キーワード） インカ      [関連語] => アンデス文明,図書費,正文館書店,,文庫書架,,,２０１１．１１．１５,,False,,,,False,,,,False,True,False,,
978-4-003381-31-9,45814,2011/09/13,コーラン　【上】,ｺｰﾗﾝ｢ｼﾞｮｳ｣,,,岩波文庫,,井筒　俊彦．訳,ｲﾂﾞﾂﾄｼﾋｺ.ﾔｸ,,167.3,ｲﾄ,上,岩波書店,2002,360,15,660,,預言者マホメットの口を通して語られた神のことば―断続的に下された啓示を、第三代カリフ・オスマーンが集積・編纂させて聖典は成立した。以後、『コーラン』解釈の発展史がイスラーム文化史を形成してきたといえる。アラビア語原典からの口語訳。１　開扉―メッカ啓示、全七節２　牝牛―メディナ啓示、全二八七（二八六）節３　イムラーン一家―メディナ啓示、全二〇〇節４　女―メディナ啓示、全一七五（一七六）節５　食卓―メディナ啓示、全一二〇節６　家畜―メッカ啓示、全一六五節７　胸壁―メ,,寄付,,,文庫書架,,,２０１１．０９．１２,,False,,,,False,,,,False,True,False,,
978-4-003381-32-7,45815,2011/09/13,コーラン　【中】,ｺｰﾗﾝ｢ﾁｭｳ｣,,,岩波文庫,,井筒　俊彦．訳,ｲﾂﾞﾂﾄｼﾋｺ.ﾔｸ,,167.3,ｲﾄ,中,岩波書店,2002,306,15,660,,「コーラン」とは元来「読誦されるもの」の意とされる。朗々と声を上げて誦されるコーランの章句は、詩的韻律と音楽的な美をもって快く耳に響く。イスラーム世界に生きる人々の信仰生活のみならず、日々の実生活をも律する聖典の名訳。フード―メッカ啓示、全一二三節ユースフ（ヨセフ）―メッカ啓示、全一一一節雷鳴―メッカ啓示、全四三節イブラーヒーム（アブラハム）―メッカ啓示、全五二節アル・ヒジュル―メッカ啓示、全九九節蜜蜂―メッカ啓示、全一二八節夜の旅―メッカ啓示、全一一一節洞,,寄付,,,文庫書架,,,２０１１．０９．１２,,False,,,,False,,,,False,True,False,,
978-4-003381-33-5,45816,2011/09/13,コーラン　【下】,ｺｰﾗﾝ｢ｹﾞ｣,,,岩波文庫,,井筒　俊彦．訳,ｲﾂﾞﾂﾄｼﾋｺ.ﾔｸ,,167.3,ｲﾄ,下,岩波書店,2002,340,15,700,,『コーラン』各章の配列は、成立年代とはほぼ逆になっている。（下）に収められた初期（メッカ期）の啓示は、サジュウ体と呼ばれる独特の散文詩体で語られ、なまなましい緊迫感がみなぎる。強く激しいシャーマン的リズムの中に浮び上がる地獄の光景は圧倒的である。サバア―メッカ啓示、全五四節天使―メッカ啓示、全四五節ヤー・スィーン―メッカ啓示、全八三節整列者―メッカ啓示、全一八二節サード―メッカ啓示、全八八節群なす人々―メッカ啓示、全七五節信者―メッカ啓示、全八五節わかりやす,,寄付,,,文庫書架,,,２０１１．０９．１２,,False,,,,False,,,,False,True,False,,
978-4-003500-18-0,46191,2011/11/26,近代日本思想案内,ｷﾝﾀﾞｲﾆﾎﾝｼｿｳｱﾝﾅｲ,,,岩波文庫別冊　１４,,鹿野　政直,ｶﾉﾏｻﾅｵ,,121.6,ｶﾏ,,岩波書店,2008,393,15,735,,幕末維新から戦後まで近代日本100年の間に日本人によって生みだされた思想とそれを担った思想家について簡潔に記す近代日本思想入門．啓蒙思想からフェミニズムまで主な思想潮流とその主要な著作を紹介する．付・索引,,図書費,正文館書店,,文庫書架,,,２０１１．１１．１５,,False,,,,False,,,,False,True,False,,
978-4-003500-22-4,46192,2011/11/26,近代日本文学案内,ｷﾝﾀﾞｲﾆﾎﾝﾌﾞﾝｶﾞｸｱﾝﾅｲ,,,岩波文庫別冊　１９,,十川　信介,ﾄｶﾞﾜｼﾝｽｹ,,910.26,ﾄｼ,,岩波書店,2008,402,15,798,,（一）時代の主流を形成してきた立身出世の欲望、（二）現実社会に飽きたらぬ、またそこからこぼれ落ちた人びとが紡いだ別世界の願望、（三）新たに登場した交通機関、通信手段と文学との関わり―三つの切り口による近代日本文学の森の旅案内。１　「立身出世」物語―「故郷」と都会の往還（「勉強ハ安楽ノ基礎」；女は出世の妨げか；「恋愛」という観念　ほか）２　近代文学のなかの別世界―他界と異界のはなし（虚と実；露伴の「他界」；鏡花の「異界」　ほか）３　移動の時代―「交通」のはなし（人力車―挽く人と乗る人；疾,件名（キーワード） 日本文学--歴史--明治以後,図書費,正文館書店,,文庫書架,,,２０１１．１１．１５,,False,,,,False,,,,False,True,False,,
978-4-004312-74-1,45678,2011/06/30,平城京の時代／日本古代史④,ﾍｲｼﾞｮｳｷｮｳﾉｼﾞﾀﾞｲ/ﾆﾎﾝｺﾀﾞｲｼ4,,,岩波新書　１２７４　シリーズ日本古代史　４,,坂上　康俊,ｻｶｳｴﾔｽﾄｼ,,210.3,ﾆ,4,岩波書店,2011,253,18,861,,八世紀の日本は、国家のすみずみにまで統治を及ぼす大宝律令の施行で幕を開けた。つづく平城遷都、記紀の編纂など、唐を手本にした体制が整えられ、奈良の都に天平文化が花開く。ところがそこに襲う疫病の流行、皇位継承をめぐる争い…。揺れ動く時代を人々はどう生きたのか。天皇・貴族や人民の動向を、豊富な資料を駆使して描く。はじめに―平城京の時代はどう見られていたか第１章　律令国家の成立第２章　国家と社会の仕組み第３章　平城遷都第４章　聖武天皇と仏教第５章　古代社会の黄昏,日本 -- 歴史 -- 奈良時代∥ニホン -- レキシ -- ナラジダイ      →: 上位語: 日本 -- 歴史 -- 古代∥ニホン -- レキシ -- コダイ  ,図書費,白山商会,,新書書架,,,２０１１．０６．２９,,False,,,,False,,,,False,True,False,,
978-4-004312-75-8,45679,2011/06/30,平安京遷都／日本古代史⑤,ﾍｲｱﾝｷｮｳｾﾝﾄ/ﾆﾎﾝｺﾀﾞｲｼ5,,,岩波新書　１２７５　シリーズ日本古代史　５,,川尻　秋生,ｶﾜｼﾞﾘｱｷｵ,,210.3,ﾆ,5,岩波書店,2011,247,18,840,,権力争いの結果、予期せず皇位について桓武は、皇統の革新を強調すべく二度の遷都を行った。以後長らく日本の都として栄えることとなった平安京。その黎明期、いかなる文化が形成されたのか。天皇を中心とした統治システムの変遷や、最澄・空海による密教の興隆、また地方社会の変化にも目配りしつつ、武士誕生の時代までを描く。はじめに―平安時代を脱ぎ、着る明治天皇第１章　桓武天皇とその時代第２章　唐風化への道第３章　「幼帝」の誕生と摂政・関白の出現第４章　成熟する平安王朝第５章　唐の,日本 -- 歴史 -- 平安時代∥ニホン -- レキシ -- ヘイアンジダイ      →: 上位語: 日本 -- 歴史 -- 古代∥ニホン -- レキシ -- コダイ ,図書費,白山商会,,新書書架,,,２０１１．０６．２９,,False,,,,False,,,,False,True,False,,
978-4-004312-76-5,46396,2012/02/10,摂関政治／シリーズ日本古代史⑥,ｾｯｶﾝｾｲｼﾞ/ｼﾘｰｽﾞﾆﾎﾝｺﾀﾞｲｼ6,,,岩波新書　１２７６,,古瀬　奈津子,ﾌﾙｾﾅﾂｺ,,210.3,ﾆ,6,岩波書店,2011,244,18,840,,２１０．３７／我が世の栄華を満月にたとえた藤原道長。彼が他の貴族を圧倒する力を得たのはなぜか。『枕草子』『源氏物語』などすぐれた女房文学はなぜ生まれたのか。殿上人は、そして都の庶民は、どんな一年を送っていたのか。力をつける地方国司、武士の台頭、そして末法思想と浄土教の広がりなど、古代の終わりと中世への胎動を描く。はじめに―藤原道長の「我が世」とは第１章　摂政・関白制度の誕生第２章　道長がつくった時代第３章　「殿上人」の世界第４章　ひろがりゆく「都市」と「地方」,日本--歴史--平安時代,図書費,白山商会,,新書書架,,,２０１２．０２．１０,,False,,,,False,,,,False,True,False,,
978-4-004313-09-0,45680,2011/06/29,日本の食糧が危ない,ﾆﾎﾝﾉｼｮｸﾘｮｳｶﾞｱﾌﾞﾅｲ,,,岩波新書　１３０９,,中村　靖彦,ﾅｶﾑﾗﾔｽﾋｺ,,611.3,ﾅﾔ,,岩波書店,2011,234,18,798,,日本経済の見通しが不透明な中で、中国を始めとする新興国の需要増等で穀物価格が高騰し、食糧不足が目前に迫っている。輸入大国日本はこのままでいいのか？農政の目玉政策といわれる「戸別所得補償制度」や自給率向上のための飼料用コメの開発について検証しながら、ＴＰＰへの対処など真の食糧安保のために必要な政策を提言する。序章　野菜畑は中国人ばかり第１章　戸別所得補償制度と日本農業第２章　試論・農地は公有化すべし第３章　食料自給率論争の不毛第４章　世界の食を呑み込む中国第５章　鍵は餌に,食糧問題 -- 日本∥ショクリョウモンダイ -- ニホン,図書費,白山商会,,新書書架,,,２０１１．０６．２９,,False,,,,False,,,,False,True,False,,
978-4-004313-10-6,45681,2011/06/29,次世代インターネットの経済学,ｼﾞｾﾀﾞｲｲﾝﾀｰﾈｯﾄﾉｹｲｻﾞｲｶﾞｸ,,,岩波新書　１３１０,,依田　高典,ｲﾀﾞﾀｶﾉﾘ,,694.21,ｲﾀ,,岩波書店,2011,237,18,798,,世界一速くて安いブロードバンドを持ちながら、なぜ日本ではグーグルやアマゾンのような企業があらわれないのか。「コンテンツ」、「通信ネットワーク」、熾烈な競争が繰り広げられる「プラットフォーム」の三層構造を踏まえ、世界を席巻しているビジネスモデルを解き明かす。情報通信産業の課題も検討、ブロードバンド立国への道を提言する。序　日本のインターネットは、いま第１章　無料モデルの誘惑―デジタル・コンテンツの経済学第２章　世界一のブロードバンド―ネットワークの経済学第３章　クラウド化する,電気通信 -- 日本∥デンキツウシン -- ニホン ブロードバンド      →: 下位語: ワイヤレスブロードバンド      →: 関連語: データ伝送∥データデンソウ  ,図書費,白山商会,,新書書架,,,２０１１．０６．２９,,False,,,,False,,,,False,True,False,,
978-4-004313-11-3,45682,2011/06/29,赤ちゃんの不思議,ｱｶﾁｬﾝﾉﾌｼｷﾞ,,,岩波新書　１３１１,,関　一夫,ｾｷｶｽﾞｵ,,376.11,ｾｶ,,岩波書店,2011,197,18,756,,無邪気な笑顔で周囲を魅了する赤ちゃん。脳科学・認知科学の研究が進むにつれ、その驚くべき能力が明らかになってきた。生まれた直後に母親を認識できるのか。テレビやロボットはどう捉えているのか。早期教育は有効なのか…。「赤ちゃん学」の最新の知見を紹介し、激変する養育環境が、乳児の発達にどう影響するのかについて論考する。第１章　赤ちゃん学の誕生第２章　こんなものが好き、こんなものは嫌い第３章　「心」を読む私の「こころ」第４章　「わたし」はいつから「私」なのか―自己の発見,乳児∥ニュウジ      →: 上位語: 年齢集団∥ネンレイシュウダン      →: 下位語: 未熟児∥ミジュクジ      →: 下位語: 新生児∥シンセイジ      →: 関連語: 栄養障害(乳児)∥エイヨウショウガイ(ニュウジ)      →: 関連語: 育児∥イクジ      →: 関連語: 授乳∥ジュニュウ      →: 関連語: 嬰児殺し∥エイジゴロシ      →: 関連語: 乳児保育∥ニュウジホイク      →: 関連語: 洋裁(子供服)∥ヨウサ,図書費,白山商会,,新書書架,,,２０１１．０６．２９,,False,,,,False,,,,False,True,False,,
978-4-004313-12-0,45683,2011/06/29,大震災のなかで／私たちは何をすべきか,ﾀﾞｲｼﾝｻｲﾉﾅｶﾃﾞ/ﾜﾀｼﾀﾁﾊﾅﾆｦｽﾍﾞｷｶ,,,岩波新書　１３１２,,内橋　克人．編,ｳﾁﾊｼｶﾂﾄ.ﾍﾝ,,369.31,ｳｶ,,岩波書店,2011,261,18,861,,二〇一一年三月一一日、東日本を襲った大震災は、何を問いかけているのか。大きな悲しみや喪失感のなかで新しい歩みを始めてゆかねばならない被災者・被災地に、私たちはどう向き合い、どんな支援をしていったらよいのだろうか。現地で活動を続けた医師やボランティアをはじめ、作家や学者ら三三名が震災の意味、復興の形をつづる。１　３・１１は何を問うているのか（私らは犠牲者に見つめられている―ル・モンド紙フィリップ・ポンス記者の問いに（大江健三郎）（私たちが知る）日本の終わりなのか？（テッサ・モーリス＝,東日本大震災(2011)∥ヒガシニホン ダイシンサイ (2011)      →: 関連語: 福島第一原発事故(2011)∥フクシマ ダイイチ ゲンパツ ジコ (2011)  災害復興 -- 日本∥サイガイ フッコウ -- ニホン  ,図書費,白山商会,,新書書架,,,２０１１．０６．２９,,False,,,,False,,,,False,True,False,,
978-4-004313-13-7,45684,2011/06/29,教科書の中の宗教／この奇妙な実態,ｷｮｳｶｼｮﾉﾅｶﾉｼｭｳｷｮｳ/ｺﾉｷﾐｮｳﾅｼﾞｯﾀｲ,,,岩波新書　１３１３,,藤原　聖子,ﾌｼﾞﾜﾗｻﾄｺ,,371.6,ﾌｻ,,岩波書店,2011,231,18,840,,公教育は政教分離をとうに踏み越えていた？なぜ誰も気づかなかったのか？「中立・客観」的であると信じられている教科書の知られざる記述を仔細に検証する。海外での論争や試行錯誤も豊富に紹介。国際理解のための、そして自ら考えるための宗教教育とはどうあるべきか。そもそも中立的に宗教を語ることは可能なのか。１章　教科書が推進する宗教教育―日本は本当に政教分離か２章　なぜ宗派教育的なのか３章　教科書が内包する宗教差別４章　なぜ偏見・差別が見逃されてきたのか５章　海外の論争と試行錯誤,宗教教育∥シュウキョウキョウイク      →: 上位語: 情操教育∥ジョウソウキョウイク      →: 下位語: キリスト教教育∥キリストキョウキョウイク      →: 下位語: 仏教教育∥ブッキョウ キョウイク      →: 関連語: 宗教と教育∥シュウキョウトキョウイク  ,図書費,白山商会,,新書書架,,,２０１１．０６．２９,,False,,,,False,,,,False,True,False,,
978-4-004313-14-4,45685,2011/06/29,感染症と文明／共生への道,ｶﾝｾﾝｼｮｳﾄﾌﾞﾝﾒｲ/ｷｮｳｾｲﾍﾉﾐﾁ,,,岩波新書　１３１４,,山本　太郎,ﾔﾏﾓﾄﾀﾛｳ,,493.8,ﾔﾀ,,岩波書店,2011,210,18,756,,感染症との闘いは人類に勝利をもたらすのか。防疫による封じ込めは、大きな悲劇の準備にすぎないのか。共生の道はあるのか。感染症と人類の関係を文明の発祥にさかのぼって考察し、社会が作り上げてきた流行の諸相を描き出す。共生とは理想的な均衡ではなく、心地よいとはいえない妥協の産物ではないのだろうか。プロローグ　島の流行が語ること第１章　文明は感染症の「ゆりかご」であった第２章　歴史の中の感染症第３章　近代世界システムと感染症―旧世界と新世界の遭遇第４章　生態学から見た近代,感染症 -- 歴史∥カンセンショウ -- レキシ,図書費,白山商会,,新書書架,,,２０１１．０６．２９,,False,,,,False,,,,False,True,False,,
978-4-004313-15-1,45755,2011/09/01,原発を終わらせる,ｹﾞﾝﾊﾟﾂｦｵﾜﾗｾﾙ,,,岩波新書　１３１５,,石橋　克彦．編,ｲｼﾊﾞｼｶﾂﾋｺ.ﾍﾝ,,543.5,ｲｶ,,岩波書店,2011,231,18,840,,内容細目     福島第一原発事故 原発で何が起きたのか / 田中三彦著  内容細目     事故はいつまで続くのか / 後藤政志著  内容細目     福島原発避難民を訪ねて / 鎌田遵著  内容細目     原発の何が問題か-科学・技術的側面から 原発は不完全な技術 / 上澤千尋著  内容細目     原発は先の見えない技術 / 井野博満著  内容細目     原発事故の災害規模 / 今中哲二著  内容細目     地震列島の原発 / 石橋克彦著  内容細目     原発の,原子力発電∥ゲンシリョクハツデン      →: 上位語: 発電∥ハツデン      →: 上位語: 原子力産業∥ゲンシリョクサンギョウ      →: 関連語: 原子力平和利用∥ゲンシリョクヘイワリヨウ      →: 関連語: 原子力発電所∥ゲンシリョクハツデンショ      →: 関連語: 原子力∥ゲンシリョク,図書費,白山商会,,新書書架,,,２０１１．０９．０１,,False,,,,False,,,,False,True,False,,
978-4-004313-16-8,45756,2011/09/01,人間と国家　【上】／ある政治学徒の回想,ﾆﾝｹﾞﾝﾄｺｯｶ｢ｼﾞｮｳ｣/ｱﾙｾｲｼﾞｶﾞｸﾄﾉｶｲｿｳ,,,岩波新書　１３１６,,坂本　義和,ｻｶﾓﾄﾖｼｶｽﾞ,,289.1,ｻﾖ,上,岩波書店,2011,220,18,840,,現代に生きる人間は、国家とどう向き合い、自分のアイデンティティをどのように考えていくべきか。その問いと格闘してきた国際政治学者の軌跡。上巻は、上海で戦争を経験した少年時代、生き方に悩む青年時代、やがて学問と出会い、アメリカ留学を経て、冷戦・核時代のなかで平和問題に取り組み、社会的発言を繰り広げてゆくまで。第１章　父母のこと、そして上海時代第２章　少年時代第３章　戦争と一高時代第４章　戦後の一高時代第５章　研究者への道第６章　アメリカ留学第７章　平和問題への取り組,,図書費,白山商会,,新書書架,,,２０１１．０９．０１,,False,,,,False,,,,False,True,False,,
978-4-004313-17-5,45757,2011/09/01,人間と国家　【下】／ある政治学徒の回想,ﾆﾝｹﾞﾝﾄｺｯｶ｢ｹﾞ｣/ｱﾙｾｲｼﾞｶﾞｸﾄﾉｶｲｿｳ,,,岩波新書　１３１７,,坂本　義和,ｻｶﾓﾄﾖｼｶｽﾞ,,289.1,ｻﾖ,下,岩波書店,2011,248,18,840,,現代に生きる人間は、国家とどう向き合い、自分のアイデンティティをどのように考えていくべきか。その問いと格闘してきた国際政治学者の軌跡。下巻は、東大紛争との関わり、世界の知識人たちとの共同研究や交流、アジアと日本をめぐる諸問題への取り組み、そして冷戦終結から東日本大震災まで。人間の未来へのメッセージに満ちた回想録。東大紛争国際的な共同研究国連と国際会議アジアとの対話日本社会への訴え冷戦終焉と二一世紀現代に生きる人間は，国家とどう向き合い，自分のアイデンティ,,図書費,白山商会,,新書書架,,,２０１１．０９．０１,,False,,,,False,,,,False,True,False,,
978-4-004313-18-2,45758,2011/09/01,大学とは何か,ﾀﾞｲｶﾞｸﾄﾊﾅﾆｶ,,,岩波新書　１３１８,,吉見　俊哉,ﾖｼﾐｼｭﾝﾔ,,377,ﾖｼ,,岩波書店,2011,264,18,861,,いま、大学はかつてない困難な時代にある。その危機は何に起因しているのか。これから大学はどの方向へ踏み出すべきなのか。大学を知のメディアとして捉え、中世ヨーロッパにおける誕生から、近代国家による再生、明治日本への移植と戦後の再編という歴史のなかで位置づけなおす。大学の理念の再定義を試みる画期的論考。序章　大学とは何か第１章　都市の自由　大学の自由第２章　国民国家と大学の再生第３章　学知を移植する帝国第４章　戦後日本と大学改革終章　それでも、大学が必要だ,大学∥ダイガク      →: 上位語: 学校∥ガッコウ      →: 下位語: 短期大学∥タンキダイガク      →: 下位語: 公開大学∥コウカイダイガク      →: 下位語: 私立大学∥シリツダイガク      →: 下位語: 国立大学∥コクリツ ダイガク      →: 下位語: 公立大学∥コウリツ ダイガク      →: 関連語: 大学病院∥ダイガクビョウイン      →: 関連語: 大学経営∥ダイガクケイエイ      →: 関連語: 大学の自治,図書費,白山商会,,新書書架,,,２０１１．０９．０１,,False,,,,False,,,,False,True,False,,
