978-4-395012-39-8,46223,2011/11/29,人間と建築／デザインおぼえがき【復刻版】,ﾆﾝｹﾞﾝﾄｹﾝﾁｸ/ﾃﾞｻﾞｲﾝｵﾎﾞｴｶﾞｷ｢ﾌｯｺｸﾊﾞﾝ｣,,,,,丹下　健三,ﾀﾝｹﾞｹﾝｿﾞｳ,,520.4,ﾀｹ,,彰国社,2011,311,19,2415,,１　建築家論２　現代建築と芸術３　現実と創造４　技術と人間５　機能と空間６　設計の経験著者紹介丹下健三［タンゲケンゾウ］１９１３年、大阪府生まれ。１９３５年、東京帝国大学（現・東京大学）工学部建築科卒業後、前川國男建築事務所に入所。１９４２年、大東亜建設記念営造計画設計競技に１等入選。１９４９年、東京大学大学院を修了後、同大学建築科助教授に就任。１９５１年、ＣＩＡＭに招かれ、ロンドンで広島計画を発表。１９６１年、丹下健三・都市・建築設計研究所を設立。１９６３年、東京大学,件名（キーワード） 建築      [関連語] => 建築家[関連語] => 建築構造[関連語] => 建築物[関連語] => 建築研究[関連語] => 建築儀礼[関連語] => 建築計画[関連語] => 廃墟[関連語] => 築城[関連語] => 建築設計[関連語] => 建築施工法[関連語] => 建築経済[上位語] => 美術[下位語] => 建築 (西洋)[下位語] => 建築 (イスラム)[下位語] => 建築 (東洋)[下位語] ,図書費,正文館書店,,,,,２０１１．１１．１５,,False,,,,False,,,,False,True,False,,
978-4-396112-51-6,45926,2011/10/06,悲しみの効用,ｶﾅｼﾐﾉｺｳﾖｳ,,,,,五木　寛之,ｲﾂｷﾋﾛﾕｷ,,914.6,ｲﾋ,,祥伝社,2011,221,18,1200,,未知の時代を乗り超える反常識のすすめ。第１章　悲しみの効用第２章　世辞の効用第３章　ボケの効用第４章　ホラの効用第５章　おしゃべりの効用第６章　病の効用第７章　マンネリの効用第８章　鬱の効用著者紹介五木寛之［イツキヒロユキ］１９３２年（昭和７年）福岡県生まれ。生後間もなく朝鮮にわたり、戦後引揚げ。早稲田大学中退。６６年『さらばモスクワ愚連隊』で第６回小説現代新人賞、６７年『蒼ざめた馬を見よ』で第５６回直木賞、７６年『青春の門　筑豊編』ほかで第１０回吉,,図書費,ＴＳＵＴＡＹＡ多治見インター店,,,,,２０１１．０９．３０,,False,,,,False,,,,False,True,False,,
978-4-396633-74-5,46243,2011/11/30,ぼくらは夜にしか会わなかった,ﾎﾞｸﾗﾊﾖﾙﾆｼｶｱﾜﾅｶｯﾀ,,,,,市川　拓司,ｲﾁｶﾜﾀｸｼﾞ,,913.6,ｲﾀ,,祥伝社,2011,306,20,1575,,部分タイトル 白い家 / 市川拓司 著 部分タイトル スワンボートのシンドバッド / 市川拓司 著 部分タイトル ぼくらは夜にしか会わなかった / 市川拓司 著 部分タイトル 花の呟き / 市川拓司 著 部分タイトル 夜の燕 / 市川拓司 著 部分タイトル いまひとたび、あの微笑みに / 市川拓司 著 ／憶えていてね、と彼女は言った。忘れないで。―美しく純粋な魂が奏でる、せつない祈りに満ちた純愛小説集。著者紹介市川拓司［イチカワタクジ］１９６２年生まれ。東京,,図書費,正文館書店,,,,,２０１１．１１．１５,,False,,,,False,,,,False,True,False,,
978-4-396633-75-2,46306,2011/12/06,陣星、翔る,ｲｸｻﾎｼ､ｶｹﾙ,,,,,宮本　昌孝,ﾐﾔﾓﾄﾏｻﾀｶ,,913.6,ﾐﾏ,,祥伝社,2011,364,20,1785,,部分タイトル 鵺と麝香と鬼丸と / 宮本昌孝 著 部分タイトル 死者への陣借り / 宮本昌孝 著 部分タイトル 女弁慶と女大名 / 宮本昌孝 著 部分タイトル 勝鬨姫始末 / 宮本昌孝 著 部分タイトル 木阿弥の夢 / 宮本昌孝 著 将軍足利義輝より百万石に値すると激賞された、天下無双の武人、魔羅賀平助。刃渡り四尺の大太刀と傘鎗という武器を携える彼を、人は「陣借り平助」と呼ぶ。桶狭間、川中島など天下に聞こえる戦いで第一の大手柄を挙げたという強者だが、白米が大好物で女子には弱い。,,図書費,正文館書店,,,,,２０１１．１１．１５,,False,,,,False,,,,False,True,False,,
978-4-396633-76-9,46284,2011/12/02,花明かり／深川駕籠,ﾊﾅｱｶﾘ/ﾌｶｶﾞﾜｶｺﾞ,,,,,山本　一力,ﾔﾏﾓﾄｲﾁﾘｷ,,913.6,ﾔｲ,,祥伝社,2011,382,20,1890,,部分タイトル 花明かり / 山本一力 著 部分タイトル 菖蒲の湯 / 山本一力 著 世の中は三日見ぬ間に桜かな…深川大横川沿いの桜並木は満開を迎えようとしていた。駕篭舁きの新太郎と尚平の暮らす木兵衛店も総出で明日の花見の仕度に忙しい。その日の昼、二人は坂本村の庄兵衛とその妻およねに知り合う。およねは足の自由が利かず余命わずかなことを自覚していた。「大好きな桜をもう一度見たいのです」。およねの望みに新太郎たちは夫婦を花見に招待する。翌日、およねを乗せて大横川に向かう新太郎たち,,図書費,正文館書店,,,,,２０１１．１１．１５,,False,,,,False,,,,False,True,False,,
978-4-398691-01-9,45813,2011/09/13,東日本大震災　復興支援地図,ﾋｶﾞｼﾆﾎﾝﾀﾞｲｼﾝｻｲﾌｯｺｳｼｴﾝﾁｽﾞ,,,地図,,昭文社,ｼｮｳﾌﾞﾝｼｬ,,291.2,ｼ,,昭文社,2011,72,37,1000,,沿岸地域本図主要都市拡大図広域図東北・関東地方図町名索引施設索引避難所索引,,図書費,正文館書店,,,,,２０１１．０９．１２,,False,,,,False,,,,False,True,False,,
978-4-404040-63-3,45742,2011/08/29,ナポレオン／ヨーロッパを制覇した皇帝とボナパルト家の人々,ﾅﾎﾟﾚｵﾝ/ﾖｰﾛｯﾊﾟｦｾｲﾊｼﾀｺｳﾃｲﾄﾎﾞﾅﾊﾟﾙﾄｹﾉﾋﾄﾋﾞﾄ,,,ビジュアル選書,ﾋﾞｼﾞｭｱﾙｾﾝｼｮ,新人物往来社．編,ｼﾝｼﾞﾝﾌﾞﾂｵｳﾗｲｼｬ.ﾍﾝ,,289.3,ｼ,,新人物往来社,2011,143,21,1890,,ヨーロッパが、皇帝と大陸軍にひれ伏す。風雲児ナポレオン、激越なる生涯と戦い。第１部　ナポレオン５１年の生涯（故郷を失った貧乏貴族；革命政府の暗闘；無敵の皇帝　ほか）第２部　ナポレオン戦記（トゥーロン攻囲戦；第一次イタリア遠征；エジプト遠征　ほか）第３部　ボナパルト一族とナポレオンをめぐる人々（独立に燃えた父と零落の息子を支えた母―シャルル／レティツィア；覇業の手駒となった兄弟たち―ジョゼフ／リュシアン／ルイ／ジェローム；兄の権力に踊らされた妹たち―ポーリーヌ／カロリーヌ／エリザ　ほ,,図書費,正文館書店,,,,,２０１１．０８．２４,,False,,,,False,,,,False,True,False,,
978-4-404040-87-9,46261,2011/12/01,乱世に挑戦した男　平清盛,ﾗﾝｾﾆﾁｮｳｾﾝｼﾀｵﾄｺﾀｲﾗﾉｷﾖﾓﾘ,,,,,岩田　慎平,ｲﾜﾀｼﾝﾍﾟｲ,,289.1,ｲｼ,,新人物往来社,2011,239,19,1575,,平清盛とは？平安時代末、白河院の落胤として生をうけた清盛。忠盛の嫡男として育てられた清盛は着々と昇進、武家としてはじめて太政大臣となった。武士として貴族社会をきりひらいた男のおおいなる挑戦―。第１部　なぜ清盛は武士として頭角をあらわすことができたのか（清盛の出生；伊勢平氏―清盛登場の前提；平忠盛―清盛の父として；清盛の兄弟たち；清盛の妻子たち；若き日の清盛―院近臣家の子息として；祇園乱闘事件の処分；保元の乱；大蔵合戦；保元の乱の顛末；保元の乱の背景；新たな争乱の種；保元の乱後の平氏,件名（キーワード） 平清盛1118-1181,図書費,正文館書店,,,,,２０１１．１１．１５,,False,,,,False,,,,False,True,False,,
978-4-405107-02-1,46124,2011/11/22,社会心理学／歴史に残る心理学実験から現代の学際的研究まで,ｼｬｶｲｼﾝﾘｶﾞｸ/ﾚｷｼﾆﾉｺﾙｼﾝﾘｶﾞｸｼﾞｯｹﾝｶﾗｹﾞﾝﾀﾞｲﾉｶﾞｸｻｲﾃｷｹﾝｷｭｳﾏﾃﾞ,,,カラー版徹底図解,ｶﾗｰﾊﾞﾝﾃｯﾃｲｽﾞｶｲ,山岸　俊男,ﾔﾏｷﾞｼﾄｼｵ,,361.4,ﾔﾄ,,新星出版社,2011,191,21,1680,,第１章　社会心理学とは？第２章　社会心理学の歴史的な実験第３章　社会の中の個人第４章　対人認知と行動第５章　集団の中の人間第６章　文化と人間の心理第７章　社会現象・社会問題の心理著者紹介山岸俊男［ヤマギシトシオ］名古屋市生まれ。一橋大学社会学部卒、同大学社会学研究科博士課程修了。ワシントン大学Ｐｈ．Ｄ．。北海道大学文学部助教授、ワシントン大学社会学部助教授、北海道大学教授を経て、北海道大学特任教授・名誉教授。専門は社会心理学。信頼、協力、利他などの心の社会性に関する,件名（キーワード） 社会心理学      [上位語] => 社会学[上位語] => 心理学[下位語] => 組織心理学[下位語] => グループダイナミックス[下位語] => 権力[下位語] => コミュニティ心理学[関連語] => 群集[関連語] => 民族心理学[関連語] => 社会的相互作用,図書費,正文館書店,,,,,２０１１．１１．０１,,False,,,,False,,,,False,True,False,,
978-4-408411-59-0,46366,2011/12/14,乙女の秘術史　日本編,ｵﾄﾒﾉﾋｼﾞｭﾂｼﾆﾎﾝﾍﾝ,,,,,堀江　宏樹／滝乃　みわこ,ﾎﾘｴﾋﾛｷ/ﾀｷﾉﾐﾜｺ,,702.1,ﾎﾋ,,実業之日本社,2011,223,19,1470,,古代から現代まで日本の乙女アート再発見。第１章　古代・中世（キレイなお父さんは心配性―『阿修羅像』；仏像のセクシュアリティ―『弥勒菩薩半跏思惟像』『薬師三尊像』；人気のために「脱いだ」女神―『吉祥天像』『江ノ島弁才天』　ほか）第２章　近世（武力でなく、文化で反旗を翻した男―古田織部；リメイクされつづけた『風神雷神図』―俵屋宗達・尾形光琳・酒井抱一；「萌え絵」はここからはじまった―菱川師宣・鈴木春信　ほか）第３章　近現代（伝説の花魁を泣かした『美人』の絵―高橋由一；名もなき母へ捧げた東洋,件名（キーワード） 美術 (日本)--歴史,図書費,正文館書店,,,,,２０１１．１２．１３,,False,,,,False,,,,False,True,False,,
978-4-408411-60-6,46367,2011/12/14,乙女の秘術史　世界編,ｵﾄﾒﾉﾋｼﾞｭﾂｼｾｶｲﾍﾝ,,,,,堀江　宏樹／滝乃　みわこ,ﾎﾘｴﾋﾛｷ/ﾀｷﾉﾐﾜｺ,,702,ﾎﾋ,,実業之日本社,2011,239,19,1470,,古代から現代まで世界中の「美」は乙女のために。第１章　古代・中世（夫婦の仲は永遠に―エジプト『ネフェルティティ胸像』；本当はコワい「テルマエ・ロマエ」―ローマの大理石彫刻；ツボや皿に同性愛アートが！？―ギリシャの陶芸　ほか）第２章　近世（超ナルシストな元・美少年―ダ・ヴィンチ；筋肉大好きのだめんず・うぉ～か～―ミケランジェロ；空虚さを美に変えた「おひとりさま男」―ボッティチェリ　ほか）第３章　近現代（『裸のマハ』はスペイン宮廷一の女傑？―ゴヤ；慰みモノになっても、めげない「乙女の誇り」,件名（キーワード） 美術--歴史,図書費,正文館書店,,,,,２０１１．１２．１３,,False,,,,False,,,,False,True,False,,
978-4-408535-94-4,46109,2011/11/22,任侠病院,ﾆﾝｷｮｳﾋﾞｮｳｲﾝ,,,,,今野　敏,ｺﾝﾉﾋﾞﾝ,,913.6,ｺﾋﾞ,,実業之日本社,2011,366,20,1680,,日村誠司が代貸を務める阿岐本組は、東京下町で長年ちっぽけな所帯を持っている。堅気に迷惑をかけない正統派ヤクザであったが、地元新住民の間から暴力団追放運動が起こってきた。そんなおり、組長の阿岐本雄蔵が、潰れかけた病院の監事となって再建を引き受けることになった。暗い雰囲気の院内、出入り業者のバックには関西大物組織の影もある。再建先と地元、難題を二つ抱え込んだ阿岐本組。病院の理事もさせられた日村は、組の最大の危機を乗り切れるのか―。著者紹介今野敏［コンノビン］１９５５年北,,図書費,正文館書店,,,,,２０１１．１１．０７,,False,,,,False,,,,False,True,False,,
978-4-408535-96-8,46074,2011/11/20,こなもん屋馬子,ｺﾅﾓﾝﾔｳﾏｺ,,,,,田中　啓文,ﾀﾅｶﾋﾛﾌﾐ,,913.6,ﾀﾋ,,実業之日本社,2011,298,19,1575,,内容細目   豚玉のジョー / 田中啓文著  内容細目   たこ焼きのジュン / 田中啓文著  内容細目   おうどんのリュウ / 田中啓文著  内容細目   焼きそばのケン / 田中啓文著  内容細目   マルゲリータのジンペイ / 田中啓文著 　　謎のレシピでお悩み解決。大阪発Ｂ級グルメミステリー。著者紹介田中啓文［タナカヒロフミ］１９６２年大阪府生まれ。神戸大学卒。９３年『凶の剣士』で第２回ファンタジーロマン大賞に佳作入選し、『背徳のレクイエム』と改題・刊行し,,図書費,正文館書店,,,,,２０１１．１１．０７,,False,,,,False,,,,False,True,False,,
978-4-411040-13-8,46282,2011/12/02,語りかける山,ｶﾀﾘｶｹﾙﾔﾏ,,,,,飯田　年穂,ｲｲﾀﾞﾄｼﾎ,,786.1,ｲﾄ,,駿河台出版社,2011,316,20,2415,,山を愛した人たちの言葉を拾いながら、人間と山の関わりを見つめて行く山岳エッセイ。ヨーロッパと日本の山岳文化の違いから、古今東西の文学作品、文章を読みとく。サンライズ・サンセット高い山・深い山滑るのが好き・転ぶのが好き山の先生・山の案内人バーチャル人間・生身の人間楽しみますか・苦しみますかガイドレス・ガイドブックレス岩に踊れば・岩に唄えば登りたいから・護りたいから女だてらに・男だてらに〔ほか〕著者紹介飯田年穂［イイダトシホ］１９４８年、東京,件名（キーワード） 登山      [関連語] => 山岳[関連語] => 高山病[関連語] => ワンダーフォーゲル[関連語] => 山岳遭難[下位語] => ロッククライミング[下位語] => 沢登り,図書費,正文館書店,,,,,２０１１．１１．１５,,False,,,,False,,,,False,True,False,,
978-4-413038-09-6,45786,2011/09/12,麹の「生きた力」を引き出す本,ｺｳｼﾞﾉ｢ｲｷﾀﾁｶﾗ｣ｦﾋｷﾀﾞｽﾎﾝ,,,,,伏木　暢顕／小石原　はるか,ﾌｼｷﾉﾌﾞｱｷ/ｺｲｼﾊﾗﾊﾙｶ,,596,ﾌﾉ,,青春出版社,2011,150,19,1365,,酵素たっぷりの野菜の漬物、旨味の凝縮した肉・魚の保存食、天然の調味料、お手軽スイーツ。美味しくて体にやさしい甘酒と塩麹の“本当”の使い方を教えます。第１章　麹の力を生かすなら“なま”が大原則―その「甘酒」と「塩麹」の使い方、菌の力が死んでいます第２章　日本の食文化は、麹から始まった―味噌、醤油、納豆、漬物…知れば知るほど奥が深い、発酵の世界第３章　“醸す”ほどに、栄養価アップ！消化もスムーズ！―麹で酵素を補って、体の中から健康になる、ストレスにも強くなる第４章　「甘酒」の生きた,,図書費,正文館書店,,,,,２０１１．０９．１２,,False,,,,False,,,,False,True,False,,
978-4-413038-12-6,45944,2011/10/07,がんもうつもありがとう！と言える生き方,ｶﾞﾝﾓｳﾂﾓｱﾘｶﾞﾄｳ!ﾄｲｴﾙｲｷｶﾀ,,,,,音無　美紀子,ｵﾄﾅｼﾐｷｺ,,778.21,ｵﾐ,,青春出版社,2011,204,19,1470,,家族の「あのひと言」がなければ、私は生きていなかったと思う。左乳房の全摘出手術、襲ってきた「うつ」、家族崩壊の危機…どん底の私を救ってくれた家族の絆とは。はじめに　六十歳を超えられるとは思っていなかった私―がんとうつの苦しみを乗り越えて１章　もう、この子と一緒に死のう！―息子の難病をきっかけに、見失い始めた自分２章　えっ、なんで私が乳がんに！？―どうしよう、家族を残して私は死ねない！３章　襲ってきた「うつ」との闘いの日々―「死にたい、死にたい」という心の叫び４章　その苦しみ,,図書費,正文館書店,,,,,２０１１．１０．０１,,False,,,,False,,,,False,True,False,,
978-4-413038-14-0,46259,2011/12/01,リーダーになる前に２０代でインストールしておきたい大切な７０のこと,ﾘｰﾀﾞｰﾆﾅﾙﾏｴﾆ20ﾀﾞｲﾃﾞｲﾝｽﾄｰﾙｼﾃｵｷﾀｲﾀｲｾﾂﾅ70ﾉｺﾄ,,,,,千田　琢哉,ｾﾝﾀﾞﾀｸﾔ,,336.3,ｾﾀ,,青春出版社,2011,171,19,1365,,就活生はもちろん、新入社員からベテランまで。あの人にも読んでほしい！リーダーの哲学。１　スタンス―「人の上に立ちたい」という人は、もっともリーダーに向いていない。２　コミュニケーション力―別れ際、「ああ、もっと話したかったのに…」と思われる人を目指す。３　行動力―確認してからキスするのではない。キスしてから確認するのだ。４　観察力―オフィスで誰も気づかなかったゴミを拾える人が、将来リーダーになる。５　発想力―「業界の常識で考えて…」が口癖になったら、すでに成長が止まった証拠,件名（キーワード） リーダーシップ      [関連語] => 支配[関連語] => 権力[関連語] => コーチング[関連語] => 管理者[上位語] => グループダイナミックス,図書費,正文館書店,,,,,２０１１．１１．１５,,False,,,,False,,,,False,True,False,,
978-4-413043-36-6,46000,2011/11/08,図説．地図とあらすじでわかる！／平清盛と平家物語,ｽﾞｾﾂ.ﾁｽﾞﾄｱﾗｽｼﾞﾃﾞﾜｶﾙ!/ﾀｲﾗﾉｷﾖﾓﾘﾄﾍｲｹﾓﾉｶﾞﾀﾘ,,,青春新書,,日下　力,ｸｻｶﾂﾄﾑ,,913.43,ｸﾂ,,青春出版社,2011,205,18,1190,,２８９．１／保元・平治の乱、福原遷都と日宋留易、厳島神社と平家納経…争乱の世を生き抜いた「非情の覇者」の意外な実像に迫る。第１章　『平家物語』とは何か（『平家物語』とは何か―無常観を主題に平氏一門の隆盛と滅亡を描く軍記物語；作者と成立―さまざまな人の手を介して結実した「原・平家物語」　ほか）第２章　あらすじでわかる！『平家物語』（祇園精舎～内裏炎上―忠盛・清盛の台頭と反平氏勢力の増長の萌芽；座主流～蘇武～後白河院にまで伸びた清盛の追及の手　ほか）第３章　平清盛の知られざる実像（出生と時,平家物語∥ヘイケ モノガタリ,図書費,正文館書店,,新書書架,,,２０１１．１１．０７,,False,,,,False,,,,False,True,False,,
978-4-415110-02-8,45809,2011/09/13,地図で読む　東日本大震災／大地震・福島原発・災害予測,ﾁｽﾞﾃﾞﾖﾑﾋｶﾞｼﾆﾎﾝﾀﾞｲｼﾝｻｲ/ﾀﾞｲｼﾞｼﾝﾌｸｼﾏｹﾞﾝﾊﾟﾂｻｲｶﾞｲﾖｿｸ,,,地図,,成美堂出版,ｾｲﾋﾞﾄﾞｳｼｭｯﾊﾟﾝ,,369.31,ｾ,,成美堂出版,2011,95,30,1050,,,,図書費,正文館書店,,,,,２０１１．０９．１２,,False,,,,False,,,,False,True,False,,
978-4-415311-87-6,46113,2011/11/22,一冊でわかる／芸術・美術・建築からわかる日本史／縄文時代から近代まで,ｲｯｻﾂﾃﾞﾜｶﾙ/ｹﾞｲｼﾞｭﾂﾋﾞｼﾞｭﾂｹﾝﾁｸｶﾗﾜｶﾙﾆﾎﾝｼ/ｼﾞｮｳﾓﾝｼﾞﾀﾞｲｶﾗｷﾝﾀﾞｲﾏﾃﾞ,,,一冊でわかる・シリーズ,,小和田　哲雄．監修,ｵﾜﾀﾞﾃﾂｵ.ｶﾝｼｭｳ,,702.1,ｵﾃ,,成美堂出版,2011,223,21,1365,,第１章　古代日本と文化の黎明期第２章　仏教の伝来と文化の変容第３章　平安貴族が担い手となった華やかな文化第４章　文化に影響を与えた武士の精神第５章　世相を反映した豪放かつ絢爛な文化の登場第６章　平穏の時代に確立された日本の伝統文化著者紹介小和田哲男［オワダテツオ］１９４４年静岡市生まれ。早稲田大学大学院文学研究科博士課程修了、文学博士。静岡大学名誉教授。また、ＮＨＫ大河ドラマ「秀吉」「功名が辻」「天地人」「江」の時代考証を担当するなど多方面で活躍,件名（キーワード） 美術 (日本)--歴史,図書費,正文館書店,,,,,２０１１．１１．０７,,False,,,,False,,,,False,True,False,,
978-4-418095-07-0,45957,2011/10/07,ベニシアの京都里山日記／大原で出逢った宝物たち,ﾍﾞﾆｼｱﾉｷｮｳﾄｻﾄﾔﾏﾆｯｷ/ｵｵﾊﾗﾃﾞﾃﾞｱｯﾀﾀｶﾗﾓﾉﾀﾁ,,,,,ベニシア・スタンリー・スミス／梶山　正．写真・翻訳,ﾍﾞﾆｼｱ･ｽﾀﾝﾘｰ･ｽﾐｽ/ｶｼﾞﾔﾏﾀﾀﾞｼ.ｼｬｼﾝ･ﾎﾝﾔｸ,,590.4,ｽ,,世界文化社,2010,167,21,1155,,築一〇〇年の農家の修復から始まった心温まる豊かな暮らし。イギリスの貴族生活を離れたベニシアが、日記に綴った里山での日々。待望のエッセイ集、第２弾。第１章　古きものを愛する日本の心、イギリスの心（カーゾン卿が記した日本の姿；築一〇〇年の農家を改築　ほか）第２章　出会いの場、集いの場（大原朝市とカントリーマーケット；祭りは大人への通過儀礼　ほか）第３章　子供たちに夢と力を（夢と希望の源；家庭で学ぶ知恵　ほか）第４章　近所の山を歩く喜び（我が家の「登山の日」；琴平おばあちゃん　ほ,家政∥カセイ      →: 下位語: 被服管理∥ヒフクカンリ      →: 下位語: 裁縫∥サイホウ      →: 下位語: 食生活∥ショクセイカツ      →: 下位語: 育児∥イクジ      →: 下位語: 家庭経済∥カテイケイザイ      →: 下位語: 家庭科学∥カテイカガク      →: 下位語: 掃除∥ソウジ      →: 関連語: アンペイドワーク∥アンペイド ワーク      →: 関連語: 家庭∥カテイ      →: 関連語: 家,図書費,正文館書店,,,,,２０１１．１０．０１,,False,,,,False,,,1,False,True,False,,
978-4-418114-00-9,45734,2011/08/29,やさしいきもの用語小辞典／５０音順ですぐ引ける１３００語,ﾔｻｼｲｷﾓﾉﾖｳｺﾞｼｮｳｼﾞﾃﾝ/50ｵﾝｼﾞｭﾝﾃﾞｽｸﾞﾋｹﾙ1300ｺﾞ,,,,,家庭画報．編,ｶﾃｲｶﾞﾎｳ.ﾍﾝ,,593.1,ｶ,,世界文化社,2011,167,21,1575,,２８６のイラスト・図版。難読用語でも引ける。一口コラムで４７の蘊蓄。きものと帯の種類染めと織りの種類きものの仕組みと各名称日本の色名―草木染の伝統色から難字解読の手引き―部首別読み方リストきもの用語小辞典若い人や初心者も親しみやすい「横組み」のコンパクト判「きもの用語辞典」。基本の必須１３００語を収録。若い人や初心者も親しみやすい「横組み」のコンパクト判「きもの用語辞典」。●染織技法・産地●生地・素材●日本の伝統色・文様●和服と帯の種類●部位名称●仕,,図書費,正文館書店,,,,,２０１１．０８．２４,,False,,,,False,,,,False,True,False,,
978-4-422115-11-5,45707,2011/08/25,スクールカウンセラーの第一歩／学校現場への入り方から面接実施までの手引き,ｽｸｰﾙｶｳﾝｾﾗｰﾉﾀﾞｲｲｯﾎﾟ/ｶﾞｯｺｳｹﾞﾝﾊﾞﾍﾉﾊｲﾘｶﾀｶﾗﾒﾝｾﾂｼﾞｯｼﾏﾃﾞﾉﾃﾋﾞｷ,,,,,内田　利広／内田　純子,ｳﾁﾀﾞﾄｼﾋﾛ/ｳﾁﾀﾞｼﾞｭﾝｺ,,371.43,ｳﾄ,,創元社,2011,238,19,1680,,スクールカウンセラー、初心者の心に響く入門書。第１章　学校に行くまでにやっておくこと第２章　初めて学校に行く第３章　面接をスタートするまで第４章　カウンセリングの実施と校内連携について第５章　学校という組織になじむ第６章　スクールカウンセラーの限界と他機関との連携第７章　小学校におけるスクールカウンセラーの第一歩第８章　スクールカウンセラーを継続していくためにスクールカウンセラー（SC）の初任者、またはSCを目指す大学生・院生に向けた入門実用書。「よくある質,,図書費,正文館書店,,,,,２０１１．０８．２４,,False,,,,False,,,,False,True,False,,
