ISBN,登録番号,受入日,書名,書名かな,副書名,副書名かな,叢書名等,叢書名等かな,著者名,著者名かな,媒体種別,分類記号,図書記号,巻冊記号,出版社,版年,頁数,判型,本体価格,TRCMARCNO,内容紹介,件名,財源,受入先,価格,保管場所,別置記号,備考,付記事項,注記,除籍フラグ,除籍年月日,除籍番号,除籍理由,不明図書フラグ,不明日,不明理由,未点検回数,帯出禁止フラグ,バーコード印刷済フラグ,背ラベル印刷済フラグ,任意項目
,45484,2011/04/10,なるほど高校数学　数列の物語／なっとくして、ほんとうに理解できる,ﾅﾙﾎﾄﾞｺｳｺｳｽｳｶﾞｸｽｳﾚﾂﾉﾓﾉｶﾞﾀﾘ/ﾅｯﾄｸｼﾃ､ﾎﾝﾄｳﾆﾘｶｲﾃﾞｷﾙ,,,ＢＬＵＥ　ＢＡＣＫＳ　１７１１,,宇野　勝博,ｳﾉｶﾂﾋﾛ,,413.2,ｳｶ,,講談社,2011,201,18,861,,高校で学ぶ数学を、テーマ別に「わかりやすく、自由に、広がりを実感できる」ように語る、数学入門シリーズ。数列の表し方から、等差数列、等比数列、数列の和、パズルを解くように推理する漸化式、頭を悩ます数学的帰納法までを、ゆっくりと説明。第１章　数列とは何だろう第２章　基本的な数列（等差数列と等比数列；階差と和；等比数列の和；一般項がｎの２次式、３次式、…の数列）第３章　帰納的定義と数学的帰納法（帰納的定義と漸化式；少し複雑な漸化式に挑戦；数学的帰納法）第４章　数列の広がり（数列の極限,数列∥スウレツ      →: 下位語: ファレイ数列∥Farey スウレツ = ファレイスウレツ      →: 関連語: 級数∥キュウスウ      →: 関連語: フィボナッチ数∥Fibonacci スウ = フィボナッチスウ  ,図書費,白山商会,,新書書架,,,,,False,,,,False,,,,False,True,False,,
,45485,2011/04/10,図解　感覚器の進化／原始動物からヒトへ水中から陸上へ,ｽﾞｶｲｶﾝｶｸｷﾉｼﾝｶ/ｹﾞﾝｼﾄﾞｳﾌﾞﾂｶﾗﾋﾄﾍｽｲﾁｭｳｶﾗﾘｸｼﾞｮｳﾍ,,,ＢＬＵＥ　ＢＡＣＫＳ　１７１２,,岩堀　修明,ｲﾜﾎﾘﾉﾌﾞﾊﾙ,,481.17,ｲﾉ,,講談社,2011,286,18,1029,,餌を探すため、繁殖相手を見つけるために、感覚器は動物にとって欠かせない器官である。しかし、その形や機能は千差万別で、そこには動物たちがくぐり抜けてきた試練の歴史が刻まれている。全身にあるミミズの原始的な視覚器から再び水中に戻ったクジラの絶妙な聴覚器まで、眼、舌、鼻、耳、皮膚…に秘められた壮大な進化の物語。第１章　感覚器とは何か第２章　視覚器第３章　味覚器第４章　嗅覚器第５章　平衡・聴覚器第６章　体性感覚器第７章　クジラの感覚器壮観！詳細な図解で見る感覚器,感覚器官∥カンカクキカン      →: 上位語: 人体∥ジンタイ      →: 下位語: 光受容器∥コウジュヨウキ      →: 下位語: 側線器官∥ソクセンキカン      →: 下位語: 耳∥ミミ      →: 下位語: 鼻∥ハナ      →: 関連語: 感覚∥カンカク      →: 関連語: 受容器(生物)∥ジュヨウキ(セイブツ)      →: 関連語: 反射(生物)∥ハンシャ(セイブツ),図書費,白山商会,,新書書架,,,,,False,,,,False,,,,False,True,False,,
,45486,2011/04/10,Ｗｏｒｄのイライラ根こそぎ解消術／「おせっかい」と「使いにくい」を一掃する,Wordﾉｲﾗｲﾗﾈｺｿｷﾞｶｲｼｮｳｼﾞｭﾂ/｢ｵｾｯｶｲ｣ﾄ｢ﾂｶｲﾆｸｲ｣ｦｲｯｿｳｽﾙ,,,ＢＬＵＥ　ＢＡＣＫＳ　１７１４,,長谷川　裕行,ﾊｾｶﾞﾜﾋﾛﾕｷ,,548,ﾊﾋ,,講談社,2011,190,18,840,,５４８／３３６．５７／「Ｗｏｒｄには何かとイライラさせられる」その理由の大部分は、自動的に適用される無用なおせっかい機能や英語環境に由来する独特の使いにくさにある。本書は、おせっかい機能の正体を突き止め、使いにくさの原因を１つずつ潰していくことであなたのＷｏｒｄを抜群に使いやすくする。１章　入力と設定でイラつかない（自動的に箇条書きの体裁になってしまう；箇条書きの体裁は有効なまま箇条書きでない行を入力したい　ほか）２章　編集の操作でイラつかない（文字列を上手に選択するコツ；書式なしで文,,図書費,白山商会,,新書書架,,,,,False,,,,False,,,,False,True,False,,
,45487,2011/04/10,漢字のサーカス／常用漢字編２,ｶﾝｼﾞﾉｻｰｶｽ/ｼﾞｮｳﾖｳｶﾝｼﾞﾍﾝ2,,,岩波ジュニア新書　６７２,,馬場　雄二,ﾊﾞﾊﾞﾕｳｼﾞ,,811.2,ﾊﾞﾕ,,岩波書店,2011,178,18,987,,デザインとしても“すぐれもの”の漢字をたっぷり楽しめるパズルで、漢字の新しい魅力を発見しよう。やや手強い常用漢字に、新しく常用漢字表に加わる１９６字を加えた約５２０字から出題。『漢字のサーカス』『漢字のサーカス　常用漢字編１』との３冊で、常用漢字２１３６字を完全制覇。巻頭カラーページ（漢字の星座　双子座；書き足し四字熟語　ほか）はじめに―よく遊べばよく学んだことになる第１ステージ　推理力（同音楽団；心ある漢字　ほか）第２ステージ　構成力（書き足し四字熟語；異部首三兄弟　ほか,,図書費,白山商会,,新書書架,,,,,False,,,,False,,,,False,True,False,,
,45488,2011/04/10,社会主義への挑戦１９４５－１９７１／シリーズ中国近現代史④,ｼｬｶｲｼｭｷﾞﾍﾉﾁｮｳｾﾝ1945-1971/ｼﾘｰｽﾞﾁｭｳｺﾞｸｷﾝｹﾞﾝﾀﾞｲｼ4,,,岩波新書　１２５２,,久保　亨,ｸﾎﾞﾄｵﾙ,,222.07,ｸﾄ,4,岩波書店,2011,219,18,840,,人民共和国の成立は、必ずしも社会主義政権の樹立を意味していなかった。それにもかかわらず、中国はなぜ社会主義をめざしたのか。戦後、さまざまな政治構想が交錯するなかで実権を握った中国共産党。急進化するその政策路線はやがて、文化大革命の嵐を呼び寄せてしまう。試行錯誤を重ねた四半世紀をたどる。第１章　戦後復興の基望と混沌第２章　冷戦のなかの国づくり第３章　急進的社会主義路線「大躍進」の頓挫第４章　試行錯誤する社会主義第５章　急進的社会主義への再挑戦「文化大革命」第６,中国 -- 歴史 -- 1949～∥チュウゴク -- レキシ -- 1949-  社会主義 -- 中国 -- 歴史 -- 1949～∥シャカイシュギ -- チュウゴク -- レキシ -- 1949-1971,図書費,白山商会,,新書書架,,,,,False,,,,False,,,,False,True,False,,
,45489,2011/04/10,日本語の古典,ﾆﾎﾝｺﾞﾉｺﾃﾝ,,,岩波新書　１２８７,,山口　仲美,ﾔﾏｸﾞﾁﾅｶﾐ,,801.2,ﾔﾅ,,岩波書店,2011,248,18,840,,奈良時代の『古事記』から江戸末期の『春色梅児誉美』まで、歴代の名作三〇を取り上げて、言葉と表現を切り口にその面白さを解き明かしていく。登場人物の言葉遣いや鮮やかな比喩、擬音語・擬態語の生き生きとした効果などがよく分かる選び抜かれた原文を味わいながら、古典の底力、日本語の魅力を再発見できる、斬新な古典文学入門。１　言葉に霊力が宿る―奈良時代（古事記―言葉が生む悲劇；日本書紀―リアルな歴史叙述　ほか）２　貴族文化の花が咲く―平安時代（竹取物語―成長するかぐや姫；伊勢物語―命をかける、それが,日本語 -- 歴史∥ニホンゴ -- レキシ  日本文学 -- 歴史∥ニホンブンガク -- レキシ  ,図書費,白山商会,,新書書架,,,,,False,,,,False,,,1,False,True,False,,
,45490,2011/04/10,日本の国会／審議する立法府へ,ﾆﾎﾝﾉｺｯｶｲ/ｼﾝｷﾞｽﾙﾘｯﾎﾟｳﾌﾍ,,,岩波新書　１２８８,,大山　礼子,ｵｵﾔﾏﾚｲｺ,,314.1,ｵﾚ,,岩波書店,2011,235,18,840,,政党間のかけひきに終始し、実質的な審議が行われない国会。審議空洞化の原因はどこにあり、どうすれば活性化できるのか。戦後初期からの歴史的経緯を検討した上で、イギリスやフランスとの国際比較を行い、課題を明らかにする。「ねじれ国会」が常態化した今、二院制の意義を再考、そして改革の具体案を提示する。序章　政権交代は国会を変えたか第１章　戦後初期の国会運営―日本国憲法と国会法の枠組みの中で第２章　空洞化する審議―五五年体制下の国会第３章　立法府の改革構想―日本の議論、世界の潮流,国会∥コッカイ,図書費,白山商会,,新書書架,,,,,False,,,,False,,,,False,True,False,,
,45491,2011/04/10,中国エネルギー事情,ﾁｭｳｺﾞｸｴﾈﾙｷﾞｰｼﾞｼﾞｮｳ,,,岩波新書　１２８９,,郭　四志,ｶｸｼｼ/ｺﾞｳｼｼﾞ,,501.6,ｶｼ,,岩波書店,2011,240,18,840,,めざましい経済成長の続く中国は、いまや世界一のエネルギー消費国。「重厚長大」型経済の下、石油は国内生産では足りず、輸入に頼るとともに海外での開発・権益確保を推進、他方で石炭は環境汚染と地球温暖化への対応が問われている。さらに天然ガス、太陽光や原発も含め、この国の今後を左右するエネルギー事情を包括的に描く。第１章　経済の高度成長とエネルギー資源第２章　政府の危機感と政策・戦略第３章　石油・天然ガス（１）―三大メジャーと政府第４章　石油・天然ガス（２）―強化される海外資源確保,エネルギー政策 -- 中国∥エネルギーセイサク -- チュウゴク,図書費,白山商会,,新書書架,,,,,False,,,,False,,,,False,True,False,,
,45492,2011/04/10,職業としての科学,ｼｮｸｷﾞｮｳﾄｼﾃﾉｶｶﾞｸ,,,岩波新書　１２９０,,佐藤　文隆,ｻﾄｳﾌﾐﾀｶ,,409.1,ｻﾌ,,岩波書店,2011,222,18,798,,冷戦崩壊以来、科学は大きな転換期を迎えている。社会を巻き込んで突っ走る一方、科学技術創造立国政策の中で科学はリスキーな職業と化し、もはや聖域とも見られなくなった。この巨大な社会資源を生かすために、未来に受け継ぐべきものは何か。宇宙物理学に半世紀携わってきた著者が科学の歴史を縦横に語り、発想の転換を促す。第１章　転換期にある科学という制度第２章　知的自由としての科学―啓蒙・ロマン・専門第３章　科学者精神とは―マッハ対プランク第４章　制度科学のエートス―ポパー対クーン第,科学技術政策 -- 日本∥カガクギジュツセイサク -- ニホン  科学者∥カガクシャ      →: 上位語: 学者∥ガクシャ      →: 下位語: 医学者∥イガクシャ      →: 下位語: 物理学者∥ブツリガクシャ      →: 下位語: 化学者∥カガクシャ      →: 下位語: 天文学者∥テンモンガクシャ      →: 下位語: 海洋学者∥カイヨウガクシャ      →: 下位語: 生物学者∥セイブツガクシャ      →: 下位語: 地理学者∥チリ,図書費,白山商会,,新書書架,,,,,False,,,,False,,,,False,True,False,,
,45493,2011/04/10,ジプシーを訪ねて,ｼﾞﾌﾟｼｰｦﾀｽﾞﾈﾃ,,,岩波新書　１２９１,,関口　義人,ｾｷｸﾞﾁﾖｼﾄ,,382.9,ｾﾖ,,岩波書店,2011,230,18,840,,ロマ、ツィガーヌ、ヒターノ、マヌーシュ、カーロ、シンティ、ドム…さまざまな名で世界に拡散するジプシー。「自由の民」でも「乞食で泥棒」でもなく、国をもたぬ彼らは二一世紀の世界をいかに生きぬいているのか―ジプシー音楽に導かれた著者がバルカン～中欧～アラブ諸国へ、歴史ある集落から難民キャンプまでを訪ねた一〇年の記録。序章　ジプシーと出会うまで第１章　ジプシーとは誰か第２章　ジプシーに分け入って―バルカンから中欧へ第３章　ドムたち―ヨーロッパの外へ第４章　ジプシー・ミュージック―そ,ロマ,図書費,白山商会,,新書書架,,,,,False,,,,False,,,,False,True,False,,
,45494,2011/04/10,入院する前に知っておきたい　新・差額ペッド料Ｑ＆Ａ,ﾆｭｳｲﾝｽﾙﾏｴﾆｼｯﾃｵｷﾀｲｼﾝｻｶﾞｸﾍﾟｯﾄﾞﾘｮｳQ&A,,,岩波ブックレット　８００,,ささえあい医療人権センターＣＯＭＬ．編,ｻｻｴｱｲｲﾘｮｳｼﾞﾝｹﾝｾﾝﾀｰCOML.ﾍﾝ,,498.13,ｻ,,岩波書店,2011,64,21,525,,入院したとき請求されることがある「差額ベッド料」。差額ベッド料は必ずしも“個室”とは限らず、払わなくていい場合もあること、同意書が重要なことなど、ルールがあります。長年の電話相談の経験から具体例とともに丁寧に解説。差額ベッド料とは請求される場合、されない場合差額ベッド料に関する国の通知“差額”の設定条件料金は病院によって異なる病院からの説明同意書とは個室の料金とはかぎらない治療上の必要感染症の場合空きベッドがない場合払えない場合病院との交,医療費 -- 日本∥イリョウヒ -- ニホン  ベッド      →: 上位語: 家具∥カグ      →: 関連語: 寝室∥シンシツ,図書費,白山商会,,事典棚,,,,,False,,,,False,,,,False,True,False,,
,45495,2011/04/10,終わりなきアスベスト災害／地震大国ニッポンへの警告,ｵﾜﾘﾅｷｱｽﾍﾞｽﾄｻｲｶﾞｲ/ｼﾞｼﾝﾀｲｺｸﾆｯﾎﾟﾝﾍﾉｹｲｺｸ,,,岩波ブックレット　８０１,,宮本　憲一／森永　謙二／石原　一彦,ﾐﾔﾓﾄｹﾝｲﾁ/ﾓﾘﾅｶﾞｹﾝｼﾞ/ｲｼﾊﾗｶｽﾞﾋｺ,,519.3,ﾐｹ,,岩波書店,2011,64,21,525,,アスベストは、日本では全消費量の８割が建材に用いられてきた。そのため地震で建物が倒壊するとアスベストは飛び散り、阪神・淡路大震災では建築物の解体作業に携わった人に被害が出ている。これからすべきことは何か。１章　震災アスベスト問題が発する警告２章　建築物のアスベスト飛散と発症３章　復旧労働者・救護者への医療アプローチ―ＷＴＣ倒壊と阪神・淡路大震災を事例に４章　震災時のアスベスト対策の確立に向けて著者紹介宮本憲一［ミヤモトケンイチ］１９３０年生まれ。立命館大学政,石綿∥セキメン      →: 関連語: 肺塵症∥ハイジンショウ      →: 関連語: 中皮腫∥チュウヒシュ  震災∥シンサイ      →: 上位語: 自然災害∥シゼンサイガイ      →: 下位語: 地震火災∥ジシン カサイ      →: 関連語: 地震∥ジシン      →: 関連語: 地震保険∥ジシンホケン      →: 関連語: 震災予防∥シンサイ ヨボウ,図書費,白山商会,,事典棚,,,,,False,,,,False,,,,False,True,False,,
,45496,2011/04/10,証言記録　兵士たちの戦争　５,ｼｮｳｹﾞﾝｷﾛｸﾍｲｼﾀﾁﾉｾﾝｿｳ5,,,兵士たちの戦争　５,,ＮＨＫ「戦争証言」プロジェクト．編,NHK｢ｾﾝｿｳｼｮｳｹﾞﾝ｣ﾌﾟﾛｼﾞｪｸﾄ.ﾍﾝ,,916,ｴ,5,ＮＨＫ出版,2011,307,22,2310,,２００７年８月の放送開始以来、全国の視聴者から反響を呼んでいるＮＨＫ『証言記録　兵士たちの戦争』の出版化。太平洋戦争開戦から７０年。悲惨な戦場を知る元兵士たちが伝える戦争の現実と心の傷跡。第１章　陸軍・南海支隊―ポートモレスビー作戦「絶対ニ成功ノ希望ナシ」第２章　朝鮮人皇軍兵士―遥かなる祖国第３章　満蒙開拓青少年義勇軍―王道楽土を信じた少年たち第４章　陸軍・近衞師団―昭和二〇年八月一五日玉音放送を阻止せよ第５章　ニューブリテン島ズンゲン支隊―生き延びてはならなかった最前,太平洋戦争(1941～1945)∥タイヘイヨウセンソウ(1941-1945)      →: 上位語: 世界戦争(1939～1945)∥セカイセンソウ(1939-1945)      →: 関連語: 日中戦争(1937～1945)∥ニッチュウセンソウ(1937-1945)      →: 関連語: 太平洋戦争(1941～1945) -- 特攻隊∥タイヘイヨウセンソウ(1941-1945) -- トッコウタイ      →: 関連語: 玉音放送(1945)∥ギョクオンホウソウ(1945)  ,図書費,ＴＳＵＴＡＹＡ多治見インター店,,,,,２０１１．０４．０１,,False,,,,False,,,,False,True,False,,
,45497,2011/04/10,量子もつれとは何か／「不確定性原理」と複数の量子を扱う量子力学,ﾘｮｳｼﾓﾂﾚﾄﾊﾅﾆｶ/｢ﾌｶｸﾃｲｾｲｹﾞﾝﾘ｣ﾄﾌｸｽｳﾉﾘｮｳｼｦｱﾂｶｳﾘｮｳｼﾘｷｶﾞｸ,,,ＢＬＵＥ　ＢＡＣＫＳ　１７１５,,古澤　明,ﾌﾙｻﾜｱｷﾗ,,421.3,ﾌｱ,,講談社,2011,190,18,840,,アインシュタインを悩ませた「量子もつれ」の正体とはなんだったのか？不確定性原理と波の重ね合わせから導き出される量子もつれを駆使して、まったく新しい量子力学の考え方を提示する。量子力学とはテクノロジーの進歩と量子化の必要性振り子の量子化光の量子化レーザー光と量子ゆらぎ量子エンタングルメント量子光学を用いたＥＰＲペアを生成するための準備量子光学を用いてＥＰＲペアを生成量子光学を用いた量子エンタングルメント検証実験単一光子状態の生成量子テレポーテーション多,量子力学∥リョウシリキガク      →: 上位語: 力学∥リキガク      →: 上位語: 量子論∥リョウシロン      →: 上位語: 数理物理学∥スウリブツリガク      →: 下位語: 波動力学∥ハドウリキガク      →: 下位語: 行列力学∥ギョウレツリキガク      →: 下位語: 量子電磁力学∥リョウシデンジリキガク      →: 下位語: 多体問題∥タタイモンダイ      →: 関連語: シンプレクティック幾何学∥シンプレクティックキカガク ,図書費,白山商会,,新書書架,,,２０１１．０４．０１,,False,,,,False,,,,False,True,False,,
,45498,2011/04/10,「余剰次元」と逆二乗則の破れ／我々の世界は本当に三次元か？,｢ﾖｼﾞｮｳｼﾞｹﾞﾝ｣ﾄｷﾞｬｸﾆｼﾞｮｳｿｸﾉﾔﾌﾞﾚ/ﾜﾚﾜﾚﾉｾｶｲﾊﾎﾝﾄｳﾆｻﾝｼﾞｹﾞﾝｶ?,,,ＢＬＵＥ　ＢＡＣＫＳ　１７１６,,村田　次郎,ﾑﾗﾀｼﾞﾛｳ,,421,ﾑｼﾞ,,講談社,2011,254,18,945,,ミクロの世界では重力が存在するのか、じつはまったく確認されていない。もし実験で万有引力の法則からのずれが見つかれば、それは重力が余剰次元にも伝播していることを示唆し、四つの力の統一という現代物理学最大の目標に向けた突破口となる。余剰次元探索の最前線に立つ著者が最新の考え方と実験の現場を紹介する。第１章　宇宙の姿第２章　重力の法則第３章　空間次元と逆二乗則第４章　力の法則の一般形第５章　余剰次元の世界第６章　余剰次元を探る第７章　強い力と宇宙項問題わずか０,理論物理学∥リロンブツリガク      →: 上位語: 物理学∥ブツリガク      →: 下位語: 数理物理学∥スウリブツリガク      →: 下位語: 相対性原理∥ソウタイセイゲンリ      →: 関連語: 拡散∥カクサン  次元(数学)∥ジゲン(スウガク)      →: 関連語: 抽象空間∥チュウショウクウカン  ,図書費,白山商会,,新書書架,,,２０１１．０４．０１,,False,,,,False,,,,False,True,False,,
,45499,2011/04/10,図解　地下鉄の科学／トンネル構造から車輌のしくみまで,ｽﾞｶｲﾁｶﾃﾂﾉｶｶﾞｸ/ﾄﾝﾈﾙｺｳｿﾞｳｶﾗｼｬﾘｮｳﾉｼｸﾐﾏﾃﾞ,,,ＢＬＵＥ　ＢＡＣＫＳ　１７１７,,川辺　謙一,ｶﾜﾍﾞｹﾝｲﾁ,,516.72,ｶｹ,,講談社,2011,254,18,945,,地下道やライフラインが複雑に絡み合う地下空間。地下鉄はそれらをくぐり抜けながら、残された場所を探すように、急勾配やカーブを繰り返しながら走っていく。その姿はまるで大都会のジェットコースター。トンネル建設には土木技術の粋が集められ、車両や軌道にも工夫が凝らされている。一般にはあまり知られていない地下鉄の高度な技術を豊富な図解を用いて解説する。第１章　地下鉄技術の歴史第２章　地下鉄ネットワーク第３章　地下鉄をつくる第４章　驚きの立体交差第５章　運行システムの技術,地下鉄道∥チカテツドウ      →: 上位語: 鉄道∥テツドウ      →: 上位語: 地下構造物∥チカコウゾウブツ,図書費,白山商会,,新書書架,,,２０１１．０４．０１,,False,,,,False,,,,False,True,False,,
,45500,2011/04/10,小事典・からだの手帖〈新装版〉／薬よりよく効く１０１話,ｼｮｳｼﾞﾃﾝｶﾗﾀﾞﾉﾃﾁｮｳ/ｸｽﾘﾖﾘﾖｸｷｸ101ﾜ｢ｼﾝｿｳﾊﾞﾝ｣,,,ＢＬＵＥ　ＢＡＣＫＳ　１７１８,,高橋　長雄,ﾀｶﾊｼﾀｹｵ,,491.3,ﾀﾀ,,講談社,2011,222,18,903,,神経系の小径をたどって感覚器に至り、血液のダイナミックな流れにのって、心臓から血管、リンパ管を抜けて行く。広大な呼吸器のガス交換現場を一望し、長い消化管をくぐって化学プラント肝臓へ、そして神秘の内分泌器官へ迫る…。名ガイドの案内で行く人体ワンダーランドの旅。ニューロン―通信網の基本単位反射―知覚から運動へのクイックターン大脳回／大脳溝―頭の中の部署配置大脳辺縁系―「内密の我」の宿るところ意識―知・情・意の舞台言語野―おしゃべりはここにはじまる脳波―脳からの電気の,人体∥ジンタイ      →: 下位語: 金属と生体∥キンゾクトセイタイ      →: 下位語: 顔∥カオ      →: 下位語: 頸∥クビ      →: 下位語: 胸部∥キョウブ      →: 下位語: 皮膚∥ヒフ      →: 下位語: 上肢∥ジョウシ      →: 下位語: 下肢∥カシ      →: 下位語: 運動器官∥ウンドウキカン      →: 下位語: 感覚器官∥カンカクキカン      →: 下位語: 呼吸器∥コキュウキ      ,図書費,白山商会,,新書書架,,,２０１１．０４．０１,,False,,,,False,,,,False,True,False,,
,45501,2011/04/10,社会の真実の見つけかた,ｼｬｶｲﾉｼﾝｼﾞﾂﾉﾐﾂｹｶﾀ,,,岩波ジュニア新書　６７３,,堤　未果,ﾂﾂﾐﾐｶ,,304,ﾂﾐ,,岩波書店,2011,227,18,861,,メディアが流す情報を鵜呑みにしていては、社会の真実は見えてこない。９・１１以後のアメリカで、人々の恐怖心と競争を煽ってきたメディアの実態を実際に体験し、取材してきた著者が、「情報を読み解く力」を身につける大切さを若い世代に向けて解説する。同時にそこにこそ“未来を選ぶ自由”があると説く。第１章　戦争の作りかた―三つの簡単なステップ（恐怖が判断力を失わせる；現れた敵　ほか）第２章　教育がビジネスになる（奇妙な出来事；全米に広がる教師のインチキ合戦　ほか）第３章　メディアがみせるイメ,,図書費,白山商会,,新書書架,,,２０１１．０４．０１,,False,,,,False,,,,False,True,False,,
,45502,2011/04/10,正しいパンツのたたみ方／新しい家庭科勉強法,ﾀﾀﾞｼｲﾊﾟﾝﾂﾉﾀﾀﾐｶﾀ/ｱﾀﾗｼｲｶﾃｲｶﾍﾞﾝｷｮｳﾎｳ,,,岩波ジュニア新書　６７４,,,,,590,ﾐﾀ,,岩波書店,2011,210,18,861,,家庭科は、自分の暮らしを自分で整える力だけでなく、この社会の中で他者とともに生きていく力を育ててくれる教科だと実感した著者は、自ら専任教員となる。ご飯の作り方、お金とのつきあい方、時間の使い方など自立にあたってどんな知識が必要か、１０代の暮らしに沿って具体的にアドバイスする。序章　家庭科を学ぶ意味（バンツのたたみ方に悩む男性に温かいアドバイスを；お互いの違いを知る教科　ほか）１章　いま、生きているワタシ（目指せ！弁当高校生；さわやかな朝の目覚めのために　ほか）２章　家族の中で生きる,,図書費,白山商会,,新書書架,,,２０１１．０４．０１,,False,,,,False,,,,False,True,False,,
