978-4-062577-47-2,46347,2011/12/12,マンガ量子力学／この世を支配する奇妙な法則,ﾏﾝｶﾞﾘｮｳｼﾘｷｶﾞｸ/ｺﾉﾖｦｼﾊｲｽﾙｷﾐｮｳﾅﾎｳｿｸ,,,ＢＬＵＥ　ＢＡＣＫＳ　１７４７,,石川　真之介．原作・漫画,ｲｼｶﾜｼﾝﾉｽｹ.ｹﾞﾝｻｸ･ﾏﾝｶﾞ,,421.3,ｲｼ,,講談社,2011,203,18,861,,女子高生のフェル美は、言葉をしゃべる魔法犬フォト丸と出会い、この世は「量子力学」に支配されており、決まりきったことなど何もなく、とても不思議な世界だと教えられる。そこに現れた同じ高校に通う古川典子は、そんなことはない、この世のすべては「古典力学」によって決められると激しく反発する…。量子力学と古典力学の対比をモチーフに綿密に構成されたフェル美と典子のバトルの行方は。日常では考えられない量子力学の摩訶不思議な世界をカリフォルニア大学バークレー校の研究員がやさしく解説。プロローグ第,件名（キーワード） 量子力学,図書費,白山商会,,新書書架,,,２０１１．１２．１０,,False,,,,False,,,,False,True,False,,
978-4-062577-48-9,46346,2011/12/12,図解　ボーイング７８７　ｖｓ．　エアバスＡ３８０／新世代旅客機を徹底比較,ｽﾞｶｲﾎﾞｰｲﾝｸﾞ787vs.ｴｱﾊﾞｽA380/ｼﾝｾﾀﾞｲﾘｮｶｸｷｦﾃｯﾃｲﾋｶｸ,,,ＢＬＵＥ　ＢＡＣＫＳ　１７４８,,青木　謙知,ｱｵｷﾖｼﾄﾓ,,538.68,ｱﾖ,,講談社,2011,238,18,924,,ボーイング、エアバスの２大旅客機メーカーが２１世紀に初めて出した新型機が７８７とＡ３８０。両機はほぼ同時期に開発されたが、そのコンセプトは大きく異なる。７８７が燃費効率に優れた中型機なのに対し、Ａ３８０は史上最大の超大型機。こうした基本的な方向性の違いから、製造に至る経緯、機体の性能まで、両機種を徹底分析。豊富な写真や図を用いて、わかりやすく解説した決定版。第１章　７８７とＡ３８０の開発（大型ジェット旅客機略史；Ａ３８０の製造　ほか）第２章　７８７とＡ３８０の機体技術比較（,件名（キーワード） ジェット機,図書費,白山商会,,新書書架,,,２０１１．１２．１０,,False,,,,False,,,,False,True,False,,
978-4-062577-49-6,46391,2012/02/10,データで検証　地球の資源／未来はほんとうに大丈夫なのか？,ﾃﾞｰﾀﾃﾞｹﾝｼｮｳﾁｷｭｳﾉｼｹﾞﾝ/ﾐﾗｲﾊﾎﾝﾄｳﾆﾀﾞｲｼﾞｮｳﾌﾞﾅﾉｶ?,,,ＢＬＵＥ　ＢＡＣＫＳ　１７４９,,井田　徹治,ｲﾀﾞﾃﾂｼﾞ,,334.7,ｲﾃ,,講談社,2011,288,18,1092,,２０５０年、世界の人口は９２億人に達するだろう（国連人口部による２００６年時点での推計）。転換を迫られる原子力中心のエネルギー政策、巨大市場化するインドと中国、ますます加速する低価格と大量消費。資源の枯渇は、すでに現実の問題になっている。食糧は、エネルギーは、水は、レアメタルは…最新のデータで資源の未来を検証する。第１章　エネルギーと原子力―原子力発電の夢第２章　化石エネルギー第３章　急伸、再生可能エネルギー第４章　重要性増すレアメタル第５章　食糧と飢餓第６章　,資源 ,図書費,白山商会,,新書書架,,,２０１２．０２．１０,,False,,,,False,,,,False,True,False,,
978-4-062577-50-2,46392,2012/02/10,知っておきたい物理の疑問５５／物理の基本知識を問う「疑問中の疑問」,ｼｯﾃｵｷﾀｲﾌﾞﾂﾘﾉｷﾞﾓﾝ55/ﾌﾞﾂﾘﾉｷﾎﾝﾁｼｷｦﾄｳ｢ｷﾞﾓﾝﾁｭｳﾉｷﾞﾓﾝ｣,,,ＢＬＵＥ　ＢＡＣＫＳ　１７５０,,日本物理学会．編,ﾆﾎﾝﾌﾞﾂﾘｶﾞｯｶｲ.ﾍﾝ,,420,ﾆ,,講談社,2011,205,18,861,,答えられそうで答えに窮する極上の疑問集。高校生から寄せられた物理の疑問には物理の世界を理解する法則やエッセンスが溢れている。空が青く、夕日が赤いのはなぜ？といった、だれもが抱く疑問から、宇宙がはじまる前には何があったの？といった、専門家でもまだわからない疑問まで結論にいたる方法に重きをおいて解説した物理の基本知識の集大成。第１章　身近な疑問（鉛筆で紙に字が書けるのはなぜですか。；いくつもの絵具を混ぜると黒くなるのはなぜですか。　ほか）第２章　考えるとやはり不思議（レーザーポ,物理学,図書費,白山商会,,新書書架,,,２０１２．０２．１０,,False,,,,False,,,,False,True,False,,
978-4-062577-51-9,46393,2012/02/10,低温「ふしぎ現象」小事典／０℃～絶対零度で何が起こるか？,ﾃｲｵﾝ｢ﾌｼｷﾞｹﾞﾝｼｮｳ｣ｼｮｳｼﾞﾃﾝ/0ﾄﾞｶﾗｾﾞｯﾀｲﾚｲﾄﾞﾃﾞﾅﾆｶﾞｵｺﾙｶ?,,,ＢＬＵＥ　ＢＡＣＫＳ　１７５１,,低温工学・超電導学会．編,ﾃｲｵﾝｺｳｶﾞｸ･ﾁｮｳﾃﾞﾝﾄﾞｳｶﾞｯｶｲ.ﾍﾝ,,426.7,ﾃ,,講談社,2011,254,18,945,,凍った魚が蘇る「生体冷凍保存術」。最高の美味を極める「冷凍と解凍の科学」。本当は恐ろしい「低体温症」の話。無風なのに真横に煙がたなびく南極大陸の怪奇。ダークマターを捉える超ヘビー級の低温液体。電気抵抗がゼロになる「超電導」や、壁を這い上がる忍者液体「超流動」。氷点下をはるかに下回る世界で、なぜ「ふしぎ現象」が生じるのか、低温技術で何ができるかを網羅した「温度別」読む事典。１章　低温の世界へようこそ―常温～－２０℃（天然のウォータークーラー―レトロ技術でどこまで冷える？；,低温物理学,図書費,白山商会,,新書書架,,,２０１２．０２．１０,,False,,,,False,,,,False,True,False,,
978-4-062577-52-6,46402,2012/02/11,数字で読み解くからだの不思議,ｽｳｼﾞﾃﾞﾖﾐﾄｸｶﾗﾀﾞﾉﾌｼｷﾞ,,,ＢＬＵＥ　ＢＡＣＫＳ　１７５２,,エディット．編／竹内　修二．監修,ｴﾃﾞｨｯﾄ.ﾍﾝ/ﾀｹｳﾁｼｭｳｼﾞ.ｶﾝｼｭｳ,,491,ｴ,,講談社,2012,185,18,861,,心臓が１日に送り出す血液の量は？食べ物が胃にとどまっている時間は？脳のシワを広げるとどれくらいの大きさ？ふだん意識したことのないからだの働きを、重さや長さ、面積や容積、時間や速さで表すと驚くべきからだのメカニズムが見えてくる。第１章　全部でいくつ？第２章　全部あわせるとどれくらい？第３章　１日にどれくらい？第４章　一生でどれくらい？第５章　どのくらいの速さ？時間？第６章　さまざまなどれくらい？第７章　比べてみよう！心臓が一日に送り出す血液の量は？鼻水,人体,図書費,白山商会,,新書書架,,,２０１２．０２．１２,,False,,,,False,,,,False,True,False,,
978-4-062577-53-3,46403,2012/02/11,理系のための　クラウド知的生産術／メール処理から論文執筆まで,ﾘｹｲﾉﾀﾒﾉｸﾗｳﾄﾞﾁﾃｷｾｲｻﾝｼﾞｭﾂ/ﾒｰﾙｼｮﾘｶﾗﾛﾝﾌﾞﾝｼｯﾋﾟﾂﾏﾃﾞ,,,ＢＬＵＥ　ＢＡＣＫＳ　１７５３,,堀　正岳,ﾎﾘﾏｻﾀｹ,,547.48,ﾎﾏ,,講談社,2012,198,18,861,,メール処理や事務作業に時間を奪われ研究する時間が十分に取れない、論文執筆をもっと効率的に進めたい―そんな悩みを解決するのがクラウドサービス。効果的な情報整理で時間を生み出し研究の可能性を広げる活用法を豊富な実例とともに紹介。第１章　クラウドサービスを使った仕事環境第２章　メールに振り回されない環境をつくる第３章　手間をかけない論文管理法第４章　アイデアをなくさない情報整理法第５章　クラウド上で論文を書く第６章　時間も空間も超えるコラボレーション術第７章　細かい時間を,,図書費,白山商会,,新書書架,,,２０１２．０２．１２,,False,,,,False,,,,False,True,False,,
978-4-062577-54-0,46404,2012/02/11,日本の土木遺産／近代化を支えた技術を見に行く,ﾆﾎﾟﾝﾉﾄﾞﾎﾞｸｲｻﾝ/ｷﾝﾀﾞｲｶｦｻｻｴﾀｷﾞｼﾞｭﾂｦﾐﾆｲｸ,,,ＢＬＵＥ　ＢＡＣＫＳ　１７５４,,土木学会．編,ﾄﾞﾎﾞｸｶﾞｯｶｲ.ﾍﾝ,,510.92,ﾄﾞ,,講談社,2012,206,18,1050,,日本の近代化を支えた橋梁やトンネル、鉄道・港湾施設などのインフラストラクチャーは、いまも各地でその姿をとどめている。それら土木構造物のうち、特に価値の高いものを土木学会が「選奨土木遺産」として認定。本書では、このうち約４０ヵ所を厳選し、建設に尽力した技術者の活躍に触れながら紹介。専門家が執筆した本格的な「土木遺産」の解説書。１　北海道・東北２　関東・甲信越３　東海・北陸４　近畿５　中国・四国６　九州日本に残された貴重な「土木遺産」を土木学会が認定。そのな,建設事業--日本--歴史,図書費,白山商会,,新書書架,,,２０１２．０２．１２,,False,,,,False,,,,False,True,False,,
978-4-062577-55-7,46405,2012/02/11,振り回されないメール術／状況を改善する「適切な書き方」,ﾌﾘﾏﾜｻﾚﾅｲﾒｰﾙｼﾞｭﾂ/ｼﾞｮｳｷｮｳｦｶｲｾﾞﾝｽﾙ｢ﾃｷｾﾂﾅｶｷｶﾀ｣,,,ＢＬＵＥ　ＢＡＣＫＳ　１７５５,,田村　仁,ﾀﾑﾗｼﾞﾝ,,336.5,ﾀｼﾞ,,講談社,2012,174,18,840,,「メールに時間を取られて、仕事が進まない」この状況の改善に最も効果的なのは、あなた自身が「適切な書き方」に沿ってメールを書くこと。その「原則」と「形式」を本書で学び、読み手の負担がいちばん少ない書き方を心がければ、無駄なやり取りが減り、メールに振り回されることがなくなる。第１章　なぜメールに振り回されるのか（頻繁なメールチェックは時間を無駄にする；「すべてをメールで」と考えない　ほか）第２章　振り回されないメール文の原則（メール文の３原則１　相手のメールをじっくり読む；メール文の３原則,文書作法 電子メール ,図書費,白山商会,,新書書架,,,２０１２．０２．１２,,False,,,,False,,,,False,True,False,,
978-4-062577-56-4,46406,2012/02/11,山はどうしてできるのか／ダイナミックな地球科学入門,ﾔﾏﾊﾄﾞｳｼﾃﾃﾞｷﾙﾉｶ/ﾀﾞｲﾅﾐｯｸﾅﾁｷｭｳｶｶﾞｸﾆｭｳﾓﾝ,,,ＢＬＵＥ　ＢＡＣＫＳ　１７５６,,藤岡　換太郎,ﾌｼﾞｵｶｶﾝﾀﾛｳ,,454.5,ﾌｶ,,講談社,2012,238,18,924,,あたりまえのように「そこにある」山は、いつ、どのようにしてできたのか―。あなたはこの問いに正しく答えられますか？実は「山ができる理由」は古来から、地質学者たちの大きな論争のテーマでした。山の成因には、地球科学のエッセンスがぎっしりと詰まっているのです。本書を読めば、なにげなく踏んでいる大地の見え方が変わってくることでしょう。準備運動　世界一高い山はエベレストか１合目　山を見るための４つの視点２合目　山の高さとは何か３合目　論争の夜明け４合目　大陸は移動する５,山岳,図書費,白山商会,,新書書架,,,２０１２．０２．１２,,False,,,,False,,,,False,True,False,,
978-4-062582-11-2,46042,2011/11/15,日常生活のなかの禅／修行のすすめ,ﾆﾁｼﾞｮｳｾｲｶﾂﾉﾅｶﾉｾﾞﾝ/ｼｭｷﾞｮｳﾉｽｽﾒ,,,講談社選書メチエ　２１１,,南　直哉,ﾐﾅﾐｼﾞｷｻｲ,,188.8,ﾐｼﾞ,,講談社,2009,262,19,1785,,日常生活の底に突如開く深淵―無常。根拠なき生をかかえ、「このままでよいのか」という想いにとらわれるとき、禅はラディカルな技術となる。永平寺の若き俊英が、釈尊・道元の教えを元に仏教思想を根幹から説き起こし、現代における禅の可能性を探る、アクチュアルな坐禅のすすめ。第１章　「根拠」の外部へ―本当の「自己」とは何か第２章　煩悩のトライアングル―「苦」としての実存第３章　システムとしての存在―「縁起」の思想第４章　「自己」とは何か―「方法」としての因果第５章　「自己」の倫理―生,,図書費,正文館書店,,,,,２０１１．１１．０７,,False,,,,False,,,,False,True,False,,
978-4-062582-30-9,46025,2011/11/10,日本語に主語はいらない／百年の誤謬を正す,ﾆﾎﾝｺﾞﾆｼｭｺﾞﾊｲﾗﾅｲ/ﾋｬｸﾈﾝﾉｺﾞﾋﾞｭｳｦﾀﾀﾞｽ,,,講談社選書メチエ　２３０,,金谷　武洋,ｶﾅﾔﾀｹﾋﾛ,,815,ｶﾀ,,講談社,2009,254,19,1575,,「愛らしい」「赤ん坊だ」「泣いた」―日本語の基本文はこの３種で必要十分である。英文法の安易な移植により生まれた日本語文法の「主語」信仰を完璧に論破する、すべての日本語話者、必携の書。序章　モントリオールの日本語教室から第１章　日本語に人称代名詞という品詞はいらない第２章　日本語に主語という概念はいらない第３章　助詞「は」をめぐる誤解第４章　生成文法からみた主語論第５章　日本語の自動詞／他動詞をめぐる誤解終章　モントリオールから訴える著者紹介金谷武洋［カナ,,図書費,正文館書店,,,,,２０１１．１１．０７,,False,,,,False,,,,False,True,False,,
978-4-062582-31-7,46016,2011/11/10,人類最古の哲学／カイエ・ソバージュ　１,ｼﾞﾝﾙｲｻｲｺﾉﾃﾂｶﾞｸ/ｶｲｴｿﾊﾞｰｼﾞｭ1,,,講談社選書メチエ　２３１,,中沢　新一,ﾅｶｻﾞﾜｼﾝｲﾁ,,164,ﾅｼ,1,講談社,2002,210,19,1575,,宇宙、自然、人間存在の本質を問う、はじまりの哲学＝神話。神話を司る「感覚の論理」とは？人類的分布をするシンデレラ物語に隠された秘密とは？宗教と神話のちがいとは？現実の力を再発見する知の冒険。序章　はじまりの哲学第１章　人類的分布をする神話の謎第２章　神話論理の好物第３章　神話としてのシンデレラ第４章　原シンデレラのほうへ第５章　中国のシンデレラ第６章　シンデレラに抗するシンデレラ第７章　片方の靴の謎終章　神話と現実著者紹介中沢新一［ナ,,図書費,正文館書店,,,,,２０１１．１１．０７,,False,,,,False,,,,False,True,False,,
978-4-062582-39-2,46017,2011/11/10,熊から王へ／カイエ・ソバージュ　２,ｸﾏｶﾗｵｳﾍ/ｶｲｴｿﾊﾞｰｼﾞｭ2,,,講談社選書メチエ　２３９,,中沢　新一,ﾅｶｻﾞﾜｼﾝｲﾁ,,164,ﾅｼ,2,講談社,2006,248,19,1680,,熊をカミとする狩猟民たちの「対称性の思考」とは？「哲学」と「権力」が共存する冬の祭りの秘密とは？王を戴く国家が「無法の野蛮」と結びつく根源へと遡行する。はじめに　カイエ・ソバージュ（Ｃａｈｉｅｒ　Ｓａｕｖａｇｅ）についてニューヨークからベーリング海峡へ失われた対称性を求めて原初、神は熊であった「対称性の人類学」入門海岸の決闘王にならなかった首長環太平洋の神話学へ「人食い」としての王「野生の思考」としての仏教補論　熊の主題をめぐる変奏曲著者,,図書費,正文館書店,,,,,２０１１．１１．０７,,False,,,,False,,,,False,True,False,,
978-4-062582-60-0,46018,2011/11/10,愛と経済のロゴス／カイエ・ソバージュ　３,ｱｲﾄｹｲｻﾞｲﾉﾛｺﾞｽ/ｶｲｴｿﾊﾞｰｼﾞｭ3,,,講談社選書メチエ　２６０,,中沢　新一,ﾅｶｻﾞﾜｼﾝｲﾁ,,164,ﾅｼ,3,講談社,2006,210,19,1575,,３３０．４／序章　全体性の運動としての「愛」と「経済」第１章　交換と贈与第２章　純粋贈与する神第３章　増殖の秘密第４章　埋蔵金から聖杯へ第５章　最後のコルヌコピア第６章　マルクスの悦楽第７章　聖霊と資本終章　荒廃国からの脱出著者紹介中沢新一［ナカザワシンイチ］１９５０年、山梨県生まれ。東京大学大学院人文科学研究科修士課程修了。現在、中央大学教授。宗教学者、思想家。著書に、『チベットのモーツァルト』（せりか書房、サントリー学芸賞）、『森のバロック』（せりか書房,,図書費,正文館書店,,,,,２０１１．１１．０７,,False,,,,False,,,,False,True,False,,
978-4-062582-71-6,46019,2011/11/10,神の発明／カイエ・ソバージュ　４,ｶﾐﾉﾊﾂﾒｲ/ｶｲｴｿﾊﾞｰｼﾞｭ4,,,講談社選書メチエ　２７１,,中沢　新一,ﾅｶｻﾞﾜｼﾝｲﾁ,,164,ﾅｼ,4,講談社,2005,208,19,1575,,１６１／内部視覚、瞑想、夢の時間…。「宗教的思考」の根源はどこにあるのか？精霊が超越を生む。高神から唯一神へ。“精神の考古学”が、神々の基本構造をあざやかに解き明かす。スピリットが明かす神の秘密脳の森の朝はじめての「超越」神にならなかったグレートスピリット自然史としての神の出現神々の基本構造（メビウス縫合型；トーラス型）高神から唯一神へ心の巨大爬虫類未来のスピリット著者紹介中沢新一［ナカザワシンイチ］１９５０年、山梨県生まれ。東京,,図書費,正文館書店,,,,,２０１１．１１．０７,,False,,,,False,,,,False,True,False,,
978-4-062582-88-0,46026,2011/11/10,英語にも主語はなかった／日本語文法から言語千年史へ,ｴｲｺﾞﾆﾓｼｭｺﾞﾊﾅｶｯﾀ/ﾆﾎﾝｺﾞﾌﾞﾝﾎﾟｳｶﾗｹﾞﾝｺﾞｾﾝﾈﾝｼﾍ,,,講談社選書メチエ　２８８,,金谷　武洋,ｶﾅﾔﾀｹﾋﾛ,,815,ｶﾀ,,講談社,2008,242,19,1575,,日本語に「主語」はない。それどころか、英語における「主語」の概念すら、実は歴史上遅れて発生した特殊なものなのだ。「主語」は普遍性を持たない文法概念なのである！千年の言語史を遡行して、「天」の言語と「地」の言語を説き明かす、壮大な比較文法論。序章　上昇気流に乗った英語第１章　「神の視点」と「虫の視点」第２章　アメリカよ、どこへ行く第３章　英語を遡る第４章　日本語文法から世界を見る第５章　最近の主語必要論著者紹介金谷武洋［カナヤタケヒロ］１９５１年北海道,,図書費,正文館書店,,,,,２０１１．１１．０７,,False,,,,False,,,,False,True,False,,
978-4-062582-91-0,46020,2011/11/10,対称性人類学／カイエ・ソバージュ　５,ﾀｲｼｮｳｾｲｼﾞﾝﾙｲｶﾞｸ/ｶｲｴｿﾊﾞｰｼﾞｭ5,,,講談社選書メチエ　２９１,,中沢　新一,ﾅｶｻﾞﾜｼﾝｲﾁ,,164,ﾅｼ,5,講談社,2005,302,19,1785,,神話、国家、経済、宗教、そして対称性人類学へ。「圧倒的な非対称」が支配する世界の根源を問う冒険、ここに堂々完結。抑圧された無意識の「自然」は甦るのか？「対称性の論理」が切り開く新たな世界とは？野生の思考としての仏教を媒介に、来るべき形而上学革命への展望を示す。序章　対称性の方へ第１章　夢と神話と分裂症第２章　はじめに無意識ありき第３章　“一”の魔力第４章　隠された知恵の系譜第５章　完成された無意識―仏教（１）第６章　原初的抑圧の彼方へ―仏教（２）第７,,図書費,正文館書店,,,,,２０１１．１１．０７,,False,,,,False,,,,False,True,False,,
978-4-062583-16-1,46041,2011/11/15,統合失調症あるいは精神分裂病／精神医学の虚実,ﾄｳｺﾞｳｼｯﾁｮｳｼｮｳｱﾙｲﾊｾｲｼﾝﾌﾞﾝﾚﾂﾋﾞｮｳ/ｾｲｼﾝｲｶﾞｸﾉｷｮｼﾞﾂ,,,講談社選書メチエ　３１６,,計見　一雄,ｹﾝﾐｶｽﾞｵ,,493.76,ｹｶ,,講談社,2010,283,19,1890,,目の前の何でもない風景が急にまがまがしく見える時。そこからはじまる「病」はいかに進展するのか？いかに回復していくのか？果たして何が「分裂」し、何が「失調」するのか？精神科急性期治療の第一線に立ち続けてきた著者が、従来「精神分裂病」に付随して語られてきた誤謬を論破し、治癒へつながる「病の本質」を解明する講義。第１回講義　決まり文句を疑う第２回講義　精神医学に潜む虚妄第３回講義　急性期医療と「陰性症状」第４回講義　現実と妄想第５回講義　妄想の発生と由来第６回講義,,図書費,正文館書店,,,,,２０１１．１１．０７,,False,,,,False,,,,False,True,False,,
978-4-062583-18-6,46037,2011/11/15,日本人の起源／古人骨からルーツを探る,ﾆﾎﾝｼﾞﾝﾉｷｹﾞﾝ/ｺｼﾞﾝｺﾂｶﾗﾙｰﾂｦｻｸﾞﾙ,,,講談社選書メチエ　３１８,,中橋　孝博,ﾅｶﾊｼﾀｶﾋﾛ,,469.91,ﾅﾀ,,講談社,2007,268,19,1785,,日本列島の旧石器時代はどこまでさかのぼれるか。縄文人から弥生人への移行の真相は。遠くアフリカ大陸に誕生した人類は、どのような道のりをたどり日本列島にたどり着いたのか―。最新の知見をもとに、「日本人の起源」へのさまざまな疑問を解き明かす。第１章　太古の狩人たち―旧石器時代の日本列島人第２章　人類の起源と進化第３章　アジアへ、そして日本列島へ第４章　日本人起源論―その論争史第５章　縄文人から弥生人へ第６章　倭国大乱から「日本」人の形成へ著者紹介中橋孝博［,,図書費,正文館書店,,,,,２０１１．１１．０７,,False,,,,False,,,,False,True,False,,
978-4-062583-19-4,46051,2011/11/15,夢の分析／生成する〈私〉の根源,ﾕﾒﾉﾌﾞﾝｾｷ/ｾｲｾｲｽﾙ｢ﾜﾀｼ｣ﾉｺﾝｹﾞﾝ,,,講談社選書メチエ　３１９,,川嵜　克哲,ｶﾜｻｷﾖｼｱｷ,,146.1,ｶﾖ,,講談社,2005,238,19,1575,,夢は「意味されるもの」の現前なのか、内面を解釈するものなのか―。海に落ちて沈んでいく夢、仕切りのないトイレの夢の分析から立ち現れる内面性と超越性の対立。古代から現代に至る人々の夢を辿りつつ、近代的な主体の誕生を読む。第１章　夢をめぐるフロイトとユング（反復夢とはなにか；精神分析と夢；神経症＝意識と無意識の妥協形成　ほか）第２章　落ちる夢―超越性をめぐって（「私」という主体のあり方；垂直軸と水平軸；シャーマニズムの治療観　ほか）第３章　トイレの夢―内面性をめぐって（排泄―「私」を,,図書費,正文館書店,,,,,２０１１．１１．０７,,False,,,,False,,,,False,True,False,,
978-4-062583-86-2,46031,2011/11/10,日本軍のインテリジェンス／なぜ情報が活かされないのか,ﾆﾎﾝｸﾞﾝﾉｲﾝﾃﾘｼﾞｪﾝｽ/ﾅｾﾞｼﾞｮｳﾎｳｶﾞｲｶｻﾚﾅｲﾉｶ,,,講談社選書メチエ　３８６,,小谷　賢,ｺﾀﾆｹﾝ,,391.6,ｺｹ,,講談社,2011,248,19,1680,,暗号解読など優れたインフォメーション解読能力を持ちながら、なぜ日本軍は情報戦に敗れたか。「作戦重視、情報軽視」「長期的視野の欠如」「セクショナリズム」。日本軍最大の弱点はインテリジェンス意識の欠如にあった。インテリジェンスをキーワードに日本的風土の宿痾に迫る。第１章　日本軍による情報収集活動第２章　陸軍の情報収集第３章　海軍の情報収集第４章　情報の分析・評価はいかになされたか第５章　情報の利用―成功と失敗の実例第６章　戦略における情報利用―太平洋戦争に至る政策決,太平洋戦争(1941～1945)∥タイヘイヨウセンソウ(1941-1945)      →: 上位語: 世界戦争(1939～1945)∥セカイセンソウ(1939-1945)      →: 関連語: 日中戦争(1937～1945)∥ニッチュウセンソウ(1937-1945)      →: 関連語: 太平洋戦争(1941～1945) -- 特攻隊∥タイヘイヨウセンソウ(1941-1945) -- トッコウタイ      →: 関連語: 玉音放送(1945)∥ギョクオンホウソウ(1945)  ,図書費,正文館書店,,,,,２０１１．１１．０７,,False,,,,False,,,,False,True,False,,
