978-4-041023-40-2,49149,2016/09/02,この日のために 池田勇人・東京五輪への軌跡 上,ｺﾉ ﾋ ﾉ ﾀﾒ ﾆ ｲｹﾀﾞ ﾊﾔﾄ ﾄｳｷｮｳｺﾞﾘﾝ ｴ ﾉ ｷｾｷ ｼﾞｮｳ,,,,,幸田 真音／著,ｺｳﾀﾞ ﾏｲﾝ,,913.6,ｺ,1,ＫＡＤＯＫＡＷＡ,2016,270p,20cm,1600,16022874,幻となったオリンピックを再び東京で開催しようと動き始める田畑政治。時を同じくして、池田勇人は大蔵省を経て、政治の世界へと身を投じていく…。知られざる東京オリンピック物語。『北国新聞』等連載を加筆修正。,イケダ ハヤト　池田勇人　イケダ ハヤト ショウセツ　池田勇人 小説,図書費,ＴＲＣ,1600,図書室,,,,,False,,,,False,,,,False,False,False,,
978-4-041023-53-2,49060,2016/06/02,レオナルドの扉,ﾚｵﾅﾙﾄﾞ ﾉ ﾄﾋﾞﾗ,,,,,真保 裕一／著,ｼﾝﾎﾟ ﾕｳｲﾁ,,913.6,ｼ,,ＫＡＤＯＫＡＷＡ,2015,397p,19cm,1500,15010926,イタリアに生まれた若き時計職人ジャンは、ある設計図が記された秘密のノートを巡り、フランス軍の追手に狙われることになる。レオナルド・ダ・ヴィンチが遺したノートを狙うフランス軍との攻防の行方は！？,,図書費,,1500,図書室,,,欧文タイトル：Ｄｏｏｒ　ｏｆ　Ｌｅｏｎａｒｄｏ,,False,,,,False,,,,False,False,False,,
978-4-041025-02-4,49050,2016/06/02,インフェルノ 上,ｲﾝﾌｪﾙﾉ,,,角川文庫 フ３３－１４,ｶﾄﾞｶﾜﾌﾞﾝｺ ﾌ-33-14,ダン・ブラウン／著 越前 敏弥／訳,ﾌﾞﾗｳﾝ ﾀﾞﾝ ｴﾁｾﾞﾝ ﾄｼﾔ ﾀﾞﾝﾌﾞﾗｳﾝ,,933.7,ﾌﾞ,1,ＫＡＤＯＫＡＷＡ,2016,305p,15cm,680,16009759,フィレンツェの病院で目覚めたラングドン教授は、ここ数日の記憶がないことに動揺する。そこに何者かによる銃撃が。医師シエナの手を借り逃げ出したラングドンは、ダンテ「神曲」の〈地獄篇〉に手がかりがあると気づくが…。,,図書費,,680,文庫書架,0,,,,False,,,,False,,,,False,False,False,,
978-4-041025-03-1,49052,2016/06/02,インフェルノ 下,ｲﾝﾌｪﾙﾉ,,,角川文庫 フ３３－１６,ｶﾄﾞｶﾜﾌﾞﾝｺ ﾌ-33-16,ダン・ブラウン／著 越前 敏弥／訳,ﾌﾞﾗｳﾝ ﾀﾞﾝ ｴﾁｾﾞﾝ ﾄｼﾔ ﾀﾞﾝﾌﾞﾗｳﾝ,,933.7,ﾌﾞ,3,ＫＡＤＯＫＡＷＡ,2016,289p,15cm,680,16009763,人類の未来を永久に変えてしまう、恐るべきゾブリストの野望。ＷＨＯ事務局長シンスキーと合流したラングドンは、目に見えぬ敵を追ってサン・マルコ大聖堂からイスタンブールへと飛ぶが…。,,図書費,,680,文庫書架,,,,,False,,,,False,,,,False,False,False,,
978-4-041025-04-8,49051,2016/06/02,インフェルノ 中,ｲﾝﾌｪﾙﾉ,,,角川文庫 フ３３－１５,ｶﾄﾞｶﾜﾌﾞﾝｺ ﾌ-33-15,ダン・ブラウン／著 越前 敏弥／訳,ﾌﾞﾗｳﾝ ﾀﾞﾝ ｴﾁｾﾞﾝ ﾄｼﾔ ﾀﾞﾝﾌﾞﾗｳﾝ,,933.7,ﾌﾞ,2,ＫＡＤＯＫＡＷＡ,2016,296p,15cm,680,16009761,医師シエナとともに、ヴェッキオ宮殿に向かったラングドンは、監視カメラ映像にダンテのデスマスクを盗み出す不審人物の姿を見て、驚愕する。一方、マスクの所有者で大富豪のゾブリストは、壮大な野望の持ち主だった…。,,図書費,,680,文庫書架,,,,,False,,,,False,,,,False,False,False,,
978-4-041025-27-7,49148,2016/09/05,記憶の渚にて,ｷｵｸ ﾉ ﾅｷﾞｻ ﾆﾃ,,,,,白石 一文／著,ｼﾗｲｼ ｶｽﾞﾌﾐ,,913.6,ｼ,,ＫＡＤＯＫＡＷＡ,2016,489p,20cm,1700,16033087,世界的ベストセラー作家の兄の不審死と遺された謎だらけの随筆。記憶とは食い違う原稿の真実が明かされるとき、「世界」は大きく揺らぎはじめる－。『北海道新聞』など新聞５紙連載を単行本化。,,図書費,ＴＲＣ,1700,図書室,,,,,False,,,,False,,,,False,False,False,,
978-4-041025-33-8,49151,2016/09/05,ＪＦＫ暗殺は日本の謀略だった オズワルドの陰で蠢く日本の巨悪三人組,ｼﾞｪｰ ｴﾌ ｹｰ ｱﾝｻﾂ ﾜ ﾆﾎﾝ ﾉ ﾎﾞｳﾘｬｸ ﾀﾞｯﾀ ｵｽﾞﾜﾙﾄﾞ ﾉ ｶｹﾞ ﾃﾞ ｳｺﾞﾒｸ ﾆﾎﾝ ﾉ ｷｮｱｸ ｻﾝﾆﾝｸﾞﾐ,,,,,グレン・Ｄ．デイビス／著 田中 敦／訳,ﾃﾞｲﾋﾞｽ ｸﾞﾚﾝ ﾀﾅｶ ｱﾂｼ ｸﾞﾚﾝDﾃﾞｲﾋﾞｽ,,253.0,ﾃﾞ,,ＫＡＤＯＫＡＷＡ,2016,302p,19cm,1800,16023830,暗殺の６年前、オズワルドは厚木基地に派遣され、謎の行動をとっていた。２０世紀最悪の犯罪に登場する謎の日本人たちは何者で、どんな役割を演じていたのか－。ケネディ暗殺に日本人が関与していたことを暴く。,ケネディダイトウリョウアンサツジケン　ケネディ大統領暗殺事件（１９６３）,図書費,ＴＲＣ,1800,図書室,,,,,False,,,,False,,,,False,False,False,,
978-4-041026-22-9,49261,2016/11/16,小説君の名は。,ｼｮｳｾﾂ ｷﾐ ﾉ ﾅ ﾜ,,,角川文庫 し５７－３,,新海 誠／著,ｼﾝｶｲ ﾏｺﾄ,,913.6,シ,,ＫＡＤＯＫＡＷＡ,2016,262p,15cm,560,16030888,田舎町に暮らす女子高校生・三葉は、自分が男の子になる夢を見る。一方、東京で暮らす男子高校生・滝も自分が女子高校生になる夢を見る。２人は夢の中で入れ替わっていることに気づくが…。２０１６年８月公開映画の原作小説。,,図書費,ＴＲＣ,560,文庫書架,,,,,False,,,,False,,,,False,False,False,,
978-4-041030-11-0,49263,2016/11/16,ハリー・オーガスト、１５回目の人生,ﾊﾘｰ ｵｰｶﾞｽﾄ ｼﾞｭｳｺﾞｶｲﾒ ﾉ ｼﾞﾝｾｲ,,,角川文庫 ノ２－１,ｶﾄﾞｶﾜ ﾌﾞﾝｺ ﾉ-2-1,クレア・ノース／著 雨海 弘美／訳,ﾉｰｽ ｸﾚｱ ｱﾏｶﾞｲ ﾋﾛﾐ ｸﾚｱﾉｰｽ,,933.7,ノ,,ＫＡＤＯＫＡＷＡ,2016,526p,15cm,1160,16042439,ハリー・オーガストは、死んでも誕生時と同じ状況で、記憶を残したまま生まれ変わる体質を持っていた。彼は１１回目の人生で、自分が世界の終わりをとめなければいけないことを知る。終焉の原因は、同じ体質を持つ科学者で…。,,図書費,ＴＲＣ,1160,文庫書架,,,,,False,,,,False,,,,False,False,False,,
978-4-041034-64-4,49057,2016/06/02,バベル九朔,ﾊﾞﾍﾞﾙ ｷｭｳｻｸ,,,,,万城目 学／著,ﾏｷﾒ ﾏﾅﾌﾞ,,913.6,ﾏ,,ＫＡＤＯＫＡＷＡ,2016,430p,20cm,1600,16014416,作家志望の「俺」が管理人を務める雑居ビル「バベル九朔」で奇妙な事件が頻発。ある絵に触れた瞬間、なぜか「俺」は湖にいた。そこで出会った少女に「鍵」を渡されると、巨大な塔が現れ…。『文芸カドカワ』掲載を単行本化。,,図書費,,1600,図書室,,,,,False,,,,False,,,,False,False,False,,
978-4-041036-33-4,49150,2016/09/06,この日のために 池田勇人・東京五輪への軌跡 下,ｺﾉﾋ ﾉ ﾀﾒ ﾆ ｲｹﾀﾞ ﾊﾔﾄ ﾄｳｷｮｳ ｺﾞﾘﾝ ｴ ﾉ ｷｾｷ,,,,,幸田 真音／著,ｺｳﾀﾞ ﾏｲﾝ,,913.6,ｺ,2,ＫＡＤＯＫＡＷＡ,2016,271p,20cm,1600,16022875,「記憶に残る大会に」「経済成長に弾みを」というそれぞれの理想を掲げて奔走した池田勇人と田畑政治。そしてついに五輪開催の日が訪れた…。知られざる東京オリンピック物語。『北国新聞』等連載を加筆修正。,イケダ ハヤト　池田勇人　イケダ ハヤト ショウセツ　池田勇人 小説,図書費,ＴＲＣ,1600,図書室,,,,,False,,,,False,,,,False,False,False,,
978-4-041036-43-3,49055,2016/06/02,倒れるときは前のめり,ﾀｵﾚﾙ ﾄｷ ﾜ ﾏｴﾉﾒﾘ,,,,,有川 浩／著,ｱﾘｶﾜ ﾋﾛ,,914.6,ｱ,,ＫＡＤＯＫＡＷＡ,2016,344p,19cm,1400,16004654,「図書館戦争」等で人気の作家、有川浩のエッセイ集。日々のつれづれ、創作の裏側、愛する本や映画のことなど、デビュー書籍刊行前の２００３年～２０１５年までの全９４本のほか、小説「ゆず、香る」「彼の本棚」も特別収録。,,図書費,,1400,図書室,,,,,False,,,,False,,,,False,False,False,,
978-4-041036-47-1,49146,2016/08/31,英国一家、インドで危機一髪,ｴｲｺｸｲｯｶ ｲﾝﾄﾞ ﾃﾞ ｷｷｲｯﾊﾟﾂ,,,,,マイケル・ブース／著 寺西 のぶ子／訳,ﾌﾞｰｽ ﾏｲｹﾙ ﾃﾗﾆｼ ﾉﾌﾞｺ ﾏｲｹﾙﾌﾞｰｽ,,292.5,ﾌﾞ,,ＫＡＤＯＫＡＷＡ,2016,355p,19cm,1800,16017696,４０歳を目前にしてキレやすく怒りっぽくなった僕に妻が言った。「みんなでインドに行きましょう」　こうして英国一家のインド旅行が始まった！　そして僕の人生の大転換が！？　生きるヒント満載の爆笑エッセイ。,インド キコウアンナイキ　インド 紀行・案内記,図書費,ＴＲＣ,1800,図書室,,,,,False,,,,False,,,,False,False,False,,
978-4-041039-04-5,49156,2016/09/02,ファミリー・レス,ﾌｧﾐﾘｰ ﾚｽ,,,,,奥田 亜希子／著,ｵｸﾀﾞ ｱｷｺ,,913.6,ｵ,,ＫＡＤＯＫＡＷＡ,2016,270p,19cm,1600,16027318,同じ屋根の下で暮らす女ともだち。ふたつきに一度だけ会う親子。本当の親子になりたい母親と、亡き姉の娘。家族とも他人ともいえない現代的な６つの関係性を描く短編集。『小説野性時代』掲載に書き下ろしを加えて単行本化。,,図書費,ＴＲＣ,1600,図書室,,,欧文タイトル：ＦＡＭＩＬＹ　ＬＥＳＳ,,False,,,,False,,,,False,False,False,,
978-4-041041-26-0,49152,2016/09/06,代体,ﾀﾞｲﾀｲ,,,,,山田 宗樹／著,ﾔﾏﾀﾞ ﾑﾈｷ,,913.6,ﾔ,,ＫＡＤＯＫＡＷＡ,2016,416p,20cm,1700,16027500,人間の意識を移転させる技術がビジネスとなった世界。意識を容れることができる身体型の器「代体」の大手メーカー営業マンの八田は、代体に絡む利権や悪意が渦巻く陰謀に次第に巻き込まれてゆく…。,,図書費,ＴＲＣ,1700,図書室,,,,,False,,,,False,,,,False,False,False,,
978-4-041043-27-1,49109,2016/06/30,ホセ・ムヒカ　世界でいちばん貧しい大統領,ﾎｾ ﾑﾋｶ ｾｶｲ ﾃﾞ ｲﾁﾊﾞﾝ ﾏｽﾞｼｲ ﾀﾞｲﾄｳﾘｮｳ ,,,角川文庫 ム３－１,ｶﾄﾞｶﾜﾌﾞﾝｺ ﾑ-3-1,アンドレス・ダンサ／著 エルネスト・トゥルボヴィッツ／著 大橋 美帆／訳,ﾀﾞﾝｻ ｱﾝﾄﾞﾚｽ ﾄｩﾙﾎﾞｳﾞｨｯﾂ ｴﾙﾈｽﾄ ｵｵﾊｼ ﾐﾎ ｱﾝﾄﾞﾚｽﾀﾞﾝｻ ｴﾙﾈｽﾄﾄｩﾙﾎﾞｳﾞｨｯﾂ,,289.3,ﾀﾞ,,ＫＡＤＯＫＡＷＡ,2016,330p,15cm,760,16015831,国連会議でのスピーチで世界中から注目された、第４０代ウルグアイ大統領、ホセ・ムヒカ。大統領時代には言えなかった本音を、１９年間、彼に取材を続けてきた現地政治ジャーナリストらが描き出す。,ムヒカ・コルダノ Ｊ．Ａ．,図書費,ＴＲＣ,760,文庫書架,,,「悪役」（汐文社　２０１５年刊）の改題，加筆修正,,False,,,,False,,,,False,False,False,,
978-4-041047-61-3,49399,2017/01/31,いまさら翼といわれても,ｲﾏｻﾗ ﾂﾊﾞｻ ﾄ ｲﾜﾚﾃﾓ,,,〔〈古典部〉シリーズ〕 〔６〕,ｺﾃﾝﾌﾞｼﾘｰｽﾞ 6,米澤 穂信／著,ﾖﾈｻﾞﾜ ﾎﾉﾌﾞ,,913.6,ﾖ,,ＫＡＤＯＫＡＷＡ,2016,353p,20cm,1480,16058409,奉太郎が「省エネ主義」になったきっかけ、えるが合唱祭の出番前に行方不明になったわけ－。〈古典部〉メンバーの新たな一面に出会う、瑞々しくも時にビターな全６篇を収録。『小説　野性時代』『文芸カドカワ』掲載を書籍化。,,図書費,ＴＲＣ,1480,図書室,,,,,False,,,,False,,,,False,False,False,,
978-4-041049-14-3,49401,2017/01/31,汚れつちまつた悲しみに… 中原中也詩集,ﾖｺﾞﾚﾂﾁﾏﾂﾀｶﾅｼﾐﾆ ﾅｶﾊﾗﾁｭｳﾔｼｼｭｳ,,,角川文庫 な５－３,ｶﾄﾞｶﾜﾌﾞﾝｺ ﾅ-5-3,中原 中也／著 佐々木 幹郎／編,ﾅｶﾊﾗ ﾁｭｳﾔ ｻｻｷ ﾐｷﾛｳ,,911.5,ﾅ,,ＫＡＤＯＫＡＷＡ,2016,253p,15cm,560,16049592,日本の近代詩史に偉大な足跡を残した夭折の詩人中原中也。３０年の生涯で作られた詩の中に頻出した言葉、「生きる」「恋する」「悲しむ」を基軸に、制作年月推定順に作品を精選。中也の素顔を浮かび上がらせるアンソロジー。,,図書費,ＴＲＣ,560,図書室,,,,,False,,,,False,,,,False,False,False,,
978-4-044000-93-6,49154,2016/09/01,流れをつかむ日本の歴史,ﾅｶﾞﾚ ｵ ﾂｶﾑ ﾆﾎﾝ ﾉ ﾚｷｼ,,,,,山本 博文／著,ﾔﾏﾓﾄ ﾋﾛﾌﾐ,,210.1,ﾔ,,ＫＡＤＯＫＡＷＡ,2016,318p,19cm,1500,16027272,日本人はどこから来た？　慶喜はなぜ大政奉還を決意したのか？　ＩＳＩＳ（イスラム国）が生まれた背景とは？　教科書の執筆にも携わる第一線の歴史家が、最新の研究成果を反映して書き下ろした日本通史。,ニホン レキシ　日本 歴史,図書費,ＴＲＣ,1500,図書室,,,,,False,,,,False,,,,False,False,False,,
978-4-044271-01-5,49062,2016/06/02,氷菓,ﾋｮｳｶ,,,角川文庫 よ２３－１,ｶﾄﾞｶﾜﾌﾞﾝｺ ﾖ-23-1,米澤 穂信／著,ﾖﾈｻﾞﾜ ﾎﾉﾌﾞ,,913.6,ﾖ,,角川グループパブリッシング（発売）,200,217p,15cm,457,12143968,いつのまにか密室になった教室。毎週必ず借り出される本。あるはずの文集をないと言い張る少年。そして『氷菓』という題名の文集に秘められた三十三年前の真実―。何事にも積極的には関わろうとしない“省エネ”少年・折木奉太郎は、なりゆきで入部した古典部の仲間に依頼され、日常に潜む不思議な謎を次々と解き明かしていくことに。さわやかで、ちょっぴりほろ苦い青春ミステリ登場！第五回角川学園小説大賞奨励賞受賞。,,図書費,,457,文庫書架,2,,３３版,,False,,,,False,,,,False,False,False,,
978-4-044271-02-2,49110,2016/06/30,愚者のエンドロール,ｸﾞｼｬ ﾉ ｴﾝﾄﾞﾛｰﾙ,,,角川文庫 よ２３－２ 〔〈古典部〉シリーズ〕 〔２〕,ｶﾄﾞｶﾜﾌﾞﾝｺ ﾖ-23-2 ｺﾃﾝﾌﾞｼﾘｰｽﾞ 2,米澤 穂信／著,ﾖﾈｻﾞﾜ ﾎﾉﾌﾞ,,913.6,ﾖ,,角川グループパブリッシング（発売）,2002,254p,15cm,560,10143821,「折木さん、わたしとても気になります」文化祭に出展するクラス製作の自主映画を観て千反田えるが呟いた。その映画のラストでは、廃屋の鍵のかかった密室で少年が腕を切り落とされ死んでいた。誰が彼を殺したのか？その方法は？だが、全てが明かされぬまま映画は尻切れとんぼで終わっていた。続きが気になる千反田は、仲間の折木奉太郎たちと共に結末探しに乗り出した！さわやかで、ちょっぴりほろ苦い青春ミステリの傑作。,,図書費,ＴＲＣ,560,文庫書架,,,２０版,,False,,,,False,,,,False,False,False,,
978-4-044271-03-9,49053,2016/06/02,クドリャフカの順番 Ｗｅｌｃｏｍｅ　ｔｏ　ＫＡＮＹＡ　ＦＥＳＴＡ！,ｸﾄﾞﾘｬﾌｶﾉｼﾞｭﾝﾊﾞﾝ ｳｪﾙｶﾑﾄｩｰｶﾝﾔﾌｪｽﾀ,,,角川文庫 よ２３－３,ｶﾄﾞｶﾜﾌﾞﾝｺ ﾖ-23-3,米澤 穂信／著,ﾖﾈｻﾞﾜ ﾎﾉﾌﾞ,,913.6,ﾖ,,ＫＡＤＯＫＡＷＡ,200,393p,15cm,640,14144372,待望の文化祭が始まった。だが折木奉太郎が所属する古典部で大問題が発生。手違いで文集「氷菓」を作りすぎたのだ。部員が頭を抱えるそのとき、学内では奇妙な連続盗難事件が起きていた。盗まれたものは碁石、タロットカード、水鉄砲―。この事件を解決して古典部の知名度を上げよう！目指すは文集の完売だ！！盛り上がる仲間たちに後押しされて、奉太郎は事件の謎に挑むはめに…。大人気“古典部”シリーズ第３弾。,,図書費,,640,文庫書架,,,２９版,,False,,,,False,,,,False,False,False,,
978-4-044271-04-6,49153,2016/08/31,遠まわりする雛,ﾄｵﾏﾜﾘ ｽﾙ ﾋﾅ,,,角川文庫 よ２３－４ 〔〈古典部〉シリーズ〕 〔４〕,ｶﾄﾞｶﾜﾌﾞﾝｺ ﾖ-23-4 ｺﾃﾝﾌﾞ ｼﾘｰｽﾞ 4,米澤 穂信／著,ﾖﾈｻﾞﾜ ﾎﾉﾌﾞ,,913.6,ﾖ,,ＫＡＤＯＫＡＷＡ,2010,410p,15cm,629,15140807,省エネをモットーとする折木奉太郎は“古典部”部員・千反田えるの頼みで、地元の祭事「生き雛まつり」へ参加する。十二単をまとった「生き雛」が町を練り歩くという祭りだが、連絡の手違いで開催が危ぶまれる事態に。千反田の機転で祭事は無事に執り行われたが、その「手違い」が気になる彼女は奉太郎とともに真相を推理する―。あざやかな謎と春に揺れる心がまぶしい表題作ほか“古典部”を過ぎゆく１年を描いた全７編。,,図書費,ＴＲＣ,629,文庫書架,,,２４版,,False,,,,False,,,,False,False,False,,
978-4-046015-45-7,49147,2016/09/05,関白秀次の切腹,ｶﾝﾊﾟｸ ﾋﾃﾞﾂｸﾞ ﾉ ｾｯﾌﾟｸ,,,,,矢部 健太郎／著,ﾔﾍﾞ ｹﾝﾀﾛｳ,,289.1,ﾔ,,ＫＡＤＯＫＡＷＡ,2016,301p,18cm,1000,16016768,秀吉は秀頼のために〈殺生関白〉の悪名高い秀次に追放・切腹を命じた－。本当に秀次は命令されて切腹したのか？　秀吉は数少ない肉親を殺そうとしたのか？　通説とはまったく異なる彼らの姿を、史料から浮かび上がらせる。,トヨトミ ヒデツグ　トヨトミ ヒデヨシ　豊臣秀次　豊臣秀吉,図書費,ＴＲＣ,1000,図書室,,,欧文タイトル：Ｔｈｅ　Ｍｙｓｔｅｒｙ　ｏｆ　Ｈｉｄｅｔｓｕｇｕ ｓ　ＳＥＰＰＵＫＵ,,False,,,,False,,,,False,False,False,,
978-4-046016-41-6,49155,2016/09/05,２時間でわかるマクニールの『世界史』,ﾆｼﾞｶﾝ ﾃﾞ ﾜｶﾙ ﾏｸﾆｰﾙ ﾉ ｾｶｲｼ,,,,,関 真興／著,ｾｷ ｼﾝｺｳ,,209,ｾ,,ＫＡＤＯＫＡＷＡ,2016,348p,19cm,1500,16025022,「それはなぜ起こったか？」がわかれば、もっと面白い！　全世界で読み継がれている歴史の名著、マクニールの「世界史」を徹底解説。「世界史」がもつエッセンスを整理し、より簡便にまとめ直して、その奥深い魅力を伝える。,マクニール ウィリアム・ハーディ　セカイシ　世界史（マクニール）,図書費,ＴＲＣ,1500,図書室,,,,,False,,,,False,,,,False,False,False,,
978-4-047035-63-8,49054,2016/06/02,真田信繁 幸村と呼ばれた男の真実,ｻﾅﾀﾞﾉﾌﾞｼｹﾞ ﾕｷﾑﾗﾄﾖﾊﾞﾚﾀｵﾄｺﾉｼﾝｼﾞﾂ,,,角川選書 ５６３,ｶﾄﾞｶﾜｾﾝｼｮ 563,平山 優／著,ﾋﾗﾔﾏ ﾕｳ,,289.1,ﾋ,,ＫＡＤＯＫＡＷＡ,2015,383p,19cm,1800,15054378,文書や軍記物、絵図や布陣図ほか数少ない史料を博捜し、真田信繁をめぐる通説・俗説・新説をその根本から再検証。旧来の大坂の陣論や家康謀略論をも問い直し、幾多の謎に包まれた「不思議なる弓取」の実像を解き明かす。,サナダ ユキムラ　真田幸村,図書費,,1800,図書室,,,,,False,,,,False,,,,False,False,False,,
978-4-048662-26-0,49058,2016/06/02,ビブリア古書堂の事件手帖 ５ 栞子さんと繋がりの時,ﾋﾞﾌﾞﾘｱｺｼｮﾄﾞｳ ﾉ ｼﾞｹﾝﾃﾁｮｳ ｼｵﾘｺｻﾝ ﾄ ﾂﾅｶﾞﾘ ﾉ ﾄｷ,,,メディアワークス文庫 み４－５,ﾒﾃﾞｨｱﾜｰｸｽﾌﾞﾝｺ ﾐ-4-5,三上 延／著,ﾐｶﾐ ｴﾝ,,913.6,ﾐ,5,ＫＡＤＯＫＡＷＡ,2014,307p,15cm,570,14003834,静かにあたためてきた想い。無骨な青年店員の告白は美しき女店主との関係に波紋を投じる。古書にまつわる人々の数奇な物語－それにより女店主の心にも変化が？　すべての答えの出る時が迫っていた…。,,図書費,,570,文庫書架,,,４までの出版者：アスキー・メディアワークス,,False,,,,False,,,,False,False,False,,
978-4-048691-89-5,49059,2016/06/02,ビブリア古書堂の事件手帖 ６ 栞子さんと巡るさだめ,ﾋﾞﾌﾞﾘｱｺｼｮﾄﾞｳﾉｼﾞｹﾝﾃﾁｮｳ ｼｵﾘｺｻﾝﾄﾒｸﾞﾙｻﾀﾞﾒ,,,メディアワークス文庫 み４－６,ﾒﾃﾞｨｱﾜｰｸｽﾌﾞﾝｺ ﾐ-4-6,三上 延／著,ﾐｶﾐ ｴﾝ,,913.6,ﾐ,6,ＫＡＤＯＫＡＷＡ,2014,315p,15cm,400057,15000518,太宰治の「晩年」を奪うため、美しき女店主に危害を加えた青年が、ビブリア古書堂の２人の前に依頼者として現れる。本を追ううち、２人は太宰の稀覯本を巡る盗難事件に辿り着く。それには２人の祖父母が関わっていた…。,,図書費,,570,文庫書架,,,,,False,,,,False,,,,False,False,False,,
978-4-048763-62-2,49242,2016/09/12,１７音の青春 五七五で綴る高校生のメッセージ ２０１６,ｼﾞｭｳﾅﾅｵﾝ ﾉ ｾｲｼｭﾝ ｺﾞｼﾁｺﾞ ﾃﾞ ﾂｽﾞﾙ ｺｳｺｳｾｲ ﾉ ﾒｯｾｰｼﾞ,,,,,神奈川大学広報委員会／編,ｶﾅｶﾞﾜﾀﾞｲｶﾞｸ ｸｺｳﾎｳ ｲｲﾝｶｲ,,911.3,ｼﾞ,16,ＫＡＤＯＫＡＷＡ（発売）,2016,157p,18cm,700,16013889,１７音の俳句に凝縮された高校生たちの青春の日々…。第１８回神奈川大学全国高校生俳句大賞の入選作品を紹介する。応募高校一覧、団体賞受賞高校一覧、選考座談会なども収録。,ハイク クシュウ　俳句 句集,図書費,ＴＲＣ,700,図書室,,,２０１５の出版者：ＫＡＤＯＫＡＷＡ,,False,,,,False,,,,False,False,False,,
978-4-048914-27-7,49044,2016/06/02,ビブリア古書堂の事件手帖 ４ 栞子さんと二つの顔,ﾋﾞﾌﾞﾘｱ ｺｼｮﾄﾞｳ ﾉ ｼﾞｹﾝﾃﾁｮｳ ｼｵﾘｺｻﾝ ﾄ ﾌﾀﾂ ﾉ ｶｵ,,,メディアワークス文庫 み４－４,ﾒﾃﾞｨｱﾜｰｸｽﾌﾞﾝｺ ﾐ-4-4,三上 延／著,ﾐｶﾐ ｴﾝ,,913.6,ﾐ,4,角川グループパブリッシング（発売）,2013,333p,15cm,570,13008921,ビブリア古書堂の２人は、江戸川乱歩の膨大なコレクションを譲る代わりに、ある人物が残した精巧な金庫を開けてほしいと依頼される。美しき女店主とその母、謎解きは２人の知恵比べの様相を呈してくるのだが…。,,図書費,,570,文庫書架,,,,,False,,,,False,,,,False,False,False,,
978-4-048996-03-7,49061,2016/06/02,ギネス世界記録 ２０１６,ｷﾞﾈｽ ｾｶｲｷﾛｸ,,,,,クレイグ・グレンディ／編 大木 哲／ほか訳,ｸﾞﾚﾝﾃﾞｨ ｸﾚｲｸﾞ ｵｵｷ ﾃﾂ ｸﾚｲｸﾞｸﾞﾚﾝﾃﾞｨ,,031.5,ｷﾞ,16,ＫＡＤＯＫＡＷＡ（発売）,2015,18 255p,28cm,3056,15046061,宇宙から、冒険、エンタテインメント、スポーツまで、あらゆるジャンルのギネス世界記録を網羅。日本各地で生まれた世界一の記録も収録。サイトにアクセスすると記録の舞台裏映像など限定公開のコンテンツが見られる。,,図書費,,3056,図書室,,,,,False,,,,False,,,,False,False,False,,
978-4-048996-06-8,49264,2016/11/16,ギネス世界記録 ２０１７,ｷﾞﾈｽ ｾｶｲ ｷﾛｸ,,,,,クレイグ・グレンディ／編 大木 哲／ほか訳,ｸﾞﾚﾝﾃﾞｨ ｸﾚｲｸﾞ ｵｵｷ ﾃﾂ ｸﾚｲｸﾞｸﾞﾚﾝﾃﾞｨ,,031.5,ギ,17,ＫＡＤＯＫＡＷＡ（発売）,2016,18 255p,28cm,3056,16043865,宇宙から、冒険、エンタテインメント、スポーツまで、あらゆるジャンルのギネス世界記録を網羅。３Ｄプリント技術、ロボットなどさまざまなテーマも取り上げる。日本人がもつ世界記録や日本各地で生まれた世界一の記録も収録。,,図書費,ＴＲＣ,3056,図書室,,,,,False,,,,False,,,,False,False,False,,
978-4-061498-91-4,49294,2016/11/17,生物と無生物のあいだ,ｾｲﾌﾞﾂ ﾄ ﾑｾｲﾌﾞﾂ ﾉ ｱｲﾀﾞ,,,講談社現代新書 １８９１,ｺｳﾀﾞﾝｼｬ ｹﾞﾝﾀﾞｲｼﾝｼｮ 1891,福岡 伸一／著,ﾌｸｵｶ ｼﾝｲﾁ,,460.4,フ,,講談社,2007,285p,18cm,740,07026195,「生きている」とはどういうことか？　分子生物学がたどりついた地平を、歴史の闇に沈んだ科学者たちに光を当てながら平易に明かす。ページをめくる手がとまらない極上の科学ミステリー。,セイメイカガク　生命科学,図書費,ＴＲＣ,740,新書書架,,サントリー学芸賞（第29回），新書大賞（2008）　,,,False,,,,False,,,,False,False,False,,
