9784-065147023,80177,2021/06/03,潮騒のアニマ,ｼｵｻｲ ﾉ ｱﾆﾏ,,,講談社文庫　か１３２－６,ｺｳﾀﾞﾝｼｬﾌﾞﾝｺ ｶ-132-6,川瀬 七緒 著,ｶﾜｾ ﾅﾅｵ,,913.6,ｶ,,講談社,2019,501p,15cm,900,19006658,小さな離島で、ミイラ化した若い女性の遺体が発見された。解剖医は、首吊り自殺で死後３カ月以上との見解を示したが、法医昆虫学者・赤堀涼子は、遺体に「昆虫相」がないことに目を留め…。警察ミステリー。,,図書費,白山商会,891,文庫書架,,,,,False,,,,False,,,,False,False,True,,
9784-065151105,80408,2021/12/06,ふたつの日本　「移民国家」の建前と現実,ﾌﾀﾂ ﾉ ﾆﾎﾝ,,,講談社現代新書　２５１６,ｺｳﾀﾞﾝｼｬｹﾞﾝﾀﾞｲｼﾝｼｮ 2516,望月 優大 著,ﾓﾁｽﾞｷ ﾋﾛｷ,,334.41,ﾓ,,講談社,2019,222p,18cm,840,19011847,日本はすでに「移民国家」だ。止まらない人口減少の背後で、日本に暮らす外国人は増加の一途をたどっている。日本と移民との関係性を論じ、大きく変わる「国のかたち」の全体像をつかむ。５０点以上の図表も収録。,イミンショクミン　ガイコクジンロウドウシャ　移民・植民　外国人労働者,図書費,白山商会,832,新書書架,,,,,False,,,,False,,,,False,False,True,,
9784-065174791,51655,2022/01/18,宇宙の終わりに何が起こるのか,ｳﾁｭｳ ﾉ ｵﾜﾘ ﾆ ﾅﾆ ｶﾞ ｵｺﾙ ﾉｶ,,,,,ケイティ・マック 著　吉田 三知世 訳,ﾏｯｸ ｹｲﾃｨ ﾖｼﾀﾞ ﾐﾁﾖ ｹｲﾃｨﾏｯｸ,,443.9,マ,,講談社,2022,365p,19cm,1800,21037808,この宇宙はどうやって終わるのか？　ビッグクランチ（収縮して潰れる）、熱的死（膨張してあらゆる活動が停止する）、ビッグリップ（急激に膨張してズタズタになる）…。最新理論が予言する、５つの宇宙終焉シナリオを紹介。,ウチュウロン　宇宙論,図書費,ＴＲＣ,1800,図書室,,,,,False,,,,False,,,,False,False,False,,
9784-065177174,51659,2022/01/18,これでおしまい,ｺﾚ ﾃﾞ ｵｼﾏｲ,,,,,篠田 桃紅 著,ｼﾉﾀﾞ ﾄｳｺｳ,,728.2,シ,,講談社,2021,255p,20cm,1400,21015267,人間は死ぬまで一生迷路に入っているんです。迷いと、自ずから何とかなるだろうという楽観的な考え方とがいつもやり合っている－。１０７歳、世界的美術家が遺した「人生のことば」をまとめる。,シノダ トウコウ　篠田桃紅,図書費,ＴＲＣ,1400,図書室,,,,,False,,,,False,,,,False,False,False,,
9784-065205914,80248,2021/09/14,紅のアンデッド,ｸﾚﾅｲ ﾉ ｱﾝﾃﾞｯﾄﾞ,,,講談社文庫　か１３２－８,ｺｳﾀﾞﾝｼｬﾌﾞﾝｺ ｶ-132-8,川瀬 七緒 著,ｶﾜｾ ﾅﾅｵ,,913.6,ｶ,,講談社,2020,471p,15cm,840,20033583,東京都内の一軒家で、すさまじい量の血の痕と切断された左手の小指３本だけが発見された。殺人とも断定できずにいる中、法医昆虫学者の赤堀は、解剖医と大幅に違う被害者の死亡月日を推定し…。警察ミステリー。,,図書費,白山商会,832,文庫書架,,,,,False,,,,False,,,,False,False,True,,
9784-065208083,51553,2021/07/08,桜宵,ｻｸﾗ ﾖｲ,,,講談社文庫　き４１－１１,ｺｳﾀﾞﾝｼｬﾌﾞﾝｺ ｷ-41-11,北森 鴻 著,ｷﾀﾓﾘ ｺｳ,,913.6,キ,,講談社,2021,291p,15cm,680,21011510,妻の死から１年。警察官の神崎守衛は、遺品の中から手紙を見つける。三軒茶屋のビアバー〈香菜里屋〉に、妻は「最後のプレゼント」を用意したというが…。表題作ほか全５編を収めた連作短編ミステリー。,,図書費,ＴＲＣ,680,文庫書架,,,,,False,,,,False,,,,False,False,False,,
9784-065208120,51554,2021/07/08,螢坂,ﾎﾀﾙｻﾞｶ,,,講談社文庫　き４１－１２,ｺｳﾀﾞﾝｼｬﾌﾞﾝｺ ｷ-41-12,北森 鴻 著,ｷﾀﾓﾘ ｺｳ,,913.6,キ,,講談社,2021,256p,15cm,650,21017647,カメラマンの有坂はビアバー〈香菜里屋〉に辿り着く。１６年前に別れた恋人の名を耳にした有坂は、マスター工藤に心をほぐされ、胸の奥底にしまっていた過去を語り始める。そこには思いもよらぬ謎が…。連作短編ミステリー。,,図書費,ＴＲＣ,650,文庫書架,,,,,False,,,,False,,,,False,False,False,,
9784-065213070,80407,2021/12/06,狐のちょうちん,ｷﾂﾈ ﾉ ﾁｮｳﾁﾝ,,,講談社文庫　さ１１４－１２,ｺｳﾀﾞﾝｼｬﾌﾞﾝｺ ｻ-114-12,佐々木 裕一 著,ｻｻｷ ﾕｳｲﾁ,,913.6,ｻ,,講談社,2020,367p,15cm,740,20042785,１５歳の公家・信平は仏門に入らず、家光の正室である姉を頼って江戸に出た。貧乏旗本暮らしを始めた信平は、清き心と秘剣の腕で、江戸を大きく揺り動かし…。鷹司松平家を立ち上げた実在の傑人を描くシリーズの始まりの物語。,,図書費,白山商会,733,文庫書架,,,,,False,,,,False,,,,False,False,True,,
9784-065215708,51416,2021/06/22,悪魔を殺した男,ｱｸﾏ ｵ ｺﾛｼﾀ ｵﾄｺ,,,,,神永 学 著,ｶﾐﾅｶﾞ ﾏﾅﾌﾞ,,913.6,カ,,講談社,2020,425p,20cm,1750,20049180,「逆さ五芒星」連続殺人事件の犯人はひとり白い密室にいた。孤独な病棟にたたずむ「悪魔」はなにを黙考するのか？　嫉妬、陰謀、欲望、快楽…業に塗れた人間が引き起こす事件は、新たな事件を呼び…。サスペンス・ミステリー。,,図書費,ＴＲＣ,1750,図書室,,,,,False,,,,False,,,,False,False,False,,
9784-065220023,51417,2021/06/22,完パケ！,ｶﾝﾊﾟｹ,,,講談社文庫　ぬ３－１,ｺｳﾀﾞﾝｼｬﾌﾞﾝｺ ﾇ-3-1,額賀 澪 著,ﾇｶｶﾞ ﾐｵ,,913.6,ヌ,,講談社,2021,338p,15cm,700,21007070,経営難で閉校が噂される武蔵映像大学で、卒業制作の映画を撮れるのは、たった一人。監督志望の安原と北川は、コンペでガチンコ勝負することに。撮影は、前途多難の幕開けとなったが…。苦悩と成長の青春ストーリー。,,図書費,ＴＲＣ,700,文庫書架,,,,,False,,,,False,,,,False,False,False,,
9784-065224120,51418,2021/06/22,ステップファザー・ステップ,ｽﾃｯﾌﾟﾌｧｻﾞｰ ｽﾃｯﾌﾟ,,,講談社文庫　み４２－１９,ｺｳﾀﾞﾝｼｬﾌﾞﾝｺ ﾐ-42-19,宮部 みゆき 著,ﾐﾔﾍﾞ ﾐﾕｷ,,913.6,ミ,,講談社,2021,401p,15cm,800,21007176,仕事中に屋根から落ち、大ケガした泥棒の俺を助けてくれたのは、その家に住む中学生の双子の兄弟。ところがふたりに弱みを握られた俺は、家出中の両親に代わって父親となるハメに。家庭生活を始めた俺らを７つの事件が襲い…。,,図書費,ＴＲＣ,800,文庫書架,,,,,False,,,,False,,,,False,False,False,,
9784-065228449,80098,2021/04/13,三体問題　天才たちを悩ませた４００年の未解決問題,ｻﾝﾀｲﾓﾝﾀﾞｲ,,,ブルーバックス　Ｂ－２１６７,ﾌﾞﾙｰﾊﾞｯｸｽ B-2167,浅田 秀樹 著,ｱｻﾀﾞ ﾋﾃﾞｷ,,441.1,ｱ,,講談社,2021,257p,18cm,1000,21012729,科学史に名を残す天才たちの才能をもってさえ、完全には解決することができなかった「三体問題」。それはどういう問題なのか、科学者たちはどのように解決しようとしたのかなどを、なるべく高度な数式を用いず解説する。,タタイモンダイ　多体問題,図書費,白山商会,990,新書書架,,,,,False,,,,False,,,,False,False,True,,
9784-065229125,80097,2021/04/13,寿命遺伝子　なぜ老いるのか何が長寿を導くのか,ｼﾞｭﾐｮｳ ｲﾃﾞﾝｼ,,,ブルーバックス　Ｂ－２１６６,ﾌﾞﾙｰﾊﾞｯｸｽ B-2166,森 望 著,ﾓﾘ ﾉｿﾞﾑ,,467.2,ﾓ,,講談社,2021,270p,18cm,1000,21012953,たったひとつの遺伝子が人生の長さを変えるとしたら？　各国の叡智による、熾烈な遺伝子獲得競争をスリリングに描きながら、「老化」のプロセスの中でのそれぞれの遺伝子の役割や意義を解説する。,イデンシ　ジュミョウ（セイブツ）　ロウカ　遺伝子　寿命（生物）　老化,図書費,白山商会,990,新書書架,,,,,False,,,,False,,,1,False,False,True,,
9784-065230503,51666,2022/01/18,薔薇のなかの蛇,ﾊﾞﾗ ﾉ ﾅｶ ﾉ ﾍﾋﾞ,,,,,恩田 陸 著,ｵﾝﾀﾞ ﾘｸ,,913.6,オ,,講談社,2022,316p,20cm,1700,21023199,英国へ留学中のリセは、友人のアリスから薔薇をかたどった館のパーティに招かれる。アリスの家族と交流を深めるリセ。折しもその近くでは、首と胴体が切断された遺体が見つかり…。『メフィスト』掲載を加筆修正し単行本化。,,図書費,ＴＲＣ,1700,図書室,,,,,False,,,,False,,,,False,False,False,,
9784-065231814,80200,2021/06/10,理系女性の人生設計ガイド　自分を生かす仕事と生き方,ﾘｹｲ ｼﾞｮｾｲ ﾉ ｼﾞﾝｾｲ ｾｯｹｲ ｶﾞｲﾄﾞ,,,ブルーバックス　Ｂ－２１７０,ﾌﾞﾙｰﾊﾞｯｸｽ B-2170,大隅 典子 著　大島 まり 著　山本 佳世子 著,ｵｵｽﾐ ﾉﾘｺ ｵｵｼﾏ ﾏﾘ ﾔﾏﾓﾄ ｶﾖｺ,,407,ｵ,,講談社,2021,260p,18cm,1000,21022402,女性が理系の道を進むとき、どんな壁にぶつかるのか？　研究室や職場での悩みや、ワーク・ライフ・バランスなど、理系女性を取り巻く現状を取り上げ、先輩たちの仕事と日常から、理系女性の不安を乗り越えるヒントを伝える。,カガクギジュツケンキュウ　カガクシャ　ジョセイロウドウシャ　科学技術研究　科学者　女性労働者,図書費,白山商会,990,新書書架,,,,,False,,,,False,,,,False,False,True,,
9784-065232187,80131,2021/05/12,大学入試数学不朽の名問１００　大人のための“数学腕試し”,ﾀﾞｲｶﾞｸﾆｭｳｼ ｽｳｶﾞｸ ﾌｷｭｳ ﾉ ﾒｲﾓﾝ ﾋｬｸ,,,ブルーバックス　Ｂ－２１６８,ﾌﾞﾙｰﾊﾞｯｸｽ B-2168,鈴木 貫太郎 著,ｽｽﾞｷ ｶﾝﾀﾛｳ,,410,ｽ,,講談社,2021,286p,18cm,1100,21017801,「ｓｉｎ、ｃｏｓの加法定理を証明せよ」（東京大学）。思考力と本質的な理解を問うユニークな数学の名問を、古今全国の大学入試数学から１００問紹介する。数学オリンピック予選問題も収録。,スウガク　数学,図書費,白山商会,1089,新書書架,,,,,False,,,,False,,,,False,False,True,,
9784-065234464,80201,2021/06/10,四角形の七不思議　いちばん身近な図形の深遠な世界,ｼｶｯｹｲ ﾉ ﾅﾅﾌｼｷﾞ ｼｶｸｹｲ ﾉ ﾅﾅﾌｼｷﾞ,,,ブルーバックス　Ｂ－２１７１,ﾌﾞﾙｰﾊﾞｯｸｽ B-2171,細矢 治夫 著,ﾎｿﾔ ﾊﾙｵ,,414.12,ﾎ,,講談社,2021,234p,18cm,1100,21022406,私たちの生活の中にあふれている四角形。いままで気づかなかった数学的に不思議な性質をはじめ、紙や本、紙幣等の身近な長方形、魔法陣、多面体などについて解説。地図の四色問題や四元数なども紹介する。,ヘイメンキカガク　平面幾何学,図書費,白山商会,1089,新書書架,,,,,False,,,,False,,,,False,False,True,,
9784-065235492,80199,2021/06/10,アインシュタイン方程式を読んだら「宇宙」が見えた　ガチンコ相対性理論,ｱｲﾝｼｭﾀｲﾝ ﾎｳﾃｲｼｷ ｵ ﾖﾝﾀﾞﾗ ｳﾁｭｳ ｶﾞ ﾐｴﾀ,,,ブルーバックス　Ｂ－２１６９,ﾌﾞﾙｰﾊﾞｯｸｽ B-2169,深川 峻太郎 著,ﾌｶｶﾞﾜ ｼｭﾝﾀﾛｳ,,421.2,ﾌ,,講談社,2021,270p,18cm,1000,21022400,微積分も知らずに、アインシュタイン方程式を読み解く旅に出た５０代・文系の男。次々に襲いかかる複雑怪奇な記号の魑魅魍魎、際限なき方程式の底なし沼に意識が薄れかけるが…。史上初の数式ドキュメンタリー。,ソウタイセイリロン　相対性理論,図書費,白山商会,990,新書書架,,,,,False,,,,False,,,,False,False,True,,
9784-065235669,80202,2021/06/10,スペース・コロニー宇宙で暮らす方法,ｽﾍﾟｰｽ ｺﾛﾆｰ ｳﾁｭｳ ﾃﾞ ｸﾗｽ ﾎｳﾎｳ,,,ブルーバックス　Ｂ－２１７２,ﾌﾞﾙｰﾊﾞｯｸｽ B-2172,向井 千秋 監修・著　東京理科大学スペース・コロニー研究センター 編・著,ﾑｶｲ ﾁｱｷ ﾄｳｷｮｳﾘｶﾀﾞｲｶﾞｸｽﾍﾟｰｽｺﾛﾆｰｹﾝｷｭｳｾﾝﾀｰ,,538.9,ﾑ,,講談社,2021,254p,18cm,1000,21022410,宇宙で人が暮らす時代が始まっている！　極限環境ともよべる宇宙において、人が暮らすためには？　酸素や水、食料や電気・エネルギーを作るには？　さまざまな課題を、技術開発の最前線とともに徹底解説する。,ウチュウカイハツ　宇宙開発,図書費,白山商会,990,新書書架,,,,,False,,,,False,,,,False,False,True,,
9784-065237144,51664,2022/01/18,とにもかくにもごはん,ﾄﾆﾓ ｶｸﾆﾓ ｺﾞﾊﾝ,,,,,小野寺 史宜 著,ｵﾉﾃﾞﾗ ﾌﾐﾉﾘ,,913.6,オ,,講談社,2022,285p,19cm,1550,21033924,午後５時開店、午後８時閉店。松井波子が開いた「クロード子ども食堂」。お客さんは、デートに向かうおかあさんに置いていかれる小学生や、娘と絶縁し孤独に暮らすおじいさん…。現代社会の生きづらさと希望を描く群像劇。,,図書費,ＴＲＣ,1550,図書室,,,,,False,,,,False,,,,False,False,False,,
9784-065237328,51654,2022/01/18,ｉｎｖｅｒｔ　城塚翡翠倒叙集,ｲﾝｳﾞｧｰﾄ,,,,,相沢 沙呼 著,ｱｲｻﾞﾜ ｻｺ,,913.6,ア,,講談社,2022,426p,20cm,1750,21029044,綿密な犯罪計画により実行された殺人事件。事件は事故として処理されるはずだったが、犯人のもとに、死者の声を聴く美女、城塚翡翠が現れ…。犯人の視点で描かれる倒叙ミステリ中編全３編を収録。「ｍｅｄｉｕｍ」続編。,,図書費,ＴＲＣ,1750,図書室,,,,,False,,,,False,,,1,False,False,False,,
9784-065237687,51662,2022/01/18,スイート・マイホーム,ｽｲｰﾄ ﾏｲ ﾎｰﾑ,,,講談社文庫　か１５１－１,ｺｳﾀﾞﾝｼｬﾌﾞﾝｺ ｶ-151-1,神津 凛子 著,ｶﾐｽﾞ ﾘﾝｺ,,913.6,カ,,講談社,2022,403p,15cm,800,21025721,スポーツインストラクターの賢二は、寒がりの妻のため、たった１台のエアコンで家中を暖められる「まほうの家」を購入する。だが、引っ越し直後から奇妙な現象が起こり始める。さらに、関係者の一人が怪死を遂げ…。,,図書費,ＴＲＣ,800,文庫書架,,,,,False,,,,False,,,,False,False,False,,
9784-065238158,80412,2021/12/06,地球にちりばめられて,ﾁｷｭｳ ﾆ ﾁﾘﾊﾞﾒﾗﾚﾃ,,,講談社文庫　た７４－５,ｺｳﾀﾞﾝｼｬﾌﾞﾝｺ ﾀ-74-5,多和田 葉子 著,ﾀﾜﾀﾞ ﾖｳｺ,,913.6,ﾀ,,講談社,2021,349p,15cm,720,21037966,留学中に故郷の島国が消滅してしまった女性Ｈｉｒｕｋｏは、ヨーロッパ大陸で生き抜くため、独自の言語〈パンスカ〉をつくり出す。彼女は言語学を研究する青年とともに、自分と同じ母語を話す者を探す旅に出て…。,,図書費,白山商会,648,文庫書架,,,,,False,,,,False,,,,False,False,True,,
9784-065241929,80281,2021/09/14,スワロウテイルの消失点,ｽﾜﾛｳﾃｲﾙ ﾉ ｼｮｳｼﾂﾃﾝ,,,講談社文庫　か１３２－９,ｺｳﾀﾞﾝｼｬﾌﾞﾝｺ ｶ-132-9,川瀬 七緒 著,ｶﾜｾ ﾅﾅｵ,,913.6,ｶ,,講談社,2021,427p,15cm,820,21030078,発疹、出血、痒み。腐乱死体の解剖に立ち会っていた法医昆虫学者・赤堀らが原因不明の症状に見舞われる。だが彼女は意外な見解を示し、被害者の死亡推定月日に迫り…。警察ミステリー。,,図書費,白山商会,812,文庫書架,,,,,False,,,,False,,,,False,False,True,,
9784-065243107,51658,2022/01/18,クジオのさかな会計士,ｸｼﾞｵ ﾉ ｻｶﾅ ｶｲｹｲｼ,,,講談社文庫　ろ１３－３,ｺｳﾀﾞﾝｼｬﾌﾞﾝｺ ﾛ-13-3,ジャンニ・ロダーリ 著　内田 洋子 訳,ﾛﾀﾞｰﾘ ｼﾞｬﾝﾆ ｳﾁﾀﾞ ﾖｳｺ ｼﾞｬﾝﾆﾛﾀﾞｰﾘ,,973,ロ,,講談社,2021,204p,15cm,820,21046922,北イタリアの名所クジオ（オルタ湖）で取材をしていた作家の〈私〉は、足にフィンをつけたスイマーから声をかけられる。彼は地元の会計士で、魚になるためのトレーニングをしているのだという…。シュールだけど温かい短編集。,,図書費,ＴＲＣ,820,文庫書架,,,,,False,,,,False,,,,False,False,False,,
9784-065243862,80301,2021/09/22,青い春を数えて,ｱｵｲ ﾊﾙ ｵ ｶｿﾞｴﾃ,,,講談社文庫　た１３４－１,ｺｳﾀﾞﾝｼｬﾌﾞﾝｺ ﾀ-134-1,武田 綾乃 著,ﾀｹﾀﾞ ｱﾔﾉ,,913.6,ﾀ,,講談社,2021,237p,15cm,630,21030081,放送部の知咲は、本番の舞台にトラウマがある。だが、エースの有紗の様子が変で…。「白線と一歩」をはじめ、少女と大人の狭間で揺れ動く５人の高校生の、瑞々しくも切実な感情を切り取った連作短編集。,,図書費,白山商会,624,文庫書架,,,,,False,,,,False,,,,False,False,True,,
9784-065244548,51660,2022/01/18,死物語　上,ｼﾉﾓﾉｶﾞﾀﾘ ｼﾓﾉｶﾞﾀﾘ,,,講談社ＢＯＸ,ｺｳﾀﾞﾝｼｬﾎﾞｯｸｽ,西尾 維新 著,ﾆｼｵ ｲｼﾝ,,913.6,ニ,１,講談社,2022,237p,19cm,1350,21034705,デストピア・ヴィルトゥオーゾ・スーサイドマスターに会うため、故国を目指す忍野忍と阿良々木暦。人間社会が異常事態に陥った中、怪異にのみ感染するウイルスが吸血鬼を死に至らしめていて…。阿良々木暦の大学生編。,,図書費,ＴＲＣ,1350,図書室,,,,,False,,,,False,,,,False,False,False,,
9784-065244555,51661,2022/01/18,死物語　下,ｼﾉﾓﾉｶﾞﾀﾘ ｼﾓﾉｶﾞﾀﾘ,,,講談社ＢＯＸ,ｺｳﾀﾞﾝｼｬﾎﾞｯｸｽ,西尾 維新 著,ﾆｼｵ ｲｼﾝ,,913.6,ニ,２,講談社,2022,231p,19cm,1350,21034708,専門家の見習いとして、斧乃木余接、貝木泥舟と共に西表島へ向かう千石撫子。敵は蛇遣い・洗人迂路子－すべての元凶にして、臥煙伊豆湖の実の娘である。撫子が挑む“死闘”の結末は…。千石撫子の成長譚。,,図書費,ＴＲＣ,1350,図書室,,,,,False,,,,False,,,,False,False,False,,
9784-065245613,51667,2022/01/18,本が紡いだ五つの奇跡,ﾎﾝ ｶﾞ ﾂﾑｲﾀﾞ ｲﾂﾂ ﾉ ｷｾｷ,,,,,森沢 明夫 著,ﾓﾘｻﾜ ｱｷｵ,,913.6,モ,,講談社,2022,348p,19cm,1700,21038486,仕事がなかなかうまくいかない女性編集者の最後のチャレンジで実現した新作小説。その小説が人々を気持ちを奇跡のように紡いでいく…。本に関わった５人の物語。『小説現代』連載を単行本化。,,図書費,ＴＲＣ,1700,図書室,,,,,False,,,,False,,,,False,False,False,,
9784-065246238,51665,2022/01/18,７．５グラムの奇跡,ﾅﾅﾃﾝｺﾞ ｸﾞﾗﾑ ﾉ ｷｾｷ,,,,,砥上 裕將 著,ﾄｶﾞﾐ ﾋﾛﾏｻ,,913.6,ト,,講談社,2021,298p,19cm,1550,21041335,北見眼科医院の面接を受けた野宮恭一は、おおらかな院長のもと視能訓練士として働き始め…。働き学びながら「見える」ことの大切さを実感し成長する青年の姿を描く。『メフィスト』掲載に書き下ろしを加えて単行本化。,,図書費,ＴＲＣ,1550,図書室,,,,,False,,,,False,,,,False,False,False,,
9784-065249260,51657,2022/01/18,木村一基　折れない心の育て方　一流棋士に学ぶ行動指針３５,ｷﾑﾗｶｽﾞｷ ｵﾚﾅｲ ｺｺﾛ ﾉ ｿﾀﾞﾃｶﾀ,,,,,藤島 淳 著　木村 一基 監修,ﾌｼﾞｼﾏ ｼﾞｭﾝ ｷﾑﾗ ｶｽﾞｷ,,796.0,フ,,講談社,2022,181p,19cm,1300,21040332,すべての経験をプラスに捉える、今取り組んでいることに全力を尽くす、負けを受け入れる、自分を律する…。不倒の棋士・木村一基九段が「折れない心」をテーマに語った言葉から、葛藤や挫折を乗り越えるメソッドを伝える。,キムラ カズキ　木村一基,図書費,ＴＲＣ,1300,図書室,,,,,False,,,,False,,,,False,False,False,,
9784-065250402,51845,2022/02/01,考えて、考えて、考える,ｶﾝｶﾞｴﾃ ｶﾝｶﾞｴﾃ ｶﾝｶﾞｴﾙ,,,,,丹羽 宇一郎 著　藤井 聡太 著,ﾆﾜ ｳｲﾁﾛｳ ﾌｼﾞｲ ｿｳﾀ,,796.0,ニ,,講談社,2022,212p,19cm,1400,21035527,名経営者・丹羽宇一郎と若き天才棋士・藤井聡太。年齢も活躍する分野も大きく異なる２人が、勝負の前の心の整え方、逆境の越え方、時間の使い方、日常の学び、人生の目標について対話する。,フジイ ソウタ　ニワ ウイチロウ　藤井聡太　丹羽宇一郎,図書費,ＴＲＣ,1400,図書室,,,,,False,,,,False,,,,False,False,False,,
9784-065251256,51656,2022/01/18,簡単・生地から作る本格点心,ｶﾝﾀﾝ ｷｼﾞ ｶﾗ ﾂｸﾙ ﾎﾝｶｸ ﾃﾝｼﾝ,,,,,市川 友茂 著,ｲﾁｶﾜ ﾄﾓｼｹﾞ,,596.2,イ,,講談社,2021,103p,21cm,1500,21044458,餃子、焼売、パオズ、ワンタン、胡麻団子…。小麦粉を使った点心を、おいしくするコツはそのままに、難しい工程を極力省いて紹介する。生地の作り方はコマ送り写真で解説。皮の包み方を説明した動画のＱＲコード付き。,リョウリ（チュウゴク）　料理（中国）,図書費,ＴＲＣ,1500,図書室,,,,,False,,,,False,,,,False,False,False,,
9784-065252895,51663,2022/01/18,だんまり、つぶやき、語らい　じぶんをひらくことば,ﾀﾞﾝﾏﾘ ﾂﾌﾞﾔｷ ｶﾀﾗｲ,,,,,鷲田 清一 著,ﾜｼﾀﾞ ｷﾖｶｽﾞ,,804,ワ,,講談社,2021,93p,19cm,1000,21044294,心がけてもらいたいことは、たったひとつ－。碩学のあたたかい語りかけと、生徒たちの真摯な応答。２０２０年１０月、コロナ禍のなか愛知県立一宮高校の生徒に向けておこなわれた講演の記録。,ゲンゴ　コミュニケーション　言語　コミュニケーション,図書費,ＴＲＣ,1000,図書室,,,,,False,,,,False,,,,False,False,False,,
9784-074424207,80146,2021/05/07,薬屋のひとりごと　９,ｸｽﾘﾔ ﾉ ﾋﾄﾘｺﾞﾄ,,,ヒーロー文庫,ﾋｰﾛｰﾌﾞﾝｺ,日向 夏 著,ﾋｭｳｶﾞ ﾅﾂ,,913.6,ﾋ,9,主婦の友社（発売）,2020,399p,16cm,650,20008733,口外できない怪我を負った壬氏のために、秘密裏に通う猫猫。できる範囲で治療を施すが、医官付き官女という曖昧な立場に悩まされる。猫猫は羅門に医術の教えを乞おうと決めるが…。『小説家になろう』掲載に加筆し書籍化。,,図書費,白山商会,644,文庫書架,,,,,False,,,,False,,,,False,False,True,,
9784-074459377,51432,2021/06/22,大人かわいい飾り切り　ふだんの食卓もイベントメニューも料理がすてきに＆楽しくなる　毎日使えるモチーフ２２５点,ｵﾄﾅ ｶﾜｲｲ ｶｻﾞﾘｷﾞﾘ,,,,,ほりえ さちこ 著,ﾎﾘｴ ｻﾁｺ,,596,ホ,,主婦の友社,2021,111p,24cm,1500,21000221,いつもの食卓もイベントも、スペシャル感がアップする！　花や星・雪、動物やリボンといったモチーフや、クリスマス、ハロウィンなどのイベントで使える野菜や果物の飾り切りアイデアを紹介します。コピーして使える型紙つき。,リョウリ　料理,図書費,ＴＲＣ,1500,図書室,,,,,False,,,,False,,,,False,False,False,,
9784-074468942,51433,2021/06/22,中学生から知っておきたい！悪い大人にお金をだまし取られない全知識,ﾁｭｳｶﾞｸｾｲ ｶﾗ ｼｯﾃ ｵｷﾀｲ ﾜﾙｲ ｵﾄﾅ ﾆ ｵｶﾈ ｵ ﾀﾞﾏｼ ﾄﾗﾚﾅｲ ｾﾞﾝ ﾁｼｷ,,,,,イケダ ハヤト 著,ｲｹﾀﾞ ﾊﾔﾄ,,330.4,イ,,主婦の友社,2021,262p,19cm,1400,21007563,ＩＴ弱者を狙う詐欺の手法、あなたのお金を“合法的に”盗む方法、貧乏＆不幸になる“昭和の常識”…。インフルエンサー・イケダハヤトが、投資や経済を勉強する前に知っておくべき「お金を取られない知識」を解説する。,ケイザイ　サギ　経済　詐欺,図書費,ＴＲＣ,1400,図書室,,,,,False,,,,False,,,,False,False,False,,
