9784-750348520,80342,2021/10/05,ジェンダーについて大学生が真剣に考えてみた　あなたがあなたらしくいられるための２９問,ｼﾞｪﾝﾀﾞｰ ﾆ ﾂｲﾃ ﾀﾞｲｶﾞｸｾｲ ｶﾞ ｼﾝｹﾝ ﾆ ｶﾝｶﾞｴﾃﾐﾀ,,,,,佐藤 文香 監修　一橋大学社会学部佐藤文香ゼミ生一同 著,ｻﾄｳ ﾌﾐｶ ﾋﾄﾂﾊﾞｼﾀﾞｲｶﾞｸｼｬｶｲｶﾞｸﾌﾞｻﾄｳﾌﾐｶｾﾞﾐｲﾁﾄﾞｳ,,367.1,ﾋ,,明石書店,2019,203p,17cm,1500,19029178,日本はＬＧＢＴに寛容な国だよね？　フェミニズムって危険な思想なんでしょ？　ジェンダー研究のゼミに所属している学生たちが、実際に友人や知人に投げかけられた２９の問いに真っ正面から向き合ったＱ＆Ａ集。,ジョセイモンダイ　女性問題,図書費,白山商会,1485,図書室,,,,,False,,,,False,,,,False,False,True,,
9784-750351674,51363,2021/06/22,現代カナダを知るための６０章　第２版,ｹﾞﾝﾀﾞｲ ｶﾅﾀﾞ ｵ ｼﾙ ﾀﾒ ﾉ ﾛｸｼﾞｯｼｮｳ,,,エリア・スタディーズ　８３,ｴﾘｱｽﾀﾃﾞｨｰｽﾞ 83,飯野 正子 総監修　竹中 豊 総監修　日本カナダ学会 編,ｲｲﾉ ﾏｻｺ ﾀｹﾅｶ ﾕﾀｶ ﾆﾎﾝｶﾅﾀﾞｶﾞｯｶｲ,,302.5,ゲ,,明石書店,2021,380p,19cm,2000,21010724,カナダの国土・環境、先住民、社会・ジェンダー、政治・外交、文学・文化などについて、カナダ研究の各分野の第一人者が解説する。現代カナダを鳥瞰し、変化のスピードが速いカナダの今を伝える、一歩進んだ学びのガイド。,カナダ　カナダ,図書費,ＴＲＣ,2000,図書室,,,,,False,,,,False,,,,False,False,False,,
9784-750352435,51579,2022/01/18,アフガニスタンを知るための７０章,ｱﾌｶﾞﾆｽﾀﾝ ｵ ｼﾙ ﾀﾒ ﾉ ﾅﾅｼﾞｯ ｼｮｳ,,,エリア・スタディーズ　１８５,ｴﾘｱｽﾀﾃﾞｨｰｽﾞ 185,前田 耕作 編著　山内 和也 編著,ﾏｴﾀﾞ ｺｳｻｸ ﾔﾏｳﾁ ｶｽﾞﾔ,,302.2,ｱ,,明石書店,2022,408p,19cm,2000,21041337,東西冷戦や宗教原理主義の台頭、いわゆる「テロとの戦い」の舞台となるなど、数十年にわたり苦しい状況に置かれているアフガニスタン。その歴史と文化、人びとの暮らしを、平和と復興への期待を込めて幅広く紹介する。,アフガニスタン　アフガニスタン,図書費,ＴＲＣ,2000,図書室,,,,,False,,,,False,,,,False,False,False,,
9784-750352534,51580,2022/01/18,シンガポールを知るための６５章　第５版,ｼﾝｶﾞﾎﾟｰﾙ ｵ ｼﾙ ﾀﾒ ﾉ ﾛｸｼﾞｭｳｺﾞ ｼｮｳ,,,エリア・スタディーズ　１７,ｴﾘｱｽﾀﾃﾞｨｰｽﾞ 17,田村 慶子 編著,ﾀﾑﾗ ｹｲｺ,,302.2,ﾀ,,明石書店,2021,335p,19cm,2000,21040109,日本と密接な関係を持つシンガポールの歴史や社会、文化や娯楽、人々の暮らし、経済、国際関係や政治などを紹介する。写真や図表も多数収録。コロナ禍による経済危機とその対応等について触れた第５版。,シンガポール　シンガポール,図書費,ＴＲＣ,2000,図書室,,,,,False,,,,False,,,,False,False,False,,
9784-750516851,51364,2021/06/22,越えていく人　南米、日系の若者たちをたずねて,ｺｴﾃｲｸ ﾋﾄ,,,,,神里 雄大 著,ｶﾐｻﾄ ﾕｳﾀﾞｲ,,334.4,カ,,亜紀書房,2021,309p,19cm,1800,21010852,沖縄からペルーへ移住した先祖を持ち、首都リマで生まれた演出家が、アルゼンチン、ブラジル、ボリビアなどを旅して…。日系移民の子孫たちの言葉から浮かび上がる日本近代史。ＷＥＢマガジン『あき地』連載を加筆し単行本化。,ニホンジン（ミナミアメリカザイリュウ）　日本人（南アメリカ在留）,図書費,ＴＲＣ,1800,図書室,,,,,False,,,,False,,,,False,False,False,,
9784-750516912,51582,2022/01/18,小さな心の同好会,ﾁｲｻﾅ ｺｺﾛ ﾉ ﾄﾞｳｺｳｶｲ,,,となりの国のものがたり　０８,ﾄﾅﾘﾉｸﾆﾉﾓﾉｶﾞﾀﾘ 8,ユン イヒョン 著　古川 綾子 訳,ﾕﾝ ｲﾋｮﾝ ﾌﾙｶﾜ ｱﾔｺ,,929.1,ユ,,亜紀書房,2022,339p,19cm,1600,21018535,すこしの誤解やすれ違いから愛する人や大切な仲間を一瞬にして失う痛み…。私たちは、なぜ分かりあえなかったんだろう？　やり場のない怒りや悲しみにひとすじの温かな眼差しを向け、〈共にあること〉を模索した１１編の物語。,,図書費,ＴＲＣ,1600,図書室,,,,,False,,,,False,,,,False,False,False,,
9784-750517100,51581,2022/01/18,戦争とバスタオル,ｾﾝｿｳ ﾄ ﾊﾞｽﾀｵﾙ,,,,,安田 浩一 文　金井 真紀 文と絵,ﾔｽﾀﾞ ｺｳｲﾁ ｶﾅｲ ﾏｷ,,291.0,ﾔ,,亜紀書房,2022,373p,19cm,1700,21037442,ジャングルの露天風呂、お寺の寸胴風呂、無人島の大浴場…。至福の時間が流れる癒しのむこう側には、かつて日本が遺した戦争の爪痕と過酷な歴史があった。戦争で加害と被害の交差点となった温泉や銭湯を訪ねた社会派ゆる紀行。,ニホン キコウアンナイキ　タイ（コクメイ） キコウアンナイキ　カンコク キコウアンナイキ　オンセン　ヨクジョウ　タイヘイヨウセンソウ　日本 紀行・案内記　タイ（国名） 紀行・案内記　韓国 紀行・案内記　温泉　浴場　太平洋戦争（１９４１～１９４５）,図書費,ＴＲＣ,1700,図書室,,,,,False,,,,False,,,,False,False,False,,
9784-750517124,51583,2022/01/18,森の探偵　無人カメラがとらえた日本の自然,ﾓﾘ ﾉ ﾀﾝﾃｲ,,,,,宮崎 学 著　小原 真史 文・構成,ﾐﾔｻﾞｷ ﾏﾅﾌﾞ ｺﾊﾗ ﾏｻｼ,,743.6,ミ,,亜紀書房,2022,333p,19cm,1800,21034167,オリジナルの無人カメラのシステムを駆使し、野生動物たちの素顔を撮り続けてきた写真家・宮崎学。彼の撮影の秘密と森の歩き方を、映像作家・小原真史が対話によって明らかにする。写真も多数掲載。,ミヤザキ マナブ　宮崎学　シャシン サツエイ（セイブツ）　ヤセイドウブツ　写真 撮影（生物）　野生動物,図書費,ＴＲＣ,1800,図書室,,,,,False,,,,False,,,,False,False,False,,
9784-756253491,51491,2021/06/22,Ｓｍａｌｌ　Ｈｏｍｅｓ　Ｇｒａｎｄ　Ｌｉｖｉｎｇ　小さな家の大きな暮らし,ｽﾓｰﾙ ﾎｰﾑｽﾞ ｸﾞﾗﾝﾄﾞ ﾘｳﾞｨﾝｸﾞ,,,,,ｇｅｓｔａｌｔｅｎ 編集　酒井 章文 訳,ｹﾞｼｭﾀﾙﾃﾝｼｬ ｻｶｲ ｱｷﾌﾐ ｹﾞｼｭﾀﾙﾃﾝ,,527,ス,,パイインターナショナル,2021,255p,24cm,2550,21013104,ビルトイン、間仕切り、モジュール、玄関、ワークスペース、バスルーム…。小さな空間をたくさんの工夫、アイデアで快適な居住空間に仕立て上げている、世界の小さな家のインテリアをふんだんに掲載。,ジュウタクケンチク　住宅建築,図書費,ＴＲＣ,2550,図書室,,,,,False,,,,False,,,,False,False,False,,
9784-756921260,51373,2021/06/22,図解身近にあふれる「栄養素」が３時間でわかる本　思わずだれかに話したくなる,ｽﾞｶｲ ﾐｼﾞｶ ﾆ ｱﾌﾚﾙ ｴｲﾖｳｿ ｶﾞ ｻﾝｼﾞｶﾝ ﾃﾞ ﾜｶﾙ ﾎﾝ,,,,,齋藤 勝裕 著,ｻｲﾄｳ ｶﾂﾋﾛ,,498.5,サ,,明日香出版社,2021,221p,19cm,1400,21007362,栄養素をキャラクター化して、わかりやすく解説。「コレステロールはなぜ体に悪い？」「どうして二日酔いになる？」といった、日常生活の中で感じる疑問や、料理・病気・生活習慣と栄養素の関係についても説明する。,エイヨウ　栄養,図書費,ＴＲＣ,1400,図書室,,,,,False,,,,False,,,,False,False,False,,
9784-756921567,51592,2022/01/18,日常韓国語の基本の基本フレーズが身につく本　朝から夜まで、毎日使える１２８０フレーズ,ﾆﾁｼﾞｮｳ ｶﾝｺｸｺﾞ ﾉ ｷﾎﾝ ﾉ ｷﾎﾝ ﾌﾚｰｽﾞ ｶﾞ ﾐﾆﾂｸ ﾎﾝ,,,,,李 明姫 著,ｲ ﾐｮﾝﾋ ﾘ ﾒｲｷ,,829.1,イ,,明日香出版社,2022,222p,19cm,1600,21026373,日常生活において親しい人との会話でよく使われる韓国語のフレーズ１２８０を、「基本会話」「気持ちを表すことば」「注意するときのことば」などに分けて掲載する。音声のダウンロードサービス付き。,チョウセンゴ カイワ　朝鮮語 会話,図書費,ＴＲＣ,1600,図書室,,,,,False,,,,False,,,,False,False,False,,
9784-756921581,51591,2022/01/18,図解身近にあふれる「感染症」が３時間でわかる本　思わずだれかに話したくなる,ｽﾞｶｲ ﾐｼﾞｶ ﾆ ｱﾌﾚﾙ ｶﾝｾﾝｼｮｳ ｶﾞ ｻﾝｼﾞｶﾝ ﾃﾞ ﾜｶﾙ ﾎﾝ,,,,,左巻 健男 編著　桝本 輝樹 編著,ｻﾏｷ ﾀｹｵ ﾏｽﾓﾄ ﾃﾙｷ,,493.8,ズ,,明日香出版社,2022,254p,19cm,1400,21033878,インフルエンザ、ノロウイウイルス食中毒、梅毒、麻疹、新型コロナウイルス感染症…。よくかかる感染症の病原体、感染のしかた、症状などをやさしく解説。「図解身近にあふれる「微生物」が３時間でわかる本」の姉妹書。,カンセンショウ　感染症,図書費,ＴＲＣ,1400,図書室,,,,,False,,,,False,,,,False,False,False,,
9784-757436978,51831,2022/02/01,英語でオノマトペ表現　日本語の豊かな擬音語擬態語を英語でこう言う,ｴｲｺﾞ ﾃﾞ ｵﾉﾏﾄﾍﾟ ﾋｮｳｹﾞﾝ,,,,,ルーク・タニクリフ 著,ﾀﾆｸﾘﾌ ﾙｰｸ ﾙｰｸﾀﾆｸﾘﾌ,,834,タ,,アルク,2022,227p,19cm,1800,21029727,「こってりラーメン」「てきぱきとした仕事ぶり」…。この感覚を英語でそのまま伝えるには？　日本語のオノマトペを自然な英語に訳したフレーズを、例文とともに紹介する。英語のオノマトペについて学べるコラムも掲載。,エイゴ ギセイゴギタイゴ　英語 擬声語・擬態語,図書費,ＴＲＣ,1800,図書室,,,,,False,,,,False,,,,False,False,False,,
9784-759250404,51611,2022/01/18,屠畜のお仕事,ﾄﾁｸ ﾉ ｵｼｺﾞﾄ,,,シリーズお仕事探検隊,ｼﾘｰｽﾞｵｼｺﾞﾄﾀﾝｹﾝﾀｲ,栃木 裕 著,ﾄﾁｷﾞ ﾕﾀｶ,,648.2,ト,,解放出版社,2021,11 181p,21cm,1600,21015732,「豚や牛はどうやって殺すの？」「豚や牛をお肉にするための最後の工程ってなに？」　屠場のベテラン職人が、畜産という農業の一環として、屠畜に関する様々な疑問にイラストや写真を添えて答える。,ニクニクセイヒン　タベモノニカカワルシゴト　ブタ　ロウドウサイガイ　ウシ　ヒカク　ニワトリ　ヤセイドウブツ　ロウドウクミアイ　チクサン　リュウツウ　ヤヨイジダイ　マンヨウシュウ　ブッキョウ　アスカジダイ　シャカ　トクガワ ヨシノブ　エドジダイ　ドウワモンダイ　肉・肉製品　食べものにかかわる仕事　ぶた　労働災害　うし（牛）　皮革　にわとり　野生動物　労働組合　畜産　流通　弥生時代　万葉集　仏教　飛鳥時代　シャカ　徳川慶喜　江戸時代　同和問題　トジョウ　屠場,図書費,ＴＲＣ,1600,図書室,,,,,False,,,,False,,,,False,False,False,,
9784-759261264,51833,2022/02/01,自立生活楽し！！　知的障害があっても地域で生きる　親・介助者・支援者の立場から,ｼﾞﾘﾂ ｾｲｶﾂ ﾀﾉｼ,,,,,佐々木 和子 編著　廣川 淳平 編著,ｻｻｷ ｶｽﾞｺ ﾋﾛｶﾜ ｼﾞｭﾝﾍﾟｲ,,369.2,ジ,,解放出版社,2022,132p,21cm,1400,21021396,視覚障害１種１級、ＩｇＡ腎症、甲状腺機能低下症というダウン症の合併症オンパレードの息子が、３５歳から自立生活を始めて３年。親から見たその日常や、介助者の語る自立生活をまとめる。利用できる制度・方法や手順も紹介。,チテキショウガイシャフクシ　知的障害者福祉,図書費,ＴＲＣ,1400,図書室,,,,,False,,,,False,,,,False,False,False,,
9784-760152858,51615,2022/01/18,私はいま自由なの？　男女平等世界一の国ノルウェーが直面した現実,ﾜﾀｼ ﾜ ｲﾏ ｼﾞﾕｳ ﾅﾉ ﾜﾀｸｼ ﾜ ｲﾏ ｼﾞﾕｳ ﾅﾉ,,,,,リン・スタルスベルグ 著　枇谷 玲子 訳,ｽﾀﾙｽﾍﾞﾙｸﾞ ﾘﾝ ﾋﾀﾞﾆ ﾚｲｺ ﾘﾝｽﾀﾙｽﾍﾞﾙｸﾞ,,367.2,ス,,柏書房,2021,405p,19cm,2200,21039327,ノルウェーのジャーナリストが、仕事と家事の両方に押しつぶされそうなノルウェー女性たちの肉声を紹介する。ジェンダーギャップを埋めただけでは解決しない、本質的な課題を浮かび上がらせる渾身のレポート。,ジョセイモンダイ　ジョセイロウドウ　ワークライフバランス　ノルウェー　女性問題　女性労働　ワークライフバランス　ノルウェー,図書費,ＴＲＣ,2200,図書室,,,,,False,,,,False,,,,False,False,False,,
9784-760153480,51614,2022/01/18,「役に立たない」研究の未来,ﾔｸ ﾆ ﾀﾀﾅｲ ｹﾝｷｭｳ ﾉ ﾐﾗｲ,,,,,初田 哲男 著　大隅 良典 著　隠岐 さや香 著　柴藤 亮介 ナビゲーター,ﾊﾂﾀﾞ ﾃﾂｵ ｵｵｽﾐ ﾖｼﾉﾘ ｵｷ ｻﾔｶ ｼﾊﾞﾄｳ ﾘｮｳｽｹ,,407,ヤ,,柏書房,2021,213p,19cm,1500,21016694,そもそも「役に立つ」って、いったいなんだろう？　令和時代の「役に立たない」研究の進め方について多様な視点から考える。２０２０年８月に開催されたオンライン座談会「「役に立たない」科学が役に立つ」の内容を書籍化。,カガクギジュツケンキュウ　科学技術研究,図書費,ＴＲＣ,1500,図書室,,,,,False,,,,False,,,,False,False,False,,
9784-761513764,51612,2022/01/18,飛び出す！公務員　時代を切り拓く９８人の実践,ﾄﾋﾞﾀﾞｽ ｺｳﾑｲﾝ,,,,,椎川 忍 編著　牧 慎太郎 編著　澤田 史朗 編著　野崎 伸一 編著　井上 貴至 編著　前神 有里 編著　後藤 好邦 編著　吉弘 拓生 編著　地域活性化センター 発行協力・監修,ｼｲｶﾜ ｼﾉﾌﾞ ﾏｷ ｼﾝﾀﾛｳ ｻﾜﾀﾞ ｼﾛｳ ﾉｻﾞｷ ｼﾝｲﾁ ｲﾉｳｴ ﾀｶｼ ﾏｴｶﾞﾐ ﾕﾘ ｺﾞﾄｳ ﾖｼｸﾆ ﾖｼﾋﾛ ﾀｸｵ ﾁｲｷｶｯｾｲｶｾﾝﾀｰ,,318.3,ト,,学芸出版社,2021,270p,19cm,1800,21046128,職域や日常業務を超えて地域づくりに参加する「地域に飛び出す公務員」９８人の実践集。飛び出したきっかけはなにか、だれとどんな活動を始めたのか、自分はどう変わったのか、どんな体験をし、何を学んだかを語る。,チホウコウムイン　地方公務員,図書費,ＴＲＣ,1800,図書室,,,,,False,,,,False,,,,False,False,False,,
9784-763139078,51676,2022/01/18,生物学的に、しょうがない！,ｾｲﾌﾞﾂｶﾞｸ ﾃｷ ﾆ ｼｮｳｶﾞﾅｲ,,,,,石川 幹人 著,ｲｼｶﾜ ﾏｻﾄ,,140.4,イ,,サンマーク出版,2022,271p,19cm,1500,21025611,片づけられない、つい飲みすぎる…。あなたが悪いわけではありません。人間が生物として持っている遺伝子に刻まれたプログラムが原因なのです！　生物学から見て、人類が努力しても「なんともならないこと」５１を紹介。,シンカシンリガク　進化心理学,図書費,ＴＲＣ,1500,図書室,,,,,False,,,,False,,,,False,False,False,,
9784-763139375,51675,2022/01/18,さよならも言えないうちに,ｻﾖﾅﾗ ﾓ ｲｴﾅｲ ｳﾁ ﾆ,,,〔「コーヒーが冷めないうちに」シリーズ〕　〔４〕,ｺｰﾋｰｶﾞｻﾒﾅｲｳﾁﾆｼﾘｰｽﾞ 4,川口 俊和 著,ｶﾜｸﾞﾁ ﾄｼｶｽﾞ,,913.6,カ,,サンマーク出版,2022,275p,19cm,1400,21037708,「最後」があるとわかっていたのに、なぜそれがあの日だと思えなかったんだろう－。家族に、愛犬に、恋人に会うために、過去に戻れる不思議な喫茶店を訪れた４人の男女の物語。「コーヒーが冷めないうちに」シリーズ。,,図書費,ＴＲＣ,1400,図書室,,,,,False,,,,False,,,,False,False,False,,
9784-763409751,51834,2022/02/01,「八月ジャーナリズム」と戦後日本　戦争の記憶はどう作られてきたのか,ﾊﾁｶﾞﾂ ｼﾞｬｰﾅﾘｽﾞﾑ ﾄ ｾﾝｺﾞ ﾆﾎﾝ,,,日本大学法学部叢書　第４３巻,ﾆﾎﾝﾀﾞｲｶﾞｸﾎｳｶﾞｸﾌﾞｿｳｼｮ 43,米倉 律 著,ﾖﾈｸﾗ ﾘﾂ,,699.6,ヨ,,共栄書房（発売）,2022,284p,19cm,2000,21028212,戦後日本の戦争観や歴史認識を反映し、同時にそれらの形成にも影響を及ぼしてきた“夏のテレビの戦争特番”「八月ジャーナリズム」。その歴史的展開と功罪を検証し、今後の可能性と課題、展望を示す。,ホウソウバングミ レキシ　ジャーナリズム レキシ　タイヘイヨウセンソウ　放送番組 歴史　ジャーナリズム 歴史　太平洋戦争（１９４１～１９４５）,図書費,ＴＲＣ,2000,図書室,,,,,False,,,,False,,,,False,False,False,,
9784-766134612,51409,2021/06/22,柚木沙弥郎のことば,ﾕﾉｷｻﾐﾛｳ ﾉ ｺﾄﾊﾞ,,,,,柚木 沙弥郎 著　熱田 千鶴 著　木寺 紀雄 写真,ﾕﾉｷ ｻﾐﾛｳ ｱﾂﾀ ﾁｽﾞﾙ ｷﾃﾞﾗ ﾉﾘｵ,,753.8,ユ,,グラフィック社,2021,191p,19cm,2000,21005364,９８歳の今も第一線を走り、年々モダンな民藝、染色作品をつくり続ける柚木沙弥郎。柚木を長年取材しつづける編集者・熱田千鶴が、柚木の思い、信念、ことばをまとめる。,ユノキ サミロウ　柚木沙弥郎,図書費,ＴＲＣ,2000,図書室,,,,,False,,,,False,,,1,False,False,False,,
9784-766134681,51410,2021/06/22,４つのカタチが楽しい立体ポップアップカード　エッグ、ダイヤモンド、ドーム、ボックス,ﾖｯﾂ ﾉ ｶﾀﾁ ｶﾞ ﾀﾉｼｲ ﾘｯﾀｲ ﾎﾟｯﾌﾟｱｯﾌﾟ ｶｰﾄﾞ ,,,,,月本 せいじ 著,ﾂｷﾓﾄ ｾｲｼﾞ,,754.9,ツ,,グラフィック社,2021,136p,26cm,1600,21005366,フレーム状のパーツを組み合わせて作る立体ポップアップカード。卵型のエッグ、四角錐を２つつないだダイヤモンド、鳥かごのようなドーム、六角形が立体になるボックスの４種類を掲載。切って組み立てられるカード付き。,カミコウゲイ　紙工芸,図書費,ＴＲＣ,1600,図書室,,,,,False,,,,False,,,,False,False,False,,
9784-766427103,80457,2022/01/31,女大学評論　新女大学　現代語訳,ｵﾝﾅ ﾀﾞｲｶﾞｸ ﾋｮｳﾛﾝ ｼﾝ ｵﾝﾅ ﾀﾞｲｶﾞｸ,,,,,福澤 諭吉 著　加藤 紳一郎 訳,ﾌｸｻﾞﾜ ﾕｷﾁ ｶﾄｳ ｼﾝｲﾁﾛｳ,,159.6,ﾌ,,慶應義塾大学出版会（発売）,2020,14 157p,18cm,1200,20046260,日本で初めて男性と女性の平等を訴えた福澤諭吉による「女大学評論」「新女大学」の現代語訳。現代の読者に馴染みやすくするため、章のタイトル、小見出しを現代風に付け、語注も付す。,オンナダイガク　ジンセイクン（ジョセイ）　女大学　人生訓（女性）,寄付,,1200,図書室,,,,,False,,,,False,,,,False,False,True,,
9784-766427103,80458,2022/01/31,女大学評論　新女大学　現代語訳,ｵﾝﾅ ﾀﾞｲｶﾞｸ ﾋｮｳﾛﾝ  ｼﾝ ｵﾝﾅ ﾀﾞｲｶﾞｸ,,,,,福澤 諭吉 著　加藤 紳一郎 訳,ﾌｸｻﾞﾜ ﾕｷﾁ ｶﾄｳ ｼﾝｲﾁﾛｳ,,159.6,ﾌ,,慶應義塾大学出版会（発売）,2020,14 157p,18cm,1200,20046260,日本で初めて男性と女性の平等を訴えた福澤諭吉による「女大学評論」「新女大学」の現代語訳。現代の読者に馴染みやすくするため、章のタイトル、小見出しを現代風に付け、語注も付す。,オンナダイガク　ジンセイクン（ジョセイ）　女大学　人生訓（女性）,寄付,,1200,図書室,,,,,False,,,,False,,,,False,False,True,,
9784-767821559,80406,2021/12/06,日本の戦争解剖図鑑　日本近現代史がマルわかり,ﾆﾎﾝ ﾉ ｾﾝｿｳ ｶｲﾎﾞｳ ｽﾞｶﾝ,,,,,拳骨 拓史 著,ｹﾞﾝｺﾂ ﾀｸﾌﾐ,,210.6,ｹﾞ,,エクスナレッジ,2016,175p,21cm,1600,16035588,日清・日露戦争、第１次世界大戦、大東亜戦争…。開国以降の日本の対外戦争を、戦況図と豊富なイラストで完全図解。そのとき日本、アジア、欧米で何が起こっていたのかがひと目でわかる歴史年表付き。,ニホン レキシ キンダイ　センソウ レキシ　日本 歴史 近代　戦争 歴史,図書費,白山商会,1584,図書室,,,,,False,,,,False,,,,False,False,True,,
9784-767825816,80405,2021/12/06,建物できるまで図鑑　木造住宅　世界で一番楽しい　見るだけで分かる！現代の家づくりの仕組み　建築知識創刊６０周年記念出版,ﾀﾃﾓﾉ ﾃﾞｷﾙ ﾏﾃﾞ ｽﾞｶﾝ,,,,,瀬川 康秀 絵　大野 隆司 文,ｾｶﾞﾜ ﾔｽﾋﾃﾞ ｵｵﾉ ﾀｶｼ,,527,ｾ,,エクスナレッジ,2018,113p,30cm,1800,19000183,「木造住宅のできるまで」を、詳細なイラストとともに分かりやすく大解剖。在来軸組工法、枠組壁工法（ツーバイフォー）の住宅の着工から竣工までを、段階ごとに解説。在来軸組工法の各部のつくり方も紹介する。,ジュウタクケンチク　モッコウゾウ　住宅建築　木構造,図書費,白山商会,1782,図書室,,,,,False,,,,False,,,,False,False,True,,
9784-767828442,51535,2021/07/08,ちょっとのコツでけっこう幸せになる自炊生活,ﾁｮｯﾄ ﾉ ｺﾂ ﾃﾞ ｹｯｺｳ ｼｱﾜｾ ﾆ ﾅﾙ ｼﾞｽｲ ｾｲｶﾂ,,,,,山口 祐加 著,ﾔﾏｸﾞﾁ ﾕｶ,,596,ヤ,,エクスナレッジ,2020,143p,21cm,1400,20051571,料理初心者向けの料理教室「自炊レッスン」を主宰する著者が、シンプルな料理からおもてなし料理まで、簡単でおいしい５０レシピを紹介する。頑張らなくても、料理が苦手でも、自炊が無理なく続くコツが満載。,リョウリ　料理,図書費,ＴＲＣ,1400,図書室,,,,,False,,,,False,,,,False,False,False,,
9784-767828619,51379,2021/06/22,日本の装束解剖図鑑　古代から現代までイラストで読み解く有職故実の世界,ﾆﾎﾝ ﾉ ｼｮｳｿﾞｸ ｶｲﾎﾞｳ ｽﾞｶﾝ,,,,,八條 忠基 著,ﾊﾁｼﾞｮｳ ﾀﾀﾞﾓﾄ,,210.0,ハ,,エクスナレッジ,2021,127p,21cm,1600,21010624,朝廷や公家、武家の人びとが身にまとっていた「装束」に隠されたルーツや着こなし、文様の意味、時代背景をオールカラーイラストで徹底解説。古代から現代に至るまでの有職故実の世界を色鮮やかに紐解く。,ショウゾク　装束,図書費,ＴＲＣ,1600,図書室,,,,,False,,,,False,,,,False,False,False,,
9784-767829357,51602,2022/01/18,百花帖,ﾋｬｯｶ ﾁｮｳ,,,,,雨宮 ゆか 著　雨宮 秀也 写真,ｱﾒﾐﾔ ﾕｶ ｱﾒﾐﾔ ﾋﾃﾞﾔ,,793,ア,,エクスナレッジ,2021,255p,19cm,1800,21040358,挿花家が身近で親しみやすい１００点の花を紹介。生け方やうつわとの合わせ方のほか、人の暮らしとの関わり、生息地や季節、育て方などの実用情報も含めて、美しい写真と小さなエッセイで綴る。「百葉帖」も同時刊行。,カドウ　花道,図書費,ＴＲＣ,1800,図書室,,,,,False,,,,False,,,,False,False,False,,
9784-767829364,51601,2022/01/18,百葉帖,ﾋｬｸﾖｳ ﾁｮｳ,,,,,雨宮 ゆか 著　雨宮 秀也 写真,ｱﾒﾐﾔ ﾕｶ ｱﾒﾐﾔ ﾋﾃﾞﾔ,,793,ア,,エクスナレッジ,2021,255p,19cm,1800,21040361,挿花家が身近で親しみやすい１００点の葉を紹介。生け方やうつわとの合わせ方のほか、人の暮らしとの関わり、生息地や季節、育て方などの実用情報も含めて、美しい写真と小さなエッセイで綴る。「百花帖」も同時刊行。,カドウ　花道,図書費,ＴＲＣ,1800,図書室,,,,,False,,,,False,,,,False,False,False,,
9784-767829548,51600,2022/01/18,英国建築の解剖図鑑,ｴｲｺｸ ｹﾝﾁｸ ﾉ ｶｲﾎﾞｳ ｽﾞｶﾝ,,,,,マシュー・ライス 著　岡本 由香子 訳　中島 智章 監修,ﾗｲｽ ﾏｼｭｰ ｵｶﾓﾄ ﾕｶｺ ﾅｶｼﾏ ﾄﾓｱｷ ﾏｼｭｰﾗｲｽ,,523.3,ラ,,エクスナレッジ,2021,239p,21cm,1900,21046666,英国の建築を、温かみのあるイラストで丁寧に解説。建築の基本はもちろん、マナーハウスや大聖堂を鑑賞する際のポイントも紹介します。長年英国で愛されてきた“解剖図鑑”の日本版。,ケンチク イギリス　建築 イギリス,図書費,ＴＲＣ,1900,図書室,,,,,False,,,,False,,,,False,False,False,,
