9784-286184920,80352,2021/10/28,余命１０年,ﾖﾒｲ ｼﾞｭｳﾈﾝ,,,文芸社文庫ＮＥＯ　こ５－１,ﾌﾞﾝｹﾞｲｼｬﾌﾞﾝｺﾈｵ ｺ-5-1,小坂 流加 著,ｺｻｶ ﾙｶ,,913.6,ｺ,,文芸社,2017,358p,15cm,620,17023467,２０歳の茉莉は不治の病にたおれ、余命１０年であることを知る。未来に対する諦めから、死への恐怖は薄れ、淡々とした日々を過ごしていく。趣味に情熱を注ぎ、恋はしないと心に決める茉莉だったが…。ラブストーリー。,,図書費,白山商会,614,文庫書架,,,,,False,,,,False,,,,False,False,True,,
9784-286219479,51795,2022/01/24,ちょん・ぎ・らら　ケニア　ルオの民話,ﾁｮﾝ ｷﾞ ﾗﾗ,,,,,水谷 圭吾 編・文　タケダ ミホ 絵,ﾐｽﾞﾀﾆ ｹｲｺﾞ ﾀｹﾀﾞ ﾐﾎ,,388.4,チ,,文芸社,2021,166p,21×22cm,1500,21044997,ケニア西部、ビクトリア湖沿岸部に居住するルオに受け継がれてきた民話「シガナ」を多数収集。ずる賢く生き抜くもの、理不尽に傷つけられるもの…。アフリカの大地を舞台に、様々なキャラクターの姿を生き生きと描く。,ミンワ ケニア　民話 ケニア,図書費,ＴＲＣ,1500,図書室,,,,,False,,,,False,,,,False,False,False,,
9784-286228105,51880,2022/02/01,発明はあなたもできる特許を取ることもできる,ﾊﾂﾒｲ ﾜ ｱﾅﾀ ﾓ ﾃﾞｷﾙ ﾄｯｷｮ ｵ ﾄﾙ ｺﾄ ﾓ ﾃﾞｷﾙ,,,,,杉谷 嘉昭 著,ｽｷﾞﾀﾆ ﾖｼｱｷ,,507.1,ス,,文芸社,2022,161p,19cm,1100,21026882,特許は企業だけのものではない！　特許庁の審査官・審判官として審査・審理に従事し、その後、弁理士業務に携わってきた著者が、事例をあげながら、発明のコツから特許申請までのポイントを解説する。,ハツメイ　トッキョ　発明　特許,図書費,ＴＲＣ,1100,図書室,,,,,False,,,,False,,,,False,False,False,,
9784-286229119,51794,2022/01/24,ガンピの翼ストーク,ｶﾞﾝﾋﾟ ﾉ ﾂﾊﾞｻ ｽﾄｰｸ,,,,,おおえ としこ 著,ｵｵｴ ﾄｼｺ,,538.2,オ,,文芸社,2021,122p,20cm,1200,21039678,１９７７年、世界記録を達成した人力飛行機ストークの翼は、“ガンピ”でできていた－。日本の大学生達の手によって作られたストークの秘密と、植物のガンピから作られる和紙「ガンピ紙」について紹介する。,コウクウキ　コウクウキヨウザイリョウ　ワシ　航空機　航空機用材料　和紙,図書費,ＴＲＣ,1200,図書室,,,,,False,,,,False,,,,False,False,False,,
9784-295003359,80222,2021/06/29,線一本からはじめる伝わる絵の描き方　絵心がなくてもスラスラ描ける！,ｾﾝ ｲｯﾎﾟﾝ ｶﾗ ﾊｼﾞﾒﾙ ﾂﾀﾜﾙ ｴ ﾉ ｶｷｶﾀ  ｾﾝ ｲｯﾎﾟﾝ ｶﾗ ﾊｼﾞﾒﾙ ﾂﾀﾜﾙ ｴ ﾉ ｴｶﾞｷｶﾀ,,,ロジカルデッサンの技法,ﾛｼﾞｶﾙﾃﾞｯｻﾝﾉｷﾞﾎｳ,ＯＣＨＡＢＩ　Ｉｎｓｔｉｔｕｔｅ 著,ｵﾁｬﾋﾞｲﾝｽﾃｨﾃｭｰﾄ,,725,ｵ,,インプレス,2018,174p,21cm,1800,18012872,「絵を描くロジックを知る」というアプローチで、絵の描き方を学べるデッサンの教科書。線の描き方から平面的な絵、人物などの描き方や情景の描き方まで、ていねいに解説。実際に手を動かして描く「Ｗｏｒｋ」も収録。,デッサン　デッサン,図書費,白山商会,1782,図書室,,,,,False,,,,False,,,,False,False,True,,
9784-295008545,80221,2021/06/29,ロゴのつくりかたアイデア帖　“いい感じ”に仕上げる６５の引き出し,ﾛｺﾞ ﾉ ﾂｸﾘｶﾀ ｱｲﾃﾞｱ ﾁｮｳ,,,,,遠島 啓介 著,ﾄｵｼﾏ ｹｲｽｹ,,727.8,ﾄ,,インプレス,2020,174p,21cm,1800,20012061,デザイン初心者でも、ロゴデザインでしっかり想いやイメージを表現できるよう、デザインの基本からアイデア出し、納品までのアイデアを６５の引き出しとして紹介。見るだけで楽しくなる＆参考になる作例を豊富に収録。,ロゴタイプ　ロゴタイプ,図書費,白山商会,1782,図書室,,,,,False,,,,False,,,,False,False,True,,
9784-296110087,51765,2022/01/24,「シンデレラ体重」が危ない　やせれば本当に幸せになれるの？,ｼﾝﾃﾞﾚﾗﾀｲｼﾞｭｳ ｶﾞ ｱﾌﾞﾅｲ,,,,,黒住 紗織 編著　日経ＢＰ総合研究所（ヘルシー・マザリング・プロジェクト） 編著,ｸﾛｽﾞﾐ ｻｵﾘ ﾆｯｹｲﾋﾞｰﾋﾟｰｿｳｺﾞｳｹﾝｷｭｳｼﾞｮﾒﾃﾞｨｶﾙﾍﾙｽﾗﾎﾞ ﾆｯｹｲﾋﾞｰﾋﾟｰｿｳｺﾞｳｹﾝｷｭｳｼﾞｮﾍﾙｼｰﾏｻﾞﾘﾝｸﾞﾌﾟﾛｼﾞｪｸﾄ,,498.5,シ,,日経ＢＰマーケティング（発売）,2021,189p,21cm,1800,21040013,「シンデレラ体重」は肥満と同じくらい健康に悪い。２６人の専門家への取材と８５のデータで、「シンデレラ体重」が危険な体重であることと、「やせ」を目指して栄養不足に陥ることの恐ろしさを示し、その対策を紹介する。,エイヨウ　フジンエイセイ　ヤセ　栄養　婦人衛生　やせ,図書費,ＴＲＣ,1800,図書室,,,,,False,,,,False,,,,False,False,False,,
9784-297119065,51406,2021/06/22,物流業界のしくみとビジネスがこれ１冊でしっかりわかる教科書,ﾌﾞﾂﾘｭｳｷﾞｮｳｶｲ ﾉ ｼｸﾐ ﾄ ﾋﾞｼﾞﾈｽ ｶﾞ ｺﾚ ｲｯｻﾂ ﾃﾞ ｼｯｶﾘ ﾜｶﾙ ｷｮｳｶｼｮ,,,図解即戦力　豊富な図解と丁寧な解説で、知識０でもわかりやすい！,ｽﾞｶｲｿｸｾﾝﾘｮｸ,ロジ・ソリューション株式会社 著,ﾛｼﾞｿﾘｭｰｼｮﾝｶﾌﾞｼｷｶﾞｲｼｬ,,681.6,ブ,,技術評論社,2021,223p,21cm,1500,21005441,“経済の血管”と例えられる物流事業を営む業界について、物流コストのしくみから、最新のビジネスモデルや業界が抱える課題まで幅広い情報を提供。物流業務に携わる者が身につけるべき知識を丁寧に解説する。,ウンソウギョウ　カモツ　運送業　貨物,図書費,ＴＲＣ,1500,図書室,,,,,False,,,,False,,,,False,False,False,,
9784-297122034,51642,2022/01/18,ゲームシナリオ入門　基礎知識から設定・キャラクター・プロット・テキストの技法まで,ｹﾞｰﾑ ｼﾅﾘｵ ﾆｭｳﾓﾝ,,,,,北岡 雄一朗 著,ｷﾀｵｶ ﾕｳｲﾁﾛｳ,,798.5,キ,,技術評論社,2022,367p,21cm,2480,21037661,プロのゲームシナリオライターが、心を動かす物語の作り方を伝授。ゲームシナリオ作りに必要な基礎知識、心構え、創作の技術から、舞台／キャラクター設定、プロット、シナリオの書き方までが身につく。書き込み式課題あり。,ゲームソフト　シナリオ サホウ　ゲームソフト　シナリオ 作法,図書費,ＴＲＣ,2480,図書室,,,,,False,,,,False,,,,False,False,False,,
9784-297122973,51643,2022/01/18,ひとめでわかる産業図鑑＆業界地図　改訂新版,ﾋﾄﾒ ﾃﾞ ﾜｶﾙ ｻﾝｷﾞｮｳ ｽﾞｶﾝ ｱﾝﾄﾞ ｷﾞｮｳｶｲ ﾁｽﾞ,,,,,イノウ 編著,ｲﾉｳ,,509.2,ヒ,,技術評論社,2021,175p,26cm,1800,21038332,日本の産業を支える３３６の産業財から、５１の業界、のべ６９９の企業が見えてくる！　各業界で扱う代表的な製品や、その製造・利用にあたってのキーワード・トピックを解説し、主要企業の売上や事業活動などを紹介する。,ニホン コウギョウ　キギョウ ニホン　日本 工業　企業 日本,図書費,ＴＲＣ,1800,図書室,,,,,False,,,,False,,,,False,False,False,,
9784-299002440,80178,2021/06/03,ツインソウル,ﾂｲﾝ ｿｳﾙ,,,宝島社文庫　Ｃさ－５－１１,ﾀｶﾗｼﾞﾏｼｬﾌﾞﾝｺ C-ｻ-5-11,佐藤 青南 著,ｻﾄｳ ｾｲﾅﾝ,,913.6,ｻ,,宝島社,2020,313p,16cm,660,20011200,人気動画配信者が殺された。行動心理学で相手の嘘を見抜く刑事・楯岡絵麻の取り調べで、事件の意外な真相が明らかに。その後も様々な事件を解決する絵麻だが、通り魔事件被疑者から予想外の事実を知り…。ＴＶドラマの原作。,,図書費,白山商会,653,文庫書架,,,,,False,,,,False,,,,False,False,True,,
9784-299010018,51459,2021/06/22,まんが図解倒産のすべて,ﾏﾝｶﾞ ｽﾞｶｲ ﾄｳｻﾝ ﾉ ｽﾍﾞﾃ,,,,,帝国データバンク 著,ﾃｲｺｸﾃﾞｰﾀﾊﾞﾝｸ,,335.2,マ,,宝島社,2020,223p,19cm,1300,20049845,ワンマン社長の暴走、粉飾決算の横行、ニーズを見誤った販売不振、無計画な拡大路線…。山一證券、武富士、ノヴァなど、戦後の代表的倒産２０社を、まんがとともにわかりやすく解説。幹部社員が語る終焉物語なども収録。,キギョウ ニホン　キギョウトウサン　企業 日本　企業倒産,図書費,ＴＲＣ,1300,図書室,,,,,False,,,,False,,,,False,False,False,,
9784-299014009,51734,2022/01/24,ＮＨＫ「風雲！大歴史実験」日本史ミステリーの科学　一ノ谷の戦い「逆落とし」から、新選組「池田屋事件」まで！,ｴﾇｴｲﾁｹｰ ﾌｳｳﾝ ﾀﾞｲ ﾚｷｼ ｼﾞｯｹﾝ ﾆﾎﾝｼ ﾐｽﾃﾘｰ ﾉ ｶｶﾞｸ,,,,,ＮＨＫ「風雲！大歴史実験」制作班 編,ﾆｯﾎﾟﾝﾎｳｿｳｷｮｳｶｲ ｴﾇｴｲﾁｹｰﾌｳｳﾝﾀﾞｲﾚｷｼｼﾞｯｹﾝｾｲｻｸﾊﾝ,,210.0,エ,,宝島社,2022,119p,30cm,1480,21017931,義経の「鵯越の逆落とし」は本当にあったのか。秀吉が「美濃大返し」を成し遂げた秘策とは。新選組４人だけで志士２０人を倒した方法は－。時代を変えた戦いの真実を科学的な実験で検証する。ＮＨＫ　ＢＳテレビ番組を書籍化。,ニホン レキシ　日本 歴史,図書費,ＴＲＣ,1480,図書室,,,,,False,,,,False,,,,False,False,False,,
9784-299014696,51859,2022/02/01,愛に始まり、愛に終わる　瀬戸内寂聴１０８の言葉,ｱｲ ﾆ ﾊｼﾞﾏﾘ ｱｲ ﾆ ｵﾜﾙ,,,,,瀬戸内 寂聴 著,ｾﾄｳﾁ ｼﾞｬｸﾁｮｳ,,917,セ,,宝島社,2022,246p,20cm,1400,21019147,想像力こそが思いやりであり、思いやりは愛である。愛と苦しみは陸続きなのだ－。「愛」「生」「業」「老」などをテーマに、瀬戸内寂聴の珠玉の言葉を厳選し、まとめた名言集。人生の歩みを振り返る貴重な写真も収録。,,図書費,ＴＲＣ,1400,図書室,,,,,False,,,,False,,,,False,False,False,,
9784-299014825,51458,2021/06/22,１話３分で驚きの結末！大どんでん返しの物語,ｲﾁ ﾜ ｻﾝﾌﾟﾝ ﾃﾞ ｵﾄﾞﾛｷ ﾉ ｹﾂﾏﾂ ﾀﾞｲ ﾄﾞﾝﾃﾞﾝｶﾞｴｼ ﾉ ﾓﾉｶﾞﾀﾘ,,,,,『このミステリーがすごい！』編集部 編,ﾀｶﾗｼﾞﾏｼｬ ｺﾉﾐｽﾃﾘｰｶﾞｽｺﾞｲﾍﾝｼｭｳﾌﾞ,,913.68,イ,,宝島社,2021,206p,19cm,1000,21011195,京都市内の静かで素敵な喫茶店で、大好きな彼が切り出したのは…。１行でゾッとする怖い話から、最後の１ページで泣ける物語まで、３分であっと驚く珠玉のどんでん返しが楽しめる１６作品を収録する。,ショウセツ（ニホン） ショウセツシュウ　小説（日本） 小説集,図書費,ＴＲＣ,1000,図書室,,,,,False,,,,False,,,,False,False,False,,
9784-299017949,51860,2022/02/01,経営学の基本ゆる図鑑　マーケティング＋ビジネスモデル＋販売戦略の基礎がこの１冊でまるわかり！,ｹｲｴｲｶﾞｸ ﾉ ｷﾎﾝ ﾕﾙ ｽﾞｶﾝ,,,,,平野 敦士カール 監修,ﾋﾗﾉ ｱﾂｼ ｶｰﾙ,,335.1,ケ,,宝島社,2022,191p,21cm,1300,21026394,簡潔な文章とゆる～いイラストで、経営学のイロハがわかるようになる超入門書。経営戦略、マーケティング、ビジネスモデル、生産管理、組織運営、お金の調達と運用について解説する。経済学における重要人物も紹介。,ケイエイガク　経営学,図書費,ＴＲＣ,1300,図書室,,,,,False,,,,False,,,,False,False,False,,
9784-299018359,51861,2022/02/01,伝わる文章術見るだけノート　「うまい文章」の共通ルールがゼロから身につく,ﾂﾀﾜﾙ ﾌﾞﾝｼｮｳ ｼﾞｭﾂ ﾐﾙ ﾀﾞｹ ﾉｰﾄ,,,,,山口 拓朗 監修,ﾔﾏｸﾞﾁ ﾀｸﾛｳ,,816,ツ,,宝島社,2022,189p,21cm,1300,21027099,うまい文章にはルールがある。「見出し」で読み手をひきつける、結論を最初に書く、主語を明確にする、誰が読むのかを意識する…。文章力を底上げするために必要な基本とコツを、イラストを交えてわかりやすく紹介する。,ブンショウ　文章,図書費,ＴＲＣ,1300,図書室,,,,,False,,,,False,,,,False,False,False,,
9784-299019424,51735,2022/01/24,世界の戦略図鑑　歴史を動かした最強の叡智がイラストでわかる！,ｾｶｲ ﾉ ｾﾝﾘｬｸ ｽﾞｶﾝ,,,,,佐藤 優 監修,ｻﾄｳ ﾏｻﾙ,,301,セ,,宝島社,2022,223p,19×25cm,1700,21035109,戦略とは目的を達成するために作るシナリオのようなもの。ビジネスシーンや日常生活などに役立つよう、古今東西の戦略といわれるものの具体的事例を幅広くイラストとともに紹介する。コロナ禍における未来の戦略も解説。,センリャク レキシ　戦略 歴史,図書費,ＴＲＣ,1700,図書室,,,,,False,,,,False,,,,False,False,False,,
9784-299020284,80351,2021/10/28,月曜日の抹茶カフェ,ｹﾞﾂﾖｳﾋﾞ ﾉ ﾏｯﾁｬ ｶﾌｪ,,,,,青山 美智子 著,ｱｵﾔﾏ ﾐﾁｺ,,913.6,ｱ,,宝島社,2021,221p,19cm,1364,21036924,川沿いの桜並木のそばに佇む喫茶店「マーブル・カフェ」が、定休日の月曜日に、一度だけ「抹茶カフェ」を開くことに…。一杯の抹茶から始まる、東京と京都をつなぐ１２カ月の心癒されるストーリー。,,図書費,白山商会,1350,図書室,,,,,False,,,,False,,,,False,False,True,,
9784-305709394,80356,2021/10/28,文豪たちの住宅事情　住んだ家、住んだ土地から見えてくる文豪たちの人生と文学,ﾌﾞﾝｺﾞｳ ﾀﾁ ﾉ ｼﾞｭｳﾀｸ ｼﾞｼﾞｮｳ,,,,,田村 景子 編著　小堀 洋平 著　田部 知季 著　吉野 泰平 著,ﾀﾑﾗ ｹｲｺ ｺﾎﾞﾘ ﾖｳﾍｲ ﾀﾍﾞ ﾄﾓｷ ﾖｼﾉ ﾀｲﾍｲ,,910.26,ﾌﾞ,,笠間書院,2021,358p,19cm,1800,21019357,文豪たちは、わたしたちと同じように生きて暮らし、悩み悦び苦しむひとりの生活者だった。夏目漱石、寺山修司、江戸川乱歩、太宰治、谷崎潤一郎、佐藤春夫…。それぞれの住宅事情から「文豪」の生活や文学を考える。,ニホンブンガク サッカ　ジュウタクケンチク　日本文学 作家　住宅建築,図書費,白山商会,1782,図書室,,,,,False,,,,False,,,,False,False,True,,
9784-305709509,51613,2022/01/18,女の子の謎を解く,ｵﾝﾅﾉｺ ﾉ ﾅｿﾞ ｵ ﾄｸ,,,,,三宅 香帆 著,ﾐﾔｹ ｶﾎ,,902.0,ミ,,笠間書院,2021,281p,19cm,1500,21047889,男女逆転モノが少女漫画に多いのはなぜか。なぜ大人数のアイドルが流行ったのか。小説や漫画、ドラマ、映画、アイドルに描かれる「ヒロイン」を読み解き、今の世の中を考察する。文春オンラインほか掲載を加筆し書籍化。,ジョセイ（ブンガクジョウ）　マンガ　エイガ　アニメーション　女性（文学上）　漫画　映画　アニメーション,図書費,ＴＲＣ,1500,図書室,,,,,False,,,,False,,,,False,False,False,,
9784-309029160,80136,2021/05/07,推し、燃ゆ,ｵｼ ﾓﾕ,,,,,宇佐見 りん 著,ｳｻﾐ ﾘﾝ,,913.6,ｳ,,河出書房新社,2020,125p,20cm,1400,20037679,ままならない人生を引きずり、祈るようにアイドル上野真幸を推すあかり。ある日、真幸がファンを殴って炎上し…。デビュー作「かか」が三島賞候補になった２１歳の第２作。『文藝』掲載を単行本化。,,図書費,白山商会,1386,図書室,,,,,False,,,,False,,,,False,False,True,,
9784-309029627,51634,2022/01/18,一度きりの大泉の話,ｲﾁﾄﾞｷﾘ ﾉ ｵｵｲｽﾞﾐ ﾉ ﾊﾅｼ,,,,,萩尾 望都 著,ﾊｷﾞｵ ﾓﾄ,,726.1,ハ,,河出書房新社,2021,350p,20cm,1800,21018749,約５０年前、漫画家・竹宮惠子や彼女のブレインと共同生活をしていた練馬区大泉。当時の“出会いと別れ”を、現在の心境もこめて書き下ろした７０年代回想録。未発表スケッチも多数収録。,ハギオ モト　萩尾望都,図書費,ＴＲＣ,1800,図書室,,,,,False,,,,False,,,,False,False,False,,
9784-309228136,51403,2021/06/22,その虐殺は皆で見なかったことにした　トルコ南東部ジズレ地下、黙認された惨劇,ｿﾉ ｷﾞｬｸｻﾂ ﾜ ﾐﾅ ﾃﾞ ﾐﾅｶｯﾀ ｺﾄ ﾆ ｼﾀ,,,,,舟越 美夏 著,ﾌﾅｺｼ ﾐｶ,,316.8,フ,,河出書房新社,2020,269p,19cm,2400,20050144,２０１６年、トルコでクルド人数百人が地下に閉じ込められたすえに虐殺されたが、国際社会はこれを黙認した－。絶望の叫び声を聞き取り、それを掻き消した構造、大国の思惑のなかで隠蔽された恐るべき残虐行為の真実に迫る。,クルドゾク　ミンゾクモンダイ トルコ　ジェノサイド　クルド族　民族問題 トルコ　ジェノサイド,図書費,ＴＲＣ,2400,図書室,,,,,False,,,,False,,,,False,False,False,,
9784-309417899,51405,2021/06/22,ハーメルンの笛吹きと完全犯罪,ﾊｰﾒﾙﾝ ﾉ ﾌｴﾌｷ ﾄ ｶﾝｾﾞﾝ ﾊﾝｻﾞｲ,,,河出文庫　に１４－１,ｶﾜﾃﾞﾌﾞﾝｺ ﾆ-14-1,仁木 悦子 著　角田 喜久雄 著　石川 喬司 著　鮎川 哲也 著　赤川 次郎 著　小泉 喜美子 著　結城 昌治 著　加田 伶太郎 著,ﾆｷ ｴﾂｺ ﾂﾉﾀﾞ ｷｸｵ ｲｼｶﾜ ﾀｶｼ ｱﾕｶﾜ ﾃﾂﾔ ｱｶｶﾞﾜ ｼﾞﾛｳ ｺｲｽﾞﾐ ｷﾐｺ ﾕｳｷ ｼｮｳｼﾞ ｶﾀﾞ ﾚｲﾀﾛｳ,,913.68,ハ,,河出書房新社,2021,263p,15cm,720,21001966,「白雪姫」「ハーメルンの笛吹き」「みにくいアヒルの子」など、誰もが知っている世界の童話をもとに、仁木悦子、赤川次郎、結城昌治らが紡いだミステリー短篇アンソロジー。昔ばなしの「怖さ」がにじみ出る全８篇を収録。,ショウセツ（ニホン） ショウセツシュウ　小説（日本） 小説集,図書費,ＴＲＣ,720,文庫書架,,,,,False,,,,False,,,,False,False,True,,
9784-309417905,51549,2021/07/08,カチカチ山殺人事件,ｶﾁｶﾁﾔﾏ ｻﾂｼﾞﾝ ｼﾞｹﾝ,,,河出文庫　と９－１,ｶﾜﾃﾞﾌﾞﾝｺ ﾄ-9-1,伴野 朗 著　都筑 道夫 著　戸川 昌子 著　高木 彬光 著　井沢 元彦 著　佐野 洋 著　斎藤 栄 著,ﾄﾓﾉ ﾛｳ ﾂｽﾞｷ ﾐﾁｵ ﾄｶﾞﾜ ﾏｻｺ ﾀｶｷﾞ ｱｷﾐﾂ ｲｻﾞﾜ ﾓﾄﾋｺ ｻﾉ ﾖｳ ｻｲﾄｳ ｻｶｴ,,913.68,カ,,河出書房新社,2021,259p,15cm,720,21001960,「カチカチ山」「猿かに合戦」「舌きり雀」など、誰もが知っている日本の昔ばなしをもとに、伴野朗、都筑道夫、戸川昌子らが紡いだミステリー短篇アンソロジー。昔ばなしの「怖さ」をあぶり出す全７篇を収録。,ショウセツ（ニホン） ショウセツシュウ　小説（日本） 小説集,図書費,ＴＲＣ,720,文庫書架,,,,,False,,,,False,,,,False,False,True,,
9784-309418506,51641,2022/01/18,日本迷信集,ﾆﾎﾝ ﾒｲｼﾝ ｼｭｳ,,,河出文庫　こ２７－１,ｶﾜﾃﾞﾌﾞﾝｺ ｺ-27-1,今野 圓輔 著,ｺﾝﾉ ｴﾝｽｹ,,387.9,コ,,河出書房新社,2021,259p,15cm,900,21040936,精霊送りに胡瓜が使われる理由、火の玉の正体、死を告げるカラスの謎…。俗信と呼ばれる分野に強い関心を持つ民俗学者が、前兆、占い、祈り、まじない、迷信療法など、現代まで続く日本の不可思議な習俗の真相に迫る。,メイシン　迷信,図書費,ＴＲＣ,900,文庫書架,,,,,False,,,,False,,,,False,False,False,,
9784-309467276,51404,2021/06/22,ニューヨーク・スケッチブック,ﾆｭｰﾖｰｸ ｽｹｯﾁﾌﾞｯｸ,,,河出文庫　ハ１－１,ｶﾜﾃﾞﾌﾞﾝｺ ﾊ-1-1,Ｐ．ハミル 著　高見 浩 訳,ﾊﾐﾙ ﾋﾟｰﾄ ﾀｶﾐ ﾋﾛｼ Pﾊﾐﾙ,,933.7,ハ,,河出書房新社,2021,279p,15cm,880,21001957,恋人との再会、友人との別れ、酒場のひととき…。ニューヨークで生きるごく普通の男女が織りなす日常の一瞬を、絶妙な語り口で浮き彫りにした三十幾通りの人生ドラマ。映画「幸せの黄色いハンカチ」の原作も収録。,,図書費,ＴＲＣ,880,文庫書架,,,,,False,,,,False,,,,False,False,False,,
9784-309467313,51550,2021/07/08,とんでもない死に方の科学,ﾄﾝﾃﾞﾓﾅｲ ｼﾆｶﾀ ﾉ ｶｶﾞｸ,,,河出文庫　キ５－１,ｶﾜﾃﾞﾌﾞﾝｺ ｷ-5-1,Ｃ．キャシディー 著　Ｐ．ドハティー 著　梶山 あゆみ 訳,ｷｬｼﾃﾞｨｰ ｺｰﾃﾞｨｰ ﾄﾞﾊｰﾃｨｰ P. ｶｼﾞﾔﾏ ｱﾕﾐ Cｷｬｼﾃﾞｨｰ Pﾄﾞﾊﾃｨｰ,,404,キ,,河出書房新社,2021,315p,15cm,890,21010603,旅客機に乗っていて窓が割れたら？　ハチの大群に襲われたら？　雷に打たれたら？　クジラに飲みこまれたら？　そのとき人はどう死ぬのか、４５の「死に方のシナリオ」を科学で読み解く、不謹慎で真面目な思考実験。,カガク　シボウゲンイン　科学　死亡原因,図書費,ＴＲＣ,890,文庫書架,,,,,False,,,,False,,,,False,False,False,,
9784-309467375,51640,2022/01/18,動物になって生きてみた,ﾄﾞｳﾌﾞﾂ ﾆ ﾅｯﾃ ｲｷﾃ ﾐﾀ,,,河出文庫　フ１９－１,ｶﾜﾃﾞﾌﾞﾝｺ ﾌ-19-1,Ｃ．フォスター 著　西田 美緒子 訳,ﾌｫｽﾀｰ ﾁｬｰﾙｽﾞ ﾆｼﾀﾞ ﾐｵｺ Cﾌｫｽﾀｰ,,481.7,フ,,河出書房新社,2022,349p,15cm,980,21036686,アナグマとなって森で眠り、アカシカとなって猟犬に追われ、カワウソとなって川にもぐり、キツネとなってゴミを漁る…。大自然のなかで野生動物として生きることにした男の、愉快で、エキセントリックで、感動的な体験記。,ドウブツセイタイガク　動物生態学,図書費,ＴＲＣ,980,文庫書架,,,,,False,,,,False,,,,False,False,False,,
9784-309467382,51841,2022/02/01,モーリタニアン黒塗りの記録,ﾓｰﾘﾀﾆｱﾝ ｸﾛﾇﾘ ﾉ ｷﾛｸ,,,河出文庫　ス５－１,ｶﾜﾃﾞﾌﾞﾝｺ ｽ-5-1,モハメドゥ・ウルド・スラヒ 著　ラリー・シームズ 編　中島 由華 訳,ｽﾗﾋ ﾓﾊﾒﾄﾞｩ･ｳﾙﾄﾞ ｼｰﾑｽﾞ ﾗﾘｰ ﾅｶｼﾞﾏ ﾕｶ ﾓﾊﾒﾄﾞｩｳﾙﾄﾞｽﾗﾋ ﾗﾘｰｼｰﾑｽﾞ,,936,ス,,河出書房新社,2022,560p,15cm,1420,21039189,テロ容疑者収容所として多くの人々が罪状不明のまま米国政府により収監されたグアンタナモ収容所。そこで１４年間にわたり拷問と虐待の日々を過ごした著者が国家犯罪の実態を明らかにする。２０２１年１０月公開映画の原作。,キョウセイシュウヨウジョ　テロリズム　強制収容所　テロリズム,図書費,ＴＲＣ,1420,文庫書架,,,,,False,,,,False,,,,False,False,False,,
9784-309467481,51639,2022/01/18,サンタクロースの贈物　クリスマス×ミステリーアンソロジー,ｻﾝﾀｸﾛｰｽ ﾉ ｵｸﾘﾓﾉ,,,河出文庫　し２９－１,ｶﾜﾃﾞﾌﾞﾝｺ ｼ-29-1,新保 博久 編,ｼﾝﾎﾟ ﾋﾛﾋｻ,,908.3,サ,,河出書房新社,2021,396p,15cm,990,21045578,クリスマスを舞台にした国内外の傑作ミステリーアンソロジー。ドイル「青いガーネット」、クイーン「クリスマスと人形」、星新一「クリスマス・イブの出来事」、筒井康隆「最後のクリスマス」など、全１３編を収録。,ショウセツ ショウセツシュウ　小説 小説集,図書費,ＴＲＣ,990,文庫書架,,,,,False,,,,False,,,,False,False,False,,
9784-309617367,51638,2022/01/18,「心」のお仕事　今日も誰かのそばに立つ２４人の物語,ｺｺﾛ ﾉ ｵｼｺﾞﾄ,,,１４歳の世渡り術,ｼﾞｭｳﾖﾝｻｲﾉﾖﾜﾀﾘｼﾞｭﾂ,河出書房新社 編　荒井 裕樹 ほか著,ｶﾜﾃﾞｼｮﾎﾞｳｼﾝｼｬ ｱﾗｲ ﾕｳｷ,,498.1,コ,,河出書房新社,2021,279p,19cm,1420,21043653,精神科医、カウンセラー、臨床心理士、ソーシャルワーカー、心の謎に迫る研究者…。目に見えない「心」を扱うことを仕事にしている２４人が、その面白さと苦労、道のりを語る。,ココロニカカワルシゴト　心にかかわる仕事　イシ　セイシンイガク　カウンセリング　医師　精神医学　カウンセリング,図書費,ＴＲＣ,1420,文庫書架,,,,,False,,,,False,,,,False,False,False,,
