9784-635823678,51977,2022/07/06,鉄道好きのための法律入門　ルールを守って鉄道を気持ちよく乗る・楽しむ,ﾃﾂﾄﾞｳ ｽﾞｷ ﾉ ﾀﾒ ﾉ ﾎｳﾘﾂ ﾆｭｳﾓﾝ,,,,,小島 好己 著,ｺｼﾞﾏ ﾖｼｷ,,686.1,コ,,山と溪谷社（発売）,2022,157p,19cm,1500,22011185,鉄道撮影には許可が必要？　ＩＣカード乗車券は誰のもの？　女性専用車両に異性が乗るのは？　鉄道に乗ったり、鉄道趣味を楽しむうえで知っておきたいルールや素朴な疑問を、法律に基づいてＱ＆Ａ形式で解説する。,テツドウ ホウレイ　鉄道 法令,図書費,ＴＲＣ,1500,図書室,,,,,False,,,,False,,,,False,False,False,,
9784-635823883,52194,2022/12/21,ハチのいない蜂飼い,ﾊﾁ ﾉ ｲﾅｲ ﾊﾁ ｶｲ,,,,,西村 玲子 著,ﾆｼﾑﾗ ﾚｲｺ,,646.9,ニ,,山と溪谷社（発売）,2023,127p,18cm,1800,22028483,小さないきものたちは、淡々と生きる姿を見せてくれる－。岐阜県郡上市で小さな洋菓子店を経営する著者が、ニホンミツバチとの暮らしや、それを取り巻く自然のお話を綴る。養老孟司との対談も収録。,ミツバチ　みつばち（蜜蜂）,図書費,ＴＲＣ,1800,図書室,,,,,False,,,,False,,,,False,False,False,,
9784-635823975,51978,2022/07/06,みのり菓子　旅するようにお菓子をつくる,ﾐﾉﾘ ｶﾞｼ,,,,,小林 優子 著,ｺﾊﾞﾔｼ ﾕｳｺ,,596.6,コ,,山と溪谷社（発売）,2022,159p,21cm,1700,22019453,お店を持たない京都の和菓子屋「みのり菓子」。スープで食べる苺大福、フレッシュ檸檬の最中、桃の雫など、ふと目に入るものにインスピレーションを得て作った毎月のお菓子の写真とともに、お菓子にまつわる話などを紹介する。,ワガシ　和菓子,図書費,ＴＲＣ,1700,図書室,,,,,False,,,,False,,,,False,False,False,,
9784-641174665,52075,2022/09/21,伴走型支援　新しい支援と社会のカタチ,ﾊﾞﾝｿｳ ｶﾞﾀ ｼｴﾝ,,,,,奥田 知志 編　原田 正樹 編,ｵｸﾀﾞ ﾄﾓｼ ﾊﾗﾀﾞ ﾏｻｷ,,369,バ,,有斐閣,2022,8 199p,22cm,2000,21035758,ひきこもり、８０５０問題、ゴミ屋敷、生活困窮、子どもの貧困…。深まる社会的孤立に、つながり続ける支援を！　伴走型支援の基本的な概念や課題、価値、可能性から、これからの支援のあり方、社会のあり方までを論じる。,シャカイフクシ　社会福祉,寄付,ＴＲＣ,2000,図書室,,,,,False,,,,False,,,,False,False,False,,
9784-642059268,80527,2022/05/09,沖縄戦の子どもたち,ｵｷﾅﾜｾﾝ ﾉ ｺﾄﾞﾓﾀﾁ,,,歴史文化ライブラリー　５２６,ﾚｷｼﾌﾞﾝｶﾗｲﾌﾞﾗﾘｰ 526,川満 彰 著,ｶﾜﾐﾂ ｱｷﾗ,,219.906,ｶ,,吉川弘文館,2021,7 230p,19cm,1700,21021659,少年兵・学徒隊への動員、学童疎開、集団自決、戦争孤児…。太平洋戦争末期の沖縄で、激しい戦禍に遭った少年少女たち。彼らの体験や視点を通し、二度と戦争を起こさないために何ができるのかを考える。,オキナワケン レキシ　タイヘイヨウセンソウ　ジドウ レキシ　沖縄県 歴史　太平洋戦争（１９４１～１９４５）　児童 歴史,図書費,白山商会,1683,図書室,,,,,False,,,,False,,,,False,False,True,,
9784-651201290,80621,2022/07/08,基本の日曜大工　決定版,ｷﾎﾝ ﾉ ﾆﾁﾖｳﾀﾞｲｸ,,,暮らしの実用シリーズ,ｸﾗｼﾉｼﾞﾂﾖｳｼﾘｰｽﾞ,,,,592.7,ｷ,,ワン・パブリッシング,2009,210p,24cm,1600,21141199,生活の中には、ＤＩＹで実現・解決できる「あったらいいな」や「困った」がいっぱい。木工ＤＩＹの家具作りから、ちょっとしたリフォーム・修繕まで、日曜大工の手順を写真で丁寧に解説します。,モッコウ　木工,図書費,白山商会,1584,図書室,,,,,False,,,,False,,,,False,False,True,,
9784-651202587,52247,2022/12/21,のせて焼くだけ。毎日のオーブンレシピ　肉も野菜もこんがりがおいしい,ﾉｾﾃ ﾔｸ ﾀﾞｹ ﾏｲﾆﾁ ﾉ ｵｰﾌﾞﾝ ﾚｼﾋﾟ,,,,,市瀬 悦子 著,ｲﾁｾ ｴﾂｺ,,596,イ,,ワン・パブリッシング,2022,95p,26cm,1450,22041837,下味をつけた材料を耐熱皿にのせて、オーブンで焼くだけ。肉や魚、野菜が主役の気軽なふだんのおかずから、人気のグラタンやドリア、おもてなしにぴったりのごちそうまで、バリエーション豊かなオーブン料理を紹介します。,リョウリ　料理,図書費,ＴＲＣ,1450,図書室,,,,,False,,,,False,,,,False,False,False,,
9784-750353166,51887,2022/07/06,五色のメビウス　「外国人」とともにはたらきともにいきる,ｲﾂﾂｲﾛ ﾉ ﾒﾋﾞｳｽ  ｺﾞｼｷ ﾉ ﾒﾋﾞｳｽ,,,,,信濃毎日新聞社 編,ｼﾅﾉﾏｲﾆﾁｼﾝﾌﾞﾝｼｬ,,366.8,イ,,明石書店,2022,388p,19cm,1800,22008362,外国人技能実習、特定技能、留学生、日系人労働者、外国人花嫁、非正規滞在、入管問題…。新型コロナウイルスの感染が拡大するなかでの外国人労働者問題に切り込んだ『信濃毎日新聞』の連載キャンペーンを書籍化。,ガイコクジンロウドウシャ　外国人労働者,図書費,ＴＲＣ,1800,図書室,,,,,False,,,,False,,,,False,False,False,,
9784-750517674,52080,2022/12/21,わたしは「ひとり新聞社」　岩手県大槌町で生き、考え、伝える,ﾜﾀｼ ﾜ ﾋﾄﾘ ｼﾝﾌﾞﾝｼｬ,,,,,菊池 由貴子 著,ｷｸﾁ ﾕｷｺ,,369.3,キ,,亜紀書房,2022,259p,19cm,1800,22037730,東日本大震災後、岩手県大槌町の町民に町の情報を知らせたいという思いからスタートした『大槌新聞』。二度の心停止と離婚の挫折を抱えた内気な著者が、震災を契機にひとりで小さな新聞を創刊し書き続けた１０年間の奮闘記。,キクチ ユキコ　菊池由貴子　ヒガシニホンダイシンサイ　サイガイフッコウ　オオツチチョウ（イワテケン）　ジャーナリズム　東日本大震災（２０１１）　災害復興　大槌町（岩手県）　ジャーナリズム,図書費,ＴＲＣ,1800,図書室,,,,,False,,,,False,,,,False,False,False,,
9784-751530030,80566,2022/06/08,ルース・ベイダー・ギンズバーグ,ﾙｰｽ ﾍﾞｲﾀﾞｰ ｷﾞﾝｽﾞﾊﾞｰｸﾞ,,,信念は社会を変えた！,ｼﾝﾈﾝﾜｼｬｶｲｵｶｴﾀ,ジェフ・ブラックウェル 編　ルース・ホブデイ 編　橋本 恵 訳,ﾌﾞﾗｯｸｳｪﾙ ｼﾞｪﾌ ﾎﾌﾞﾃﾞｲ ﾙｰｽ･ｱﾝﾅ ﾊｼﾓﾄ ﾒｸﾞﾐ ｼﾞｪﾌﾌﾞﾗｯｸｳｪﾙ ﾙｰｽﾎﾌﾞﾃﾞｲ,,289.3,ﾙ,,あすなろ書房,2020,85p,20cm,1000,20042678,その揺るがぬ信念を支えるものとは？　女性弁護士が全米にまだ３％しか存在しない時代に法曹界を志し、不屈の闘志で平等の実現に人生を捧げてきたルース・ベイダー・ギンズバーグのインタビューなどを収録する。,ギンズバーグ ルース・ベーダー,図書費,白山商会,990,図書室,,,,,False,,,,False,,,,False,False,True,,
9784-758414166,51909,2022/07/06,古本食堂,ﾌﾙﾎﾝ ｼｮｸﾄﾞｳ,,,,,原田 ひ香 著,ﾊﾗﾀﾞ ﾋｶ,,913.6,ハ,,角川春樹事務所,2022,290p,19cm,1600,22010364,本が好きだという想いは強いが、進路に悩む国文科の学生、美希喜。そんな時、大叔父の古書店を、彼の妹の珊瑚さんが継ぐことに。美希喜は珊瑚さんの手伝いをするようになり…。『ランティエ』連載を改題、加筆修正し単行本化。,,図書費,ＴＲＣ,1600,図書室,,,,,False,,,,False,,,,False,False,False,,
9784-758414227,52049,2022/09/21,金網の向こう　ぼくは米軍基地にある小学校に一年間通った,ｶﾅｱﾐ ﾉ ﾑｺｳ,,,,,向山 貴彦 文　たかしま てつを 絵,ﾑｺｳﾔﾏ ﾀｶﾋｺ ﾀｶｼﾏ ﾃﾂｵ,,913.6,ム,,角川春樹事務所,2023,95p,18cm,1300,22028182,転校先は米軍基地の中。同級生は、白人、黒人、黄色人種。そこでぼくが体験したのは－。作家・向山貴彦が残した原稿にイラストレーター・たかしまてつをが絵を加え、Ｔｗｉｔｔｅｒで連載した作品に描き下ろしを加えて書籍本。,,寄付,ＴＲＣ,1300,図書室,,,,,False,,,,False,,,,False,False,False,,
9784-758414289,80754,2022/11/18,新！店長がバカすぎて,ｼﾝ ﾃﾝﾁｮｳ ｶﾞ ﾊﾞｶ ｽｷﾞﾃ,,,,,早見 和真 著,ﾊﾔﾐ ｶｽﾞﾏｻ,,913.6,ﾊ,,角川春樹事務所,2022,321p,19cm,1600,22034235,山本猛元店長が、３年ぶりに吉祥寺本店に店長として復帰した。張り切る店長だが、相変わらず、人を苛立たせる天才だ。しかし京子は、心の中で「お帰りなさい」とつぶやき…。『ランティエ』連載を加筆し書籍化。,,図書費,白山商会,1584,図書室,,,,,False,,,,False,,,,False,False,True,,
9784-758439626,80794,2022/12/09,勇者たちへの伝言　いつの日か来た道,ﾕｳｼｬ ﾀﾁ ｴ ﾉ ﾃﾞﾝｺﾞﾝ,,,ハルキ文庫　ま１４－１,ﾊﾙｷﾌﾞﾝｺ ﾏ-14-1,増山 実 著,ﾏｽﾔﾏ ﾐﾉﾙ,,913.6,ﾏ,,角川春樹事務所,2015,354p,16cm,680,15058017,正秋は、小学生の頃、今は亡き父と初めてプロ野球観戦した日のことを思い出しつつ街を歩いていた。かつての西宮球場跡地に足を踏み入れた正秋の意識は、そこから４０数年前の「いつの日か来た道」へと飛び…。,,図書費,白山商会,673,文庫書架,,,,,False,,,,False,,,,False,False,True,,
9784-758442343,80777,2022/11/28,風よ僕らに海の歌を,ｶｾﾞ ﾖ ﾎﾞｸﾗ ﾆ ｳﾐ ﾉ ｳﾀ ｵ,,,ハルキ文庫　ま１４－３,ﾊﾙｷﾌﾞﾝｺ ﾏ-14-3,増山 実 著,ﾏｽﾔﾏ ﾐﾉﾙ,,913.6,ﾏ,,角川春樹事務所,2019,450p,16cm,780,19006367,第二次世界大戦時、イタリア海軍の特務艦が神戸沖にいた。乗組員の料理を担当していたジルベルトは、イタリアの降伏で祖国へ帰る道を絶たれる。ジルベルトと家族たちは、戦後まもない宝塚でイタリア料理店を始め…。,,図書費,白山商会,772,文庫書架,,,,,False,,,,False,,,,False,False,True,,
9784-758444842,52250,2023/01/10,救いの森,ｽｸｲ ﾉ ﾓﾘ,,,ハルキ文庫　こ１５－１,ﾊﾙｷﾌﾞﾝｺ ｺ-15-1,小林 由香 著,ｺﾊﾞﾔｼ ﾕｶ,,913.6,コ,,角川春樹事務所,2022,304p,16cm,720,22019479,子どもがいじめや虐待、誘拐など命の危険を感じた時に起動させると、児童救命士がかけつける「ライフバンド」。その検査のため、新米児童救命士の長谷川は小学校に出向くが、そこでわざと警告音を鳴らす少年と出会い…。,,図書費,ＴＲＣ,720,文庫書架,,,,,False,,,,False,,,,False,False,False,,
9784-759261233,80544,2022/05/09,アルビノの話をしよう,ｱﾙﾋﾞﾉ ﾉ ﾊﾅｼ ｵ ｼﾖｳ,,,,,石井 更幸 編著,ｲｼｲ ﾉﾌﾞﾕｷ,,493.12,ｲ,,解放出版社,2017,94p,21cm,1300,17031902,全身のメラニン色素が生まれつきまったく、または不十分にしかつくれない体質をもつアルビノの人が暮らすうえでの困難や支援について、当事者と親が体験を綴る。医師などの立場からの、具体的なサポート情報も収録。,センテンセイハクヒショウ　先天性白皮症,図書費,白山商会,1287,図書室,,,,,False,,,,False,,,,False,False,True,,
9784-759816907,51897,2022/07/06,ゾウが教えてくれたこと　ゾウオロジーのすすめ,ｿﾞｳ ｶﾞ ｵｼｴﾃｸﾚﾀ ｺﾄ,,,ＤＯＪＩＮ選書　０９２,ﾄﾞｳｼﾞﾝｾﾝｼｮ 92,入江 尚子 著,ｲﾘｴ ﾅｵｺ,,489.7,イ,,化学同人,2021,185p,19cm,1500,21053240,地上最大の哺乳類、ゾウ。その進化の過程や体のつくり、野生での暮らしぶり、知能など、知っているようで知らないゾウの魅力を、ゾウ愛にあふれる著者があたたかな筆致で語り尽くす。,ゾウ　ぞう（象）,図書費,ＴＲＣ,1500,図書室,,,,,False,,,,False,,,,False,False,False,,
9784-760154685,52044,2022/09/21,ＳＤＧｓとトイレ　地球にやさしく、誰もが使えるために,ｴｽﾃﾞｨｰｼﾞｰｽﾞ ﾄ ﾄｲﾚ,,,進化するトイレ,ｼﾝｶｽﾙﾄｲﾚ,日本トイレ協会 編,ﾆﾎﾝﾄｲﾚｷｮｳｶｲ,,518.5,エ,,柏書房,2023,257p,19cm,3000,22033193,安全で衛生的なトイレを利用できない人は世界中に約２０億人。トイレから世界を眺めてみたら、ＳＤＧｓがぐっと身近になってきた！　水を使わないドライトイレや雨水の活用など、これからのトイレの進むべき未来を考える。,ベンジョ　ジゾクカノウナカイハツ　便所　持続可能な開発,寄付,ＴＲＣ,3000,図書室,,,,,False,,,,False,,,,False,False,False,,
9784-761275990,52050,2022/09/21,１３歳までに伝えたい男の子の心と体のこと　マンガでよくわかる！,ｼﾞｭｳｻﾝｻｲ ﾏﾃﾞ ﾆ ﾂﾀｴﾀｲ ｵﾄｺﾉｺ ﾉ ｺｺﾛ ﾄ ｶﾗﾀﾞ ﾉ ｺﾄ,,,,,やまがた てるえ 著　藤井 昌子 マンガ,ﾔﾏｶﾞﾀ ﾃﾙｴ ﾌｼﾞｲ ﾏｻｺ,,367.9,ヤ,,かんき出版,2022,221p,21cm,1450,22011763,自分も相手も大切にできる大人になろう！　心と体の変化から、思春期や性のことまで、男の子が豊かに育つために必要なことをマンガやＱ＆Ａを交えてやさしく解説する。書き込み式ワークあり。,シシュンキ　セイ　オトコノコノカラダ　ケ　ニオイ　ニキビ　セイショクキ　オンナノコノカラダ　セイテキマイノリティ　ジェンダー　インターネット　レンアイ　コミュニケーション　ニンシン　ヒニン　セクシャルハラスメント　ジンケン　ジゾクカノウナカイハツ　思春期　性　男の子のからだ　毛　におい　にきび　生殖器　女の子のからだ　性的マイノリティ　ジェンダー　インターネット　恋愛　コミュニケーション　妊娠　避妊　セクシャルハラスメント　人権　持続可能な開発　セイ　性,寄付,ＴＲＣ,1450,図書室,,,,,False,,,,False,,,,False,False,False,,
9784-761276317,52124,2022/12/21,東大の先生！文系の私に超わかりやすく物理を教えてください！,ﾄｳﾀﾞｲ ﾉ ｾﾝｾｲ ﾌﾞﾝｹｲ ﾉ ﾜﾀｼ ﾆ ﾁｮｳ ﾜｶﾘﾔｽｸ ﾌﾞﾂﾘ ｵ ｵｼｴﾃ ｸﾀﾞｻｲ  ﾄｳﾀﾞｲ ﾉ ｾﾝｾｲ ﾌﾞﾝｹｲ ﾉ ﾜﾀｸｼ ﾆ ﾁｮｳ ﾜｶﾘﾔｽｸ ﾌﾞﾂﾘ ｵ ｵｼｴﾃ ｸﾀﾞｻｲ,,,,,西成 活裕 著　郷 和貴 聞き手,ﾆｼﾅﾘ ｶﾂﾋﾛ ｺﾞｳ ｶｽﾞｷ,,420,ニ,,かんき出版,2022,287p,21cm,1600,22038504,なぜエアコンは室温を変えられるのか。なぜギターはいろんな音を奏でられるのか。ラジオが聞こえる仕組みとは－。物理の基礎を、日常生活に関連づけて、会話形式でわかりやすく解説する。,ブツリガク　物理学,図書費,ＴＲＣ,1600,図書室,,,,,False,,,,False,,,,False,False,False,,
9784-761513795,52103,2022/12/21,今昔地図でたどる京都大路散歩,ｺﾝｼﾞｬｸ ﾁｽﾞ ﾃﾞ ﾀﾄﾞﾙ ｷｮｳﾄ ｵｵｼﾞ ｻﾝﾎﾟ,,,,,原島 広至 著,ﾊﾗｼﾏ ﾋﾛｼ,,291.6,ハ,,学芸出版社,2022,159p,19cm,1800,22039933,ここでどんな人が住み、どんな事件が起きたのか。平安時代の道と現在の京都の道路との位置関係を、１８００分の１スケールの地図で表示。歴史と現代がリンクするよう、写真・彩色絵はがき・古絵図とともにガイドする。,キョウトシ キコウアンナイキ　キョウトシ レキシ　京都市 紀行・案内記　京都市 歴史,図書費,ＴＲＣ,1800,図書室,,,,,False,,,,False,,,,False,False,False,,
9784-766136609,52127,2022/12/21,アップサイクル・ノート　今ある布を大切に使いまわす,ｱｯﾌﾟ ｻｲｸﾙ ﾉｰﾄ,,,,,グラフィック社編集部 編,ｸﾞﾗﾌｨｯｸｼｬ ｸﾞﾗﾌｨｯｸｼｬﾍﾝｼｭｳﾌﾞ,,593.3,ア,,グラフィック社,2023,119p,26cm,1600,22034733,使わなくなった布や捨てる洋服をよりすてきなものに生まれ変わらせる方法を提案。素材の形は変えずそこに新しくプラスする方法と、素材を材料として使い新しいものを作る方法、あわせて３２のアイデアを紹介します。,ヨウサイ　シュゲイ　洋裁　手芸,図書費,ＴＲＣ,1600,図書室,,,,,False,,,,False,,,,False,False,False,,
9784-766137163,52128,2022/12/21,切手デザイナーの仕事　日本郵便切手・葉書室より,ｷｯﾃ ﾃﾞｻﾞｲﾅｰ ﾉ ｼｺﾞﾄ,,,,,間部 香代 著,ﾏﾍﾞ ｶﾖ,,693.8,マ,,グラフィック社,2022,187p,21cm,1800,22038939,日本の切手をつくる８人のデザイナー。８人の個性は異なり、デザインのスタイルもそれぞれ違う。８人８様の想いと仕事を紹介する。切手制作の流れなどを説明したコラムも掲載。,ユウビンキッテ　郵便切手,図書費,ＴＲＣ,1800,図書室,,,,,False,,,,False,,,,False,False,False,,
9784-767829821,51893,2022/07/06,歩いて、食べる京都のおいしい名建築さんぽ　京都名建築ガイド,ｱﾙｲﾃ ﾀﾍﾞﾙ ｷｮｳﾄ ﾉ ｵｲｼｲ ﾒｲ ｹﾝﾁｸ ｻﾝﾎﾟ,,,,,甲斐 みのり 著,ｶｲ ﾐﾉﾘ,,523.1,カ,,エクスナレッジ,2022,215p,19cm,1600,22013265,贅を凝らした豪商の別邸建築、明治の煙草王が築いた京都の迎賓館、銀行としてにぎわった格調高い空間…。名建築の趣とともに、おいしい食事・お茶・持ち帰りを味わえる、京都の建物を紹介します。データ：２０２２年３月現在。,ケンチク ニホン　キョウトシ キコウアンナイキ　建築 日本　京都市 紀行・案内記,図書費,ＴＲＣ,1600,図書室,,,,,False,,,,False,,,,False,False,False,,
9784-767830131,52095,2022/12/21,医師が教えるゆる漢方　身近な食材をくすりに変える,ｲｼ ｶﾞ ｵｼｴﾙ ﾕﾙ ｶﾝﾎﾟｳ,,,,,板倉 弘重 監修,ｲﾀｸﾗ ﾋﾛｼｹﾞ,,498.5,イ,,エクスナレッジ,2023,159p,21cm,1600,22028152,食事は不調に効く薬であり、続けることで健康維持につながる庶民の漢方。身近な食材を使った不調に効く食の知恵や、女性にうれしい美容の知恵、こころの不調を改善する知恵を厳選して紹介する。,ショクセイカツ　ケンコウホウ　食生活　健康法,図書費,ＴＲＣ,1600,図書室,,,,,False,,,,False,,,,False,False,False,,
9784-767830636,52096,2022/12/21,ドイツの家と町並み図鑑,ﾄﾞｲﾂ ﾉ ｲｴ ﾄ ﾏﾁﾅﾐ ｽﾞｶﾝ,,,,,久保田 由希 著　チカ・キーツマン 著,ｸﾎﾞﾀ ﾕｷ ｷｰﾂﾏﾝ ﾁｶ ﾁｶｷｰﾂﾏﾝ,,523.3,ク,,エクスナレッジ,2022,181p,21cm,1800,22042514,中世の木組みの家、茅葺き屋根の古民家、世界遺産のモダニズム建築の団地…。ドイツ在住の２人が、まだまだ日本人には知られていない、個性豊かなドイツ各地の「普通の家」を独自の視点で紹介する。,ケンチク ドイツ　ジュウタクケンチク　建築 ドイツ　住宅建築,図書費,ＴＲＣ,1800,図書室,,,,,False,,,,False,,,,False,False,False,,
9784-768459133,51920,2022/07/06,千代田区一番一号のラビリンス,ﾁﾖﾀﾞｸ ｲﾁﾊﾞﾝ ｲﾁｺﾞｳ ﾉ ﾗﾋﾞﾘﾝｽ,,,,,森 達也 著,ﾓﾘ ﾀﾂﾔ,,913.6,モ,,現代書館,2022,382p,20cm,2200,22011760,天皇の生の言葉を引き出したいという熱情に突き動かされたドキュメンタリストが、象徴天皇制の本質に迫る番組企画を立ち上げる。そして、ついに企画実現の突破口を探り出し…。皇室を巡るタブーに一石を投じる問題小説。,,図書費,ＴＲＣ,2200,図書室,,,,,False,,,,False,,,1,False,False,False,,
9784-768459171,51919,2022/07/06,岐路に立つ「動物園大国」　動物たちにとっての「幸せ」とは？,ｷﾛ ﾆ ﾀﾂ ﾄﾞｳﾌﾞﾂｴﾝ ﾀｲｺｸ,,,,,太田 匡彦 著　北上田 剛 著　鈴木 彩子 著,ｵｵﾀ ﾏｻﾋｺ ｷﾀｳｴﾀﾞ ｺﾞｳ ｽｽﾞｷ ｱﾔｺ,,480.7,キ,,現代書館,2022,205p,19cm,1800,22010787,ライオンはネコより安い？　北海道から鹿児島まで、全国の動物園を取材し「余剰動物」たちの現実をあぶり出し、日本の動物園で何が起きているのかを浮き彫りにする。『朝日新聞』連載等を単行本化。テキストデータ請求券付き。,ドウブツエン　動物園,図書費,ＴＲＣ,1800,図書室,,,,,False,,,,False,,,,False,False,False,,
9784-769916857,52136,2022/12/21,つくると食べるをつなぐサイエンス　最先端の生物生産学図鑑,ﾂｸﾙ ﾄ ﾀﾍﾞﾙ ｵ ﾂﾅｸﾞ ｻｲｴﾝｽ,,,,,三本木 至宏 監修,ｻﾝﾎﾞﾝｷﾞ ﾖｼﾋﾛ,,610.1,ツ,,恒星社厚生閣,2022,129p,26cm,1800,22043098,広島大学生物生産学部の若手教員たちが、これからの将来を担う中高生に向けて、生物生産学研究の面白さを多くの図や写真とともに解説。鳥類・哺乳類・農業と昆虫・海洋・食品と微生物のサイエンスを取り上げる。,ノウガク　チクサンガク　スイサンガク　農学　畜産学　水産学,図書費,ＴＲＣ,1800,図書室,,,,,False,,,,False,,,,False,False,False,,
9784-771036079,51931,2022/07/06,誰も加害者を裁けない　京都・亀岡集団登校事故の遺族の１０年,ﾀﾞﾚ ﾓ ｶｶﾞｲｼｬ ｵ ｻﾊﾞｹﾅｲ,,,,,広瀬 一隆 著,ﾋﾛｾ ｶｽﾞﾀｶ,,681.3,ヒ,,晃洋書房,2022,157p,19cm,1400,22012572,２０１２年４月、京都府亀岡市で無免許の少年の運転する車が児童らに突っ込み、３人が死亡した。遺族は法改正のための署名活動などに取り組む中、「被害」と「加害」の糸のもつれに直面する。地元紙記者が遺族の心の奥に迫る。,コウツウジコ　交通事故,図書費,ＴＲＣ,1400,図書室,,,,,False,,,,False,,,,False,False,False,,
9784-772614795,52053,2022/09/21,１０代の妊娠　友だちもネットも教えてくれない性と妊娠のリアル,ｼﾞｭｳﾀﾞｲ ﾉ ﾆﾝｼﾝ,,,,,にじいろ 著　高橋 幸子 監修,ﾆｼﾞｲﾛ ﾀｶﾊｼ ｻﾁｺ,,367.9,ニ,,合同出版,2021,151p,21cm,1400,21052326,妊娠したかも…どうしたらいいの？　ピルって体に悪いの？　中絶って自分でできないの？　出産したら学校はやめなきゃいけないの？　１０代の子どものリアルな性の悩みに答えるため、性の知識・情報をまとめる。,セイ　ニンシン　シュッサン　性　妊娠　出産,寄付,ＴＲＣ,1400,図書室,,,,,False,,,,False,,,,False,False,False,,
9784-772614900,52054,2022/09/21,ぼくはロヒンギャ難民。　差別され、迫害され、故郷を追われた人びと,ﾎﾞｸ ﾜ ﾛﾋﾝｷﾞｬ ﾅﾝﾐﾝ,,,,,小峯 茂嗣 著,ｺﾐﾈ ｼｹﾞﾂｸﾞ,,369.3,コ,,合同出版,2022,166p,21cm,1400,22007917,ミャンマー軍の迫害から逃れて、隣国に避難しなければならなくなったロヒンギャの人びと。バングラデシュにある難民キャンプを訪れ、彼らから直接話を聞き、さまざまな背景や思い、難民問題解決に向けた提言などを紹介する。,ナンミン　ロヒンギャゾク　難民　ロヒンギャ族,寄付,ＴＲＣ,1400,図書室,,,,,False,,,,False,,,,False,False,False,,
9784-772614924,51928,2022/07/06,いのちのバトンをつなぎたい　世界の子どもの３人に１人は栄養不良,ｲﾉﾁ ﾉ ﾊﾞﾄﾝ ｵ ﾂﾅｷﾞﾀｲ,,,,,ワールド・ビジョン・ジャパン 編著,ﾜｰﾙﾄﾞﾋﾞｼﾞｮﾝｼﾞｬﾊﾟﾝ,,611.3,イ,,合同出版,2022,165p,22cm,1600,22014950,すべての子どもに「豊かないのち」を－。世界中で子どもたちの栄養不良の改善などに取り組むワールド・ビジョン・ジャパンの活動を通して、どうやったら世界の栄養問題を乗り越えられるかを考察する。,ショクリョウモンダイ　エイヨウ　ハッテントジョウコク　食糧問題　栄養　発展途上国,図書費,ＴＲＣ,1600,図書室,,,,,False,,,,False,,,,False,False,False,,
